article,pub_date,nltk_score,source,nltk_score_title
Obama Says We Need to Fix Voting Lines. But How?,2013/02/12,0.6196,ProPublica,0.0
"Audit: Blacks, Latinos Still Likely to Face Housing Bias in Whitest Parts of Westchester",2013/02/12,0.9336,ProPublica,-0.1027
What Obama Probably Won’t Mention (But Should) in His State of the Union,2013/02/12,-0.4404,ProPublica,0.0
IRS Wins Big Tax Ruling against Bank of New York Mellon,2013/02/12,0.9936,ProPublica,0.5719
Disparate Impact and Fair Housing: Seven Cases You Should Know,2013/02/12,0.9974,ProPublica,0.3182
