article,pub_date,nltk_score,source,nltk_score_title
Confirma Evo Morales que intentaron asesinarlo,2008-12-24,0.91,Jornada,0.0
Lula y Sarkozy firman histórico tratado de cooperación militar,2008-12-24,0.7845,Jornada,0.0
"Unos 6 mil niños, reclutados por fuerzas rebeldes y del gobierno de Sudán: Unicef",2008-12-24,-0.8126,Jornada,-0.1531
Vuelve a Rusia flotilla de la marina que visitó Cuba,2008-12-24,-0.9517,Jornada,0.0
Muere sacerdote que apoyó a pobres en Perú,2008-12-24,0.0,Jornada,-0.2023
Francotirador mata a dos personas en Texas,2008-12-24,0.0,Jornada,-0.5423
Fracasa prueba de misil atómico ruso,2008-12-24,0.0,Jornada,-0.5106
Grecia: jóvenes reanudan las manifestaciones,2008-12-24,-0.8625,Jornada,0.0
"Unas 36 mil personas duermen en albergues de Nueva York, la cifra más alta jamás reportada",2008-12-24,-0.9744,Jornada,0.0
"Intento de golpe militar tras la muerte de Lansana Conté, el “hombre fuerte” de Guinea",2008-12-24,-0.9666,Jornada,-0.1531
Advertencia a militares ecuatorianos,2008-12-24,0.1027,Jornada,-0.34
Dimite presidente del Parlamento de Irak; apoyó al periodista que agredió a Bush,2008-12-24,-0.4588,Jornada,-0.4767
Se creará una comisión para recibir a los seis rehenes de las FARC: Piedad Córdoba,2008-12-24,0.6124,Jornada,0.25
Combates en Pakistán,2008-12-24,0.0,Jornada,-0.34
"Saqueo cultural, secuela de la invasión estadunidense en Irak",2008-12-24,-0.9403,Jornada,0.0
Suspende el INAH las obras del Resplandor teotihuacano,2008-12-24,0.5106,Jornada,0.0
"Estoy harto de la falta de cultura, del “no arte”: Pedro Friedeberg",2008-12-24,-0.9826,Jornada,-0.6808
Se contrajo 0.5% la economía de EU,2008-12-24,-0.6124,Jornada,0.0
Ganó la BMV 0.52%; el Dow Jones perdió 1.18,2008-12-24,-0.296,Jornada,-0.3182
Nueva caída en precios del crudo en NY y Londres; el mercado no cree en la OPEP,2008-12-24,-0.7717,Jornada,0.0
Se desacelera flujo de turistas a México: Cepal,2008-12-24,-0.128,Jornada,0.0
El gobierno de EU inyectará recurso a CIT Group y American Express,2008-12-24,0.1027,Jornada,0.0
Advierte FMI sobre otra gran depresión,2008-12-24,-0.8807,Jornada,-0.6249
Crisis de automotrices pone en riesgo la economía del sureste de Coahuila,2008-12-24,-0.4215,Jornada,-0.7351
Se suicida en Nueva York financiero francés víctima del fraude de Madoff,2008-12-24,-0.9831,Jornada,-0.886
"Llegó a 6.56% la iflación anual, la más alta en los pasados 7 años",2008-12-24,0.4404,Jornada,0.1027
Cayó 16.2% el ingreso de divisas por exportación de productos mexicanos,2008-12-24,-0.34,Jornada,0.0
Doce países encabezados por Rusia crearán una “OPEP del gas”,2008-12-24,-0.4019,Jornada,0.2732
Confía ASSA en resolver diferendo con Mexicana,2008-12-24,0.296,Jornada,0.4767
Crecen 33% accidentes relacionados con el alcohol,2008-12-24,-0.9887,Jornada,-0.3182
Rediseño laboral buscará crear “empleados universales” en Telmex,2008-12-24,0.2732,Jornada,0.2732
Inhabilitan en España a juez homófobo,2008-12-24,-0.1027,Jornada,0.0
Esperan para hoy 15 por ciento más afluencia de viajeros en el AICM,2008-12-24,0.9231,Jornada,0.0
Desatan polémica las declaraciones de Benedicto XVI sobre la homosexualidad,2008-12-24,-0.8316,Jornada,0.0
ONG exigen medidas cautelares para proteger la vida de ecologista guerrerense,2008-12-24,-0.7845,Jornada,0.2732
Conacyt: disminuirá 60% número de becas para posgrados en el extranjero,2008-12-24,-0.7906,Jornada,0.0
Crece 105% inversión privada en educación universitaria en 5 años,2008-12-24,-0.3612,Jornada,0.0
Los dinosaurios machos cuidaban a las crías e incubaban los huevos,2008-12-24,0.7506,Jornada,0.4215
Diputados sospechan que las empresas perforadoras desvían crudo en Chicontepec,2008-12-24,0.9769,Jornada,-0.7096
Pemex revela que ha entregado a Romero Deschamps al menos mil 273 millones de pesos,2008-12-24,-0.5423,Jornada,0.0
"Reabren pesquisas por los hechos en Chabajeval y Tres Cruces, Chiapas",2008-12-24,0.6908,Jornada,0.0
Mentores exigen pago en Michoacán y Morelos,2008-12-24,-0.9136,Jornada,-0.128
Aplaude AN el blindaje para 2009,2008-12-24,-0.6597,Jornada,0.34
Aprehenden a Nuestra Belleza Sinaloa con 7 narcos de Juárez,2008-12-24,0.9953,Jornada,0.0
Declaran en la SIEDO siete involucrados,2008-12-24,-0.743,Jornada,0.0
El Estado no puede responder al narco con exceso de fuerza innecesario: militar diputado,2008-12-24,-0.9867,Jornada,0.0
Encinas: PRD pagó favor a Calderón,2008-12-24,-0.4404,Jornada,0.4019
Senadores respaldan que el Estado responda con toda energía al asesinato de 8 militares,2008-12-24,-0.9633,Jornada,-0.2263
Desmantelan en EU banda ligada a cártel,2008-12-24,0.0,Jornada,0.0
"Rescatados, 3 mil migrantes en el año: INM",2008-12-24,-0.6124,Jornada,0.4215
"Congelado, el proceso contra Sandra Ávila",2008-12-24,-0.7845,Jornada,0.0
Agentes de Chiapas encuentran ocho ejecutados en la frontera con Guatemala,2008-12-24,-0.5423,Jornada,0.0
Critica Sedena “ironía y expresiones maliciosas” al informar de ejecuciones,2008-12-24,0.7096,Jornada,-0.3818
Reprueba Núñez que el IFE archive quejas contra quienes se promovieron con el erario,2008-12-24,-0.2732,Jornada,0.2263
La Operación Limpieza cumple seis meses sin lograr sentencia alguna,2008-12-24,-0.9485,Jornada,-0.0572
"Las decapitaciones, mensaje directo para el Presidente, afirma Soberanes",2008-12-24,-0.9884,Jornada,0.0
Liderazgos diversos guiarán la designación de candidatos del PRD,2008-12-24,0.5719,Jornada,0.0
Cabildeos por la refinería,2008-12-24,-0.2732,Jornada,0.0258
Busca el IFE fiscalizar los recursos de partidos antes del inicio de campañas,2008-12-24,0.9925,Jornada,0.4019
Un muerto por el frío en Tamaulipas,2008-12-24,0.34,Jornada,-0.6486
Anuncian escasez de agua en el Edomex,2008-12-24,-0.5267,Jornada,-0.25
Morelos: ofrecerá el PRD despensas baratas,2008-12-24,0.4215,Jornada,0.0
Iniciarán juicio político contra edil potosino,2008-12-24,0.3612,Jornada,0.0
El Barzón del Sur pide apoyar a deudores,2008-12-24,0.1027,Jornada,0.4019
Decepciona pista de hielo en SLP,2008-12-24,-0.296,Jornada,-0.3818
NL: González Parás planea revivir plan vial,2008-12-24,0.4939,Jornada,0.34
"QR, entre los 5 estados más inseguros del país: Coparmex",2008-12-24,-0.9633,Jornada,-0.4754
Desoye el gobierno de Jalisco alertas sobre contaminación del río Santiago,2008-12-24,-0.9771,Jornada,-0.1027
Busca Benjamín Clariond volver a gobernar NL,2008-12-24,-0.296,Jornada,0.2023
Precandidato del PRI en Colima niega vínculo con el narcotráfico,2008-12-24,-0.7579,Jornada,-0.4215
Uso electoral de fondos al agro en Guanajuato,2008-12-24,0.0,Jornada,0.0
"Arrestan a El Callejas, implicado en al menos 2 secuestros en Colima",2008-12-24,0.34,Jornada,-0.4767
