article,pub_date,nltk_score,source,nltk_score_title
La Jornada: No reasons for alarm for influenza A,2012-01-15,-0.9382,Jornada,-0.5574
La Jornada: Experts for SEP ask a humanist who knows the education system in depth,2012-01-15,-0.5106,Jornada,0.0
La Jornada: University guilds will participate in the workers' mobilization on January 31,2012-01-15,-0.4019,Jornada,0.0
"La Jornada: Social programs, palliatives that do not reduce poverty: NGOs",2012-01-15,-0.9231,Jornada,0.4023
La Jornada: Private companies to evaluate applications for sanitary registration of medicines,2012-01-15,0.1531,Jornada,0.0
La Jornada: Decommissioned the Cofepris more than 27 thousand liters of alcoholic beverages,2012-01-15,-0.2732,Jornada,0.0
La Jornada: Airport cleaning workers report abuse,2012-01-15,-0.296,Jornada,-0.6369
The Day: Iran claims to have evidence that the CIA was behind the assassination of the nuclear scientist,2012-01-15,-0.9501,Jornada,-0.5994
La Jornada: Eight Pakistani killed during rebel attack on police headquarters,2012-01-15,-0.4767,Jornada,-0.8481
La Jornada: One of the founders of ETA dies,2012-01-15,-0.5574,Jornada,0.0
La Jornada: Stranded cruise on island of Italy; Three dead,2012-01-15,-0.6486,Jornada,-0.6486
La Jornada: Retired General Otto Pérez Molina assumes the presidency of Guatemala,2012-01-15,-0.765,Jornada,0.0
La Jornada: Calderón breaks protocol,2012-01-15,0.34,Jornada,0.0
La Jornada: Thousands Celebrate in Tunisia the First Year of the Revolution of Dignity,2012-01-15,-0.1027,Jornada,0.7506
"La Jornada: Suicide bombing in Iraq leaves at least 53 dead, including several children and women",2012-01-15,-0.9118,Jornada,-0.8689
"La Jornada: A world without atomic energy, demand in Japan",2012-01-15,-0.0516,Jornada,-0.1139
La Jornada: Agent of the Argentine dictatorship would have bribed Interpol to prevent his arrest and extradition to Argentina,2012-01-15,-0.4215,Jornada,-0.3182
La Jornada: Starting in Venezuela a program that aims to create 3 million jobs,2012-01-15,-0.4939,Jornada,0.2732
La Jornada: Marine detains 4 suspected plagiarists,2012-01-15,0.0,Jornada,-0.2263
"La Jornada: Fed up with abuse and threats, Oaxacan comuneros seek to annul contracts with Demex",2012-01-15,-0.6597,Jornada,-0.7906
La Jornada: Child abuse in rural areas,2012-01-15,-0.4019,Jornada,-0.6369
La Jornada: Students protest against war on organized crime,2012-01-15,-0.7506,Jornada,-0.8555
"La Jornada: It would be advisable to govern with a majority in the Congress, expresses AMLO in Chiapas",2012-01-15,-0.7184,Jornada,0.0
La Jornada: Two suspected kidnappers killed during military shootings in Nayarit,2012-01-15,-0.6597,Jornada,-0.7506
"La Jornada: The union alliance and Peña Nieto, to privatize Pemex",2012-01-15,-0.6808,Jornada,0.0
La Jornada: Huge official effort to keep gas prices low: Calderón,2012-01-15,-0.25,Jornada,0.0516
La Jornada: Apprehens to 11 in clandestine take,2012-01-15,0.34,Jornada,0.0
La Jornada: Outraged people shout Criminal dad! At the Vatican,2012-01-15,-0.296,Jornada,-0.8016
La Jornada: Rectors demand resources to guarantee university security,2012-01-15,-0.6486,Jornada,0.4404
La Jornada: Senators of PRI want explanation of secretaries on operative White weapon,2012-01-15,-0.0772,Jornada,-0.2263
La Jornada: Rivera: The Pope's visit will light our way,2012-01-15,-0.4939,Jornada,0.0
"La Jornada: SFP: the law, lax in cases of corruption",2012-01-15,-0.7003,Jornada,0.0
"La Jornada: This Tuesday, the first debate between the aspirants of the PAN",2012-01-15,0.4404,Jornada,0.0
La Jornada: PRD will ask the IFE for support for debates between candidates,2012-01-15,0.6597,Jornada,0.4019
"La Jornada: The Beast, a trap for hundreds of Central American undocumented immigrants",2012-01-15,-0.891,Jornada,-0.3182
La Jornada: Pre-candidates of the blanquiazul make a proselytizing tour of the country,2012-01-15,0.1779,Jornada,0.0
"La Jornada: Without an answer, indigenous people who denounce plundering and plagiarism of a girl raise a stake",2012-01-15,0.296,Jornada,-0.34
La Jornada: Experts criticize Interior project on the regulation of the Migration Law,2012-01-15,-0.5859,Jornada,-0.3818
La Jornada: Mexican Protest against reform of Article 24,2012-01-15,-0.8126,Jornada,-0.25
"The Day: Indignados prepare to take Treasury; They steal us, they say",2012-01-15,-0.5267,Jornada,-0.34
La Jornada: Migrants do not have much to celebrate: CEM,2012-01-15,0.4019,Jornada,0.5719
"The Journey: Overpopulation in prisons, problem to be solved, says expert",2012-01-15,0.4215,Jornada,-0.1531
La Jornada: End of the deadline to change the voter's credential,2012-01-15,-0.4939,Jornada,0.0
"La Jornada: Joaquín El Chapo Guzmán: 11 years at large, rich and strong",2012-01-15,0.7906,Jornada,0.7845
"La Jornada: With deceptions and without a translator, Indians sign leonine contracts",2012-01-15,-0.8807,Jornada,0.0
La Jornada: Military arrests 8 suspected Aztecs,2012-01-15,0.0,Jornada,-0.5859
La Jornada: Yes I think he's going to change things: indigenous Zoque on Lopez Obrador,2012-01-15,-0.5719,Jornada,0.4019
La Jornada: Narro: UNAM is not a public square in elections,2012-01-15,-0.4019,Jornada,0.0
"La Jornada: Pemex Terminal to strengthen jobs and trade in Chiapas, says Calderón",2012-01-15,-0.128,Jornada,0.3182
La Jornada: Contradictory versions of the Navy about the missing,2012-01-15,0.3553,Jornada,-0.5574
La Jornada: March in Juárez for missing,2012-01-15,-0.25,Jornada,-0.296
La Jornada: US Officials Visit PF Facilities,2012-01-15,0.25,Jornada,0.0
La Jornada: Gasca Neri advised to rebuild the relationship with Spain's Repsol,2012-01-15,0.7351,Jornada,0.0
"La Jornada: Agencies, without limits in financial markets",2012-01-15,0.25,Jornada,0.0
La Jornada: Pilots of Iberia will suspend work,2012-01-15,-0.296,Jornada,-0.3182
La Jornada: One month delay the cleaning of Coatzacoalcos,2012-01-15,-0.8658,Jornada,-0.3182
La Jornada: Will distort regular market the word agave: Cofemer,2012-01-15,-0.5267,Jornada,-0.3182
La Jornada: Areas of attention of the CFE do not achieve average efficiency standards: S & P,2012-01-15,-0.0516,Jornada,-0.2755
La Jornada: Europe faces different economic outlook after note reduction: S & P,2012-01-15,-0.8625,Jornada,0.0
"La Jornada: Downpours on the cold front 26 cause overflow of the Tulijá river, in Tabasco",2012-01-15,-0.4404,Jornada,0.0
La Jornada: Ñanúes denounce the dispossession and resale of land in Querétaro,2012-01-15,0.0,Jornada,-0.34
La Jornada: Morelos: Villarreal Gasca is registered as pre-candidate of the PAN to governorship,2012-01-15,-0.7184,Jornada,0.0
La Jornada: Rescuing 15 captive people in Tijuana,2012-01-15,0.34,Jornada,0.0
La Jornada: At least 6 people have died of hunger in the Sierra Tarahumara,2012-01-15,-0.9666,Jornada,-0.6808
La Jornada: Police take 90 minutes to correspond to La Jornada,2012-01-15,-0.5267,Jornada,0.0
"La Jornada: In Coahuila, 1,660 missing by the violence of criminal gangs: Moreira",2012-01-15,-0.5423,Jornada,-0.8658
La Jornada: Michoacán: 40 new deputies begin work,2012-01-15,0.0,Jornada,0.0
La Jornada: Sonora PRI named president,2012-01-15,-0.4215,Jornada,0.0
La Jornada: Javier Duarte: state governments seek to build a better country,2012-01-15,0.8271,Jornada,0.4404
La Jornada: They plan to resell abandoned houses,2012-01-15,0.0,Jornada,-0.4588
"La Jornada: They plan to return to their communities, triquis expelled 16 months ago by paramilitaries",2012-01-15,0.0,Jornada,-0.25
La Jornada: Alleged medical malpractice kills a baby,2012-01-15,-0.5267,Jornada,-0.5423
"La Jornada: La Pique, by Picasso, is exhibited for the first time",2012-01-15,0.0,Jornada,-0.2732
La Jornada: Ruffato explores the sadness of a class absent in the celebration of Brazilian development,2012-01-15,-0.7003,Jornada,-0.4404
La Jornada: Boone shows another face of the north of the country: it is a way to make criticism,2012-01-15,0.0258,Jornada,-0.4404
La Jornada: Human reality without soil,2012-01-15,0.0,Jornada,0.0
La Jornada: What is humanism?,2012-01-15,0.128,Jornada,0.0
La Jornada: Urge schools to return to artistic education: De la Peña,2012-01-15,-0.8225,Jornada,0.0
"La Jornada: I will die without having achieved peace in the soul, but I am not unhappy: Fernando Vallejo",2012-01-15,0.5106,Jornada,-0.0969
Day: Embrutecimiento for control,2012-01-15,-0.5267,Jornada,0.0
"La Jornada: Óscar Rodríguez, member of the Mexican Plastic Show",2012-01-15,0.0,Jornada,0.0
"La Jornada: In Diagramática, Benjamín Torres reinterprets and modernizes the classic art",2012-01-15,0.2023,Jornada,0.0
La Jornada: Vital issue,2012-01-15,0.1531,Jornada,0.296
The Day: Unarmed Citizens,2012-01-15,-0.296,Jornada,0.0
La Jornada: Arnoldo González documents a finding that marked contemporary archeology,2012-01-15,-0.8402,Jornada,0.0
