article,pub_date,nltk_score,source,nltk_score_title
La Jornada: Taking of schools in Buenos Aires; Protest against Mauricio Macri,2011-07-06,0.0772,Jornada,-0.25
La Jornada: Sebastián Piñera announces a $ 4 billion fund for Chilean education,2011-07-06,0.9643,Jornada,0.0
La Jornada: French ship breaks the siege imposed by Greece and sails towards the Gaza Strip,2011-07-06,0.5267,Jornada,-0.0772
The Journey: Intensifies NATO attacks in eastern Libya to facilitate opposition advance,2011-07-06,-0.7184,Jornada,-0.4404
La Jornada: Chávez leads television on 200 years of Venezuelan independence,2011-07-06,-0.0772,Jornada,0.0
The Day: The Netherlands will pay damages to three of 8 thousand Muslim victims in Srebrenica massacre,2011-07-06,-0.8316,Jornada,-0.6808
The Day: Sudan faces its split amid rebellion and serious economic crisis,2011-07-06,-0.0516,Jornada,-0.7096
La Jornada: US demands Syria to withdraw troops from Hama and end arrests,2011-07-06,0.34,Jornada,-0.4404
La Jornada: Night and day incubation,2011-07-06,0.0,Jornada,0.0
"The Journey: Cy Twombly died, a consecrated of the abstract art of century XX",2011-07-06,-0.6597,Jornada,-0.5574
La Jornada: Anagrama will launch new novel by Daniel Sada; Will start circulating in September,2011-07-06,-0.5106,Jornada,0.3182
La Jornada: They will show a collection that detonated stories about the dark power of the Church,2011-07-06,-0.8074,Jornada,0.0
La Jornada: INBA will seek to disseminate its new collections among broader audiences,2011-07-06,0.0,Jornada,0.0
La Jornada: Icomos Mexico will carry out actions to reverse damage in the Palace of Fine Arts: Olga Orive,2011-07-06,-0.7184,Jornada,-0.34
"La Jornada: Machu Picchu, victim of its own success",2011-07-06,0.0258,Jornada,0.3818
La Jornada: Cristina Rivera Garza explores forms of memory to escape oblivion,2011-07-06,-0.4019,Jornada,0.1779
"La Jornada: US prosecutors to withdraw charges against Strauss-Kahn, say",2011-07-06,-0.9186,Jornada,-0.2732
La Jornada: Gruma expects strong increase in operating profit in 2011,2011-07-06,0.0,Jornada,0.8176
"La Jornada: After the crisis, prices fell on the land offered by Fonatur",2011-07-06,0.0,Jornada,-0.6249
"La Jornada: Combating insecurity, key for the economy to move forward: Banorte-Ixe",2011-07-06,-0.9509,Jornada,-0.4215
La Jornada: 150 thousand jobs will be generated less than expected: Coparmex,2011-07-06,-0.6808,Jornada,0.0
La Jornada: Lagarde enters IMF; Must meet the highest standards of ethical conduct,2011-07-06,0.0,Jornada,0.5106
La Jornada: Mexico's current growth will not solve poverty: IMF,2011-07-06,-0.9781,Jornada,0.5733
La Jornada: Mexican can still avoid bankruptcy: specialist,2011-07-06,0.2023,Jornada,-0.296
La Jornada: Bankers discuss a plan for the private sector to help rescue Greece,2011-07-06,0.0,Jornada,0.7184
"La Jornada: There will be no blur and new account, but Pemex normalizes relation with MexLub",2011-07-06,-0.6597,Jornada,-0.1531
La Jornada: Twitter social network worth 7 billion dollars,2011-07-06,-0.128,Jornada,0.2263
La Jornada: Nokia lowers smartphone prices,2011-07-06,0.0,Jornada,-0.128
La Jornada: Microsoft and Google sued for patent infringement,2011-07-06,0.0,Jornada,-0.4767
La Jornada: Order judge to release member of the OPIM,2011-07-06,-0.6908,Jornada,0.0
La Jornada: Closing the Conagua bridge over the Los Remedios River and orders demolition,2011-07-06,-0.5719,Jornada,0.0
"La Jornada: To be defined, seven mayors of Hidalgo",2011-07-06,-0.296,Jornada,0.0
"La Jornada: With Bravo Mena, the PAN obtained in the Edomex its lowest vote in 15 years",2011-07-06,0.0,Jornada,-0.3818
La Jornada: Mendoza Berrueto to preside over the next Congress of Coahuila,2011-07-06,0.0,Jornada,0.0
La Jornada: Calls for PAN to remove the mayor of Mérida,2011-07-06,0.0,Jornada,0.0
La Jornada: Chetumal prison director dismissed,2011-07-06,-0.7717,Jornada,-0.5106
La Jornada: Theft of roads causes derailment,2011-07-06,-0.4767,Jornada,0.0
La Jornada: PREP confirms the victory of PRI Roberto Sandoval in Nayarit,2011-07-06,0.6369,Jornada,0.0
La Jornada: Zacatecan medical staff demands safety,2011-07-06,0.6808,Jornada,0.4215
La Jornada: Bureaucrats of Coacalco claim benefits,2011-07-06,-0.4019,Jornada,0.3818
La Jornada: Two military officers accused of murdering Jethro Sánchez,2011-07-06,-0.6369,Jornada,-0.7579
La Jornada: Confiscating wood and animals in Oaxaca,2011-07-06,0.0,Jornada,0.0
La Jornada: Javier Duarte asks Calderón to forgive Veracruzans for delayed holdings,2011-07-06,-0.743,Jornada,0.0516
La Jornada: Jalisco bodies are found in drowned bodies of 2 speleologists,2011-07-06,-0.8885,Jornada,-0.5994
The Day: Cocoa asks Godoy to stay away from the election,2011-07-06,0.0,Jornada,0.0
La Jornada: Reject construction of McDonald's restaurant in downtown Zacatecas,2011-07-06,0.128,Jornada,-0.4019
La Jornada: Police fired for fining drunken deputy,2011-07-06,0.7269,Jornada,-0.5574
La Jornada: Baby dies due to nurse error,2011-07-06,-0.6369,Jornada,-0.4019
La Jornada: New wave of extortion in Chihuahua,2011-07-06,0.0516,Jornada,0.0
"La Jornada: $ 20,000 to be given to every affected family in Ecatepec",2011-07-06,-0.9081,Jornada,-0.1531
La Jornada: Launches Calderón program to redeem 46 million lamps,2011-07-06,0.7386,Jornada,0.0
"La Jornada: Almost 70% of rural households, headed by women",2011-07-06,0.2263,Jornada,0.0
La Jornada: Woman accused of murdering two-year-old daughter in US,2011-07-06,-0.9423,Jornada,-0.7579
"La Jornada: Riesgosos, food for sale in schools: NGOs",2011-07-06,0.0,Jornada,0.0
La Jornada: Sign agreement to exchange information Social Security and Infonavit,2011-07-06,-0.4939,Jornada,0.6808
La Jornada: The PAN tried to discard the proposal to create a company to replace LFC,2011-07-06,-0.296,Jornada,0.0258
La Jornada: Greenpeace Mexico campaign begins in protest against nuclear plants,2011-07-06,0.6249,Jornada,-0.25
La Jornada: PRI women demand respect for the right to decide,2011-07-06,-0.8957,Jornada,0.3818
"La Jornada: Accepts intermittent intermittent vaccinations of vaccines; IMSS and Issste, also with delays",2011-07-06,-0.8126,Jornada,0.3182
"La Jornada: Obesity, serious public health problem in the country, says academic",2011-07-06,-0.5719,Jornada,-0.4588
"La Jornada: A milestone, the Coidh ruling on feminicides in Juárez: UN Women",2011-07-06,-0.8442,Jornada,0.0
La Jornada: Looking for a cure for old age,2011-07-06,0.0,Jornada,0.0
"La Jornada: Ayahuasca, potent hallucinogen, is used for healing purposes in Europe",2011-07-06,-0.926,Jornada,0.0
Asia: Pollution slows global warming,2011-07-06,0.0258,Jornada,0.1531
"La Jornada: Encinas made the decision to go without an alliance and there are the results, says Ebrard",2011-07-06,-0.296,Jornada,0.0
"La Jornada: Abductions of migrants, without attention",2011-07-06,-0.128,Jornada,-0.4588
"La Jornada: Denounces abuses against inmates and visitors of the prison in Catazajá, Chiapas",2011-07-06,-0.6486,Jornada,-0.8689
La Jornada: Jesús Ortega and Guadalupe Acosta blame López Obrador for the electoral debacle,2011-07-06,-0.6808,Jornada,-0.34
La Jornada: Define rules for the appointment of the president of the Electoral Tribunal,2011-07-06,0.34,Jornada,0.0
La Jornada: Legislators demand that the PGR investigate possible corruption between Yunes and Gordillo,2011-07-06,-0.5859,Jornada,-0.128
La Jornada: The sentences issued by the IACHR must be complied with by the Mexican State: SCJN,2011-07-06,0.7096,Jornada,0.0516
"La Jornada: I do not regret the rejection of the alliance with AN in Edomex, says Encinas",2011-07-06,-0.9432,Jornada,0.6348
La Jornada: Will seek to reopen cases left pending prosecutors of the past,2011-07-06,-0.5859,Jornada,0.0
La Jornada: 2 other of the buried in San Fernando are identified,2011-07-06,0.0,Jornada,0.0
"La Jornada: The public security director of Quitupan, Jalisco",2011-07-06,0.2023,Jornada,0.34
The Day: Insists the SG in the extraordinary period,2011-07-06,0.6249,Jornada,0.0
La Jornada: This deadline expires Thursday and the IFE still does not endorse all regulations for 2012,2011-07-06,-0.8957,Jornada,-0.2411
La Jornada: Those who collect personal data must present privacy notice as of today,2011-07-06,0.4215,Jornada,0.0
"La Jornada: Hilda Anderson dies, promotes reforms in favor of women",2011-07-06,-0.5994,Jornada,0.6249
La Jornada: Corral requests extension to approve security law,2011-07-06,0.0516,Jornada,0.34
"La Jornada: Presses Los Pinos to TEPJF to ratify my expulsion, says Espino",2011-07-06,0.25,Jornada,0.0
La Jornada: Texas court refuses to suspend execution of Mexican,2011-07-06,-0.0,Jornada,-0.3182
La Jornada: Two military officers are tried for killing student Jethro Ramsés Sánchez,2011-07-06,0.1027,Jornada,-0.6597
La Jornada: The alliance with the Panal is progressing naturally: PRI Members,2011-07-06,-0.0258,Jornada,0.0
"La Jornada: In operational area, close to the teacher leader",2011-07-06,0.3818,Jornada,0.0
La Jornada: Confirming AN possible advancement of the presidential candidate election,2011-07-06,-0.802,Jornada,0.0
La Jornada: Alert of the Navy by the increase of the delinquency in the southern border,2011-07-06,-0.0772,Jornada,0.5423
La Jornada: Analysis of Zelaya's return to Honduras,2011-07-06,-0.34,Jornada,0.0
"La Jornada: Without consensus, they will present a plan to defend activists",2011-07-06,0.0,Jornada,0.0
"La Jornada: Issste is mine, said Gordillo, and demanded $ 20 million per month: Yunes",2011-07-06,0.5574,Jornada,-0.2263
"La Jornada: The last anti-democratic elections; Even a cow wins, express AMLO",2011-07-06,-0.9468,Jornada,0.5719
"La Jornada: Evening in the PRI for candidates, says Bernal",2011-07-06,-0.296,Jornada,0.0
La Jornada: Coparmex to focus its activities on the presidential election in 2012,2011-07-06,0.0,Jornada,0.0
La Jornada: Lost credential to vote for termination 03,2011-07-06,0.0,Jornada,-0.3182
La Jornada: They ask the ICC to try Calderón for crimes against humanity,2011-07-06,-0.7845,Jornada,0.0
"La Jornada: We must ally ourselves with society, not with interest groups: Beltrones a Moreira",2011-07-06,0.6705,Jornada,-0.357
"La Jornada: It is he who must answer about his acting in the institute, revolves the teacher leader",2011-07-06,-0.2263,Jornada,0.0
"La Jornada: Viable, an extraordinary period, but no pressures are accepted: PRI",2011-07-06,0.25,Jornada,-0.4767
La Jornada: NGOs accuse UN commissioner of serious violations of rights in the country,2011-07-06,-0.5267,Jornada,-0.6705
La Jornada: The Judicature dismisses the complaint against three judges in civil matters,2011-07-06,0.765,Jornada,-0.2732
"La Jornada: The Gulf cartel has a deal with the government, according to El Mamito",2011-07-06,0.0,Jornada,0.0
La Jornada: Spend Presidency in 2010 over $ 7 million in drinks and food,2011-07-06,0.3612,Jornada,0.0
