article,pub_date,nltk_score,source,nltk_score_title
"La Jornada: In Israel, law against boycotting settlements",2011-07-14,0.0,Jornada,-0.4019
La Jornada: Condemnation for false positives in Colombia,2011-07-14,-0.5106,Jornada,-0.1027
La Jornada: Unrest in Ulster after parade of unionists,2011-07-14,-0.7717,Jornada,0.0
La Jornada: They find dead to the smallest disappeared in NY,2011-07-14,0.0,Jornada,-0.7351
La Jornada: Purge in the Egyptian police; They cease to 650,2011-07-14,0.0,Jornada,0.0
La Jornada: Admits Hugo Chávez who may need chemotherapy or radiation therapy,2011-07-14,-0.9781,Jornada,0.296
La Jornada: Murder of a bullet in the head of a student when resisting to be assaulted,2011-07-14,-0.128,Jornada,-0.8442
La Jornada: A child is killed daily in Honduras,2011-07-14,-0.8176,Jornada,-0.6705
La Jornada: Opponents admit that their forces committed abuses against Libyan civilians,2011-07-14,0.6808,Jornada,-0.1779
La Jornada: Simultaneous attacks in Bombay leave 21 dead and more than 140 injured,2011-07-14,-0.7964,Jornada,-0.885
The Journey: British Justice analyzes extradition of Julian Assange,2011-07-14,-0.6486,Jornada,0.5267
La Jornada: Murdoch resigns to its project to buy TV channel BSkyB,2011-07-14,0.743,Jornada,-0.3182
La Jornada: Distinguish the poet Eduardo Lizalde with the international award Alfonso Reyes 2011,2011-07-14,0.0,Jornada,0.5423
La Jornada: Seven paths in Guanajuato in the theatrical work of several women,2011-07-14,0.0,Jornada,0.0
La Jornada: Groups in Mexico have a ballast of dances 200 years ago: Tibol,2011-07-14,-0.5267,Jornada,0.0
La Jornada: Mexican dancer and choreographer wins the INBA-UAM award,2011-07-14,0.9442,Jornada,0.802
La Jornada: Competition Commission to investigate Telmex and Dish for monopolistic practices,2011-07-14,-0.4939,Jornada,0.0
"La Jornada: Mexico, able to operate a space agency, announces Pérez-Jácome",2011-07-14,-0.0516,Jornada,0.0
La Jornada: Low growth in Mexico due to its dependence on the US: ECLAC,2011-07-14,-0.4019,Jornada,0.128
La Jornada: The dollar falls against European currencies,2011-07-14,0.6369,Jornada,0.0
The Day: Moody's Downgrades US Credit Rating,2011-07-14,-0.2732,Jornada,0.3818
"La Jornada: In Somalia, one in 10 children is at risk of dying from starvation",2011-07-14,-0.8316,Jornada,-0.2732
La Jornada: SAE will auction real estate from $ 28 thousand,2011-07-14,0.2732,Jornada,0.0
La Jornada: Gruma buys producer of tortillas and nachos in Russia,2011-07-14,0.0,Jornada,0.0
The Day: New York Times Co. to advance payments of $ 250 million to Slim,2011-07-14,0.1779,Jornada,0.0
La Jornada: Mexicana pilots demand that the government reconsider the rescue of the airline,2011-07-14,-0.8316,Jornada,0.4215
"La Jornada: Eurozone discussion on Greece undermines confidence in bailout, says IMF",2011-07-14,-0.6249,Jornada,0.128
La Jornada: At least 50 cruise shipments to Acapulco were canceled,2011-07-14,-0.2263,Jornada,0.0
La Jornada: 20% increase in housing prices in three years,2011-07-14,0.6369,Jornada,0.3182
La Jornada: Cordova Villalobos would leave the SSA at the end of September,2011-07-14,0.0516,Jornada,-0.0516
La Jornada: Young ñañús leave their traditions and adopt fashions of urban tribes,2011-07-14,0.5106,Jornada,0.128
La Jornada: Two dead and one injured in fire,2011-07-14,0.0258,Jornada,-0.8555
La Jornada: Chihuahua: 4 thousand go for teacher's places,2011-07-14,0.0,Jornada,0.0
La Jornada: Evicted settlers protesting against landfill; 5 detainees,2011-07-14,0.34,Jornada,-0.4215
La Jornada: They demand that a civil court in Morelos resolve the murder of Jethro Sánchez,2011-07-14,-0.0258,Jornada,-0.5574
La Jornada: Vacío legal in courts of Aguascalientes,2011-07-14,-0.296,Jornada,0.128
La Jornada: Order to penalize Alejandro Encinas for advancing his campaign,2011-07-14,0.4019,Jornada,0.0
La Jornada: 3 minors arrested for robbery and murder,2011-07-14,0.4939,Jornada,-0.8316
"La Jornada: Comptroller: Ulises Ruiz, responsible for damage to the treasury",2011-07-14,-0.4588,Jornada,-0.0258
"La Jornada: Alert on possible floods in Chiapas, Nuevo Leon and Guerrero",2011-07-14,0.3182,Jornada,0.296
La Jornada: Proposes Edomex to temporarily reopen bridge that the Conagua ordered to demolish,2011-07-14,0.7184,Jornada,0.0
La Jornada: Edil de Chalco hits sister for debt,2011-07-14,0.1027,Jornada,-0.3612
La Jornada: Tultitlán garbage dump to close,2011-07-14,-0.836,Jornada,-0.3818
La Jornada: Discard threat to the government of Coahuila,2011-07-14,-0.9201,Jornada,-0.6597
La Jornada: UN: poor states still hope,2011-07-14,0.0,Jornada,-0.0516
La Jornada: Loses SLP data for using obsolete equipment,2011-07-14,0.4939,Jornada,-0.5423
La Jornada: Urge to make a radical technological change in the production processes: UN,2011-07-14,-0.9657,Jornada,0.0
La Jornada: Three key drugs in the control of depression leave the market,2011-07-14,-0.9866,Jornada,-0.5994
The Day: The Catholic Church of Ireland concealed pederastia cases until 2009,2011-07-14,-0.7783,Jornada,0.0
La Jornada: Announces union of poultry farmers fall 5% in the production of chicken and egg,2011-07-14,-0.6808,Jornada,0.0
"La Jornada: Mexicanas, the second most stressed in the world",2011-07-14,-0.6124,Jornada,-0.4005
La Jornada: INEA: educational gap with mandatory baccalaureate,2011-07-14,-0.5423,Jornada,0.0772
La Jornada: Rains damaged maize plantings in Sinaloa,2011-07-14,-0.296,Jornada,-0.4404
"La Jornada: La Cofepris exempts 1,700 medical devices from having a sanitary registration",2011-07-14,-0.6908,Jornada,0.0
La Jornada: Cyber-hacking hackers unveil to NATO,2011-07-14,-0.872,Jornada,0.0
La Jornada: Denounce increase in murders for homophobia in Chihuahua and Guerrero,2011-07-14,-0.9371,Jornada,-0.6249
La Jornada: Higher teacher demand for a job than those offered,2011-07-14,-0.2023,Jornada,-0.128
La Jornada: Late credits and climate change put crops at risk: CNPR,2011-07-14,0.3818,Jornada,0.1027
La Jornada: Could fight cancer and obesity functional feeding: expert,2011-07-14,-0.6908,Jornada,-0.7906
La Jornada: The UNAM renews the way of teaching in the laboratories,2011-07-14,0.7717,Jornada,0.0
La Jornada: Detects the anti-inflammatory IPN that causes ezquizophrenia,2011-07-14,0.1027,Jornada,0.0
"La Jornada: Mexico, US and Canada redouble their exchange of safety data",2011-07-14,0.5423,Jornada,0.4215
La Jornada: Request to remedy violation of the Vienna Convention in the US,2011-07-14,-0.9186,Jornada,-0.4939
La Jornada: Coahuilenses take control of missing persons in their hands,2011-07-14,0.2263,Jornada,-0.296
La Jornada: The PGR aims to approach citizens,2011-07-14,0.0,Jornada,0.0
La Jornada: Discards president of PAN party coalition with Gordillo for 2012,2011-07-14,-0.7845,Jornada,0.1779
La Jornada: Hundreds of forced disappearances in Coahuila: Bishop Vera,2011-07-14,-0.7845,Jornada,-0.4588
"La Jornada: Compulsory, the IACHR ruling on Radilla case: Minister Sanchez",2011-07-14,0.1027,Jornada,0.0
"La Jornada: Gordillo, without room in my project: López Obrador",2011-07-14,-0.5994,Jornada,0.0
"La Jornada: If Calderón asks me to retire, I will tell him that he did not put me: Gordillo",2011-07-14,-0.93,Jornada,0.0
"La Jornada: The alliance with AN, only if it accepts PRD proposals: Cárdenas",2011-07-14,-0.5994,Jornada,0.3182
La Jornada: PGR is required to prosecute soldiers involved in the dirty war,2011-07-14,-0.8957,Jornada,-0.8591
La Jornada: Five young soccer players and three car usherers killed in Juárez,2011-07-14,-0.9371,Jornada,-0.6705
La Jornada: Cites Congress to Blake to Explain Measures of Protection to Undocumented,2011-07-14,-0.0258,Jornada,0.0
"La Jornada: The INM assisted 326 wounded or mutilated when traveling in La Bestia, between January and June",2011-07-14,-0.7845,Jornada,0.0
La Jornada: Llama Calderón to make common front to end human trafficking,2011-07-14,-0.8957,Jornada,0.0
La Jornada: Former LFC workers say they are deceived by the federal government; They are still unemployed,2011-07-14,-0.5267,Jornada,-0.4404
"La Jornada: Rewards for murderers from Sicily, LeBaron and Widmar",2011-07-14,-0.5994,Jornada,-0.296
"La Jornada: Investigation into the patrimony of judges and magistrates, requires the Permanent",2011-07-14,0.7506,Jornada,0.0
La Jornada: Trip without return from Pátzcuaro to Durango,2011-07-14,0.0,Jornada,0.0
La Jornada: The IACHR will review the situation of people who cross the country to reach the US,2011-07-14,0.0,Jornada,0.0258
"La Jornada: Personal labeling for officials who support Lamb, orders the PRI",2011-07-14,0.2023,Jornada,0.4019
La Jornada: Discards Ebrard alliance with the Honeycomb,2011-07-14,-0.296,Jornada,-0.25
La Jornada: Patrones may request arbitrations on strikes,2011-07-14,0.0,Jornada,-0.3612
La Jornada: Absenteeism of deputies sabotages call to plenary to discuss security law,2011-07-14,-0.7096,Jornada,0.34
La Jornada: AMLO predicts very difficult conditions for the 2012 elections,2011-07-14,-0.296,Jornada,-0.4201
La Jornada: Trade unionists reiterate support for miners,2011-07-14,0.9062,Jornada,0.4019
"La Jornada: In 20 months, 31 CNDH complaints against the military",2011-07-14,-0.6808,Jornada,-0.4019
La Jornada: Trade unions are asked to audit Issste,2011-07-14,0.34,Jornada,0.0
La Jornada: Background to the case Rosendo Radilla,2011-07-14,-0.128,Jornada,0.0
La Jornada: Workers continue caged protest,2011-07-14,0.0,Jornada,-0.25
"The Day: Restricting the Sale of Weapons, Obama Affects Citizens: Governor of Texas",2011-07-14,-0.9062,Jornada,-0.6705
La Jornada: Not yet defined in Government the sanction for spokesman Hugo Valdemar,2011-07-14,-0.9432,Jornada,0.0
The Journey: The Court approved a military article imprisoning a captain,2011-07-14,-0.7579,Jornada,0.4215
La Jornada: Recognized in the working world of Ifai,2011-07-14,0.0,Jornada,0.0
La Jornada: Military commanders demand legal framework to legitimize their fight against crime,2011-07-14,0.9081,Jornada,-0.7269
La Jornada: Ratifies the TEPJF fines to PRI and Tv Azteca,2011-07-14,-0.296,Jornada,0.0
La Jornada: Community Radio receives amparo against denial of advertising,2011-07-14,0.8316,Jornada,0.0
La Jornada: Praises the SRE Washington measures,2011-07-14,-0.743,Jornada,0.5267
La Jornada: Creel leaves Senate to seek AN candidacy,2011-07-14,-0.2023,Jornada,0.0
La Jornada: Legislators dismiss extra period to reform the Military Code,2011-07-14,0.5994,Jornada,0.0
The Day: Demand the Permanent to the Conago to respect guarantees in its operations,2011-07-14,0.1027,Jornada,0.3818
"La Jornada: Possible, to create electricity company for the center of the country: Hernández Juárez",2011-07-14,0.0,Jornada,0.2732
La Jornada: US Unmanned Aircraft to Watch Border Area,2011-07-14,-0.2732,Jornada,0.0
The Day: Ifai orders the Presidency to locate permits for the overflights of foreign aircraft,2011-07-14,0.25,Jornada,0.0
