article,pub_date,nltk_score,source,nltk_score_title
Evalúa Evo Morales la posibilidad de usar la fuerza en el departamento de Santa Cruz,2008-08-31,-0.9477,Jornada,0.0
"La renuncia, única salida a la crisis, le dice el jefe del ejército al premier tailandés",2008-08-31,-0.6597,Jornada,-0.743
Berlusconi ofrece disculpas a Libia por el periodo colonial italiano,2008-08-31,0.9702,Jornada,0.3612
Manda el Kremlin a socios europeos señales que buscan relajar la tensión en el Cáucaso,2008-08-31,-0.3182,Jornada,0.1531
Recuerdan en Chile a las miles de personas asesinadas por la dictadura,2008-08-31,-0.5859,Jornada,-0.6705
"Después de azotar Cuba, el meteoro se dirige hacia el sureste de Estados Unidos",2008-08-31,0.7351,Jornada,0.4215
Sale de la prisión de Martutene el ex líder de la izquierda nacionalista vasca Arnaldo Otegi,2008-08-31,-0.9948,Jornada,-0.5106
"El huracán Gustav, a punto de llegar a su máxima capacidad destructiva",2008-08-31,-0.9118,Jornada,-0.4939
Surge la única biografía de Juana de Ibarbourou,2008-08-31,-0.0772,Jornada,0.0
La Jornada,2008-08-31,0.6908,Jornada,0.0
Teatro Ojo revive la memoria y evoca cada paso del movimiento estudiantil de 1968,2008-08-31,-0.7845,Jornada,0.3818
"Pétalos y otras historias incómodas muestra la belleza real, la que nos hace seres únicos",2008-08-31,0.9485,Jornada,0.296
"Calladita te ves más bonita, premio Juan Rulfo 2006, lista en librerías del país",2008-08-31,-0.8176,Jornada,0.765
"Shahram Entekhabi, interlocutor entre el arte y los migrantes",2008-08-31,-0.7506,Jornada,0.0
Concluyó el Encuentro Internacional de Literatura en Lenguas Indígenas,2008-08-31,-0.3612,Jornada,0.0
"Gran Bretaña, en la peor crisis económica de los últimos 60 años",2008-08-31,-0.7096,Jornada,-0.8481
Reduce EU al mínimo la producción de crudo en el Golfo por el huracán Gustav,2008-08-31,0.6486,Jornada,0.0
Acusan organizaciones a la Profeco de actuar sólo contra empresas débiles,2008-08-31,-0.7845,Jornada,-0.6249
Quiebra el estadunidense Integrity Bank,2008-08-31,0.0,Jornada,0.3818
El gobierno quemó 73% de fondos excedentes en “compensaciones”,2008-08-31,0.802,Jornada,0.0
CAN: balanza comercial sana en Sudamérica,2008-08-31,0.1779,Jornada,0.4019
Crece el descontento en la CFE por nuevo régimen de pensiones,2008-08-31,0.2023,Jornada,0.1779
"Por intentar afiliarse a sindicato, despiden a empleados de gasolinera",2008-08-31,-0.1027,Jornada,0.296
"Cambian esquema de investigación en IMSS; el manejo de recursos, opaco",2008-08-31,-0.1779,Jornada,0.0
"Tema sanitario, la mala calidad del agua embotellada, según Cofepris",2008-08-31,-0.9509,Jornada,-0.4767
"La SEP, sin previsión para renovar el modelo educativo",2008-08-31,-0.5267,Jornada,0.0
Maestros de Morelos toman casetas por tercer día seguido,2008-08-31,0.743,Jornada,0.0
"Iniciativa laboral de Calderón, más rabiosa que la ley Abascal",2008-08-31,-0.2023,Jornada,0.0
"Sedeso: la casa o la escuela, donde los mexicanos se sienten “más seguros”",2008-08-31,0.4404,Jornada,0.0
Aumentó este sexenio la pobreza extrema,2008-08-31,-0.9732,Jornada,-0.296
Secuestraron a 5 mil alumnos de prepas públicas en un año,2008-08-31,-0.9944,Jornada,0.0
"La prueba Enlace “no revela nada nuevo”, dice experto de la UNAM",2008-08-31,-0.7942,Jornada,0.0
"En la defensa del petróleo, no se retrocederá ni para tomar impulso",2008-08-31,0.2263,Jornada,0.128
Denuncia Ibarra de Piedra desapariciones políticas disfrazadas de levantones; van 31 este sexenio,2008-08-31,-0.8885,Jornada,-0.6124
Desde 2006 existe un reglamento de coordinación en seguridad nacional,2008-08-31,0.9953,Jornada,0.34
Incontenible inseguridad en Guerrero,2008-08-31,-0.6486,Jornada,-0.4215
Peligran los derechos humanos con el pacto nacional por la seguridad: ONG,2008-08-31,0.9831,Jornada,-0.1531
Dos decapitadas en la ciudad de Durango,2008-08-31,-0.3612,Jornada,0.0
Anula Calderón mensaje político del día primero,2008-08-31,-0.296,Jornada,0.0
Llama diputado panista a analizar en detalle reformas a ley de fuerzas armadas,2008-08-31,0.0,Jornada,0.0
"Decenas de miles corean en el Zócalo el reclamo: “¡si no pueden, renuncien!”",2008-08-31,-0.9923,Jornada,0.0
Continúa la ola de ejecuciones y secuestros aun con operativos conjuntos contra el crimen,2008-08-31,-0.3947,Jornada,-0.5423
"Liberar a Ignacio del Valle, exige la otra campaña",2008-08-31,-0.946,Jornada,0.0
"Se cayó la estrategia militar de Calderón contra el hampa, afirma González Garza",2008-08-31,-0.9955,Jornada,0.0
Hoy presenta nuevo plan en el DF,2008-08-31,0.6597,Jornada,0.0
Alista el FAP grupo de asesores para el dictamen sobre la reforma energética,2008-08-31,0.1027,Jornada,0.5574
"La decapitación, “expresión de violencia máxima”; busca aterrorizar: criminólogos",2008-08-31,-0.9958,Jornada,-0.6486
Marchan 84 mil contra el hampa en los estados,2008-08-31,-0.9769,Jornada,0.0
Busca el PRD regulación del derecho de réplica,2008-08-31,0.9081,Jornada,0.0
Murió el luchador político y social Gilberto Rincón Gallardo,2008-08-31,-0.9538,Jornada,-0.4588
"Reforma de Pemex, en segundo plano para diputados del PAN",2008-08-31,-0.6808,Jornada,0.0
Briseño: “el golpe se fraguó en casa de Raúl Padilla”,2008-08-31,-0.8779,Jornada,0.0
Investigan a 5 policías de Los Cabos por muerte de turista,2008-08-31,-0.8591,Jornada,-0.5994
Zacatecas: suman 11 municipios declarados en emergencia por desbordamientos de ríos,2008-08-31,-0.9451,Jornada,-0.3818
"La FEG podría resurgir como poder paralelo en la UdeG, advierte ex dirigente estudiantil",2008-08-31,-0.9493,Jornada,-0.1027
Priva tensión en la UdeG; padillistas siguen atrincherados en la rectoría,2008-08-31,-0.9881,Jornada,-0.3182
Rechazan lista de plurinominales del PRI en Guerrero,2008-08-31,-0.5267,Jornada,-0.4019
