article,pub_date,nltk_score,source,nltk_score_title
Broma a Palin,2008-11-02,0.0,Jornada,0.296
Ofensiva diplomática de Europa en Congo,2008-11-02,-0.3182,Jornada,-0.4588
Suspende el presidente Evo Morales las actividades de la DEA en Bolivia,2008-11-02,0.959,Jornada,0.0
Fortalece Kadafi los vínculos Rusia-Libia,2008-11-02,-0.0258,Jornada,0.4588
"Nunca más Ecuador será una “banana república”, advierte el presidente Rafael Correa",2008-11-02,-0.8442,Jornada,-0.1027
Obama y McCain concentran sus baterías en estados clave que ganó George W. Bush en 2004,2008-11-02,-0.886,Jornada,0.5719
"ONU: las ejecuciones, práctica en Colombia",2008-11-02,-0.296,Jornada,0.0
"“Estímulo al hombre”, clave para un alto provecho ganadero: líder agrario cubano",2008-11-02,-0.8689,Jornada,0.4404
"Chávez, por expropiar petroquímica Veneco",2008-11-02,0.0,Jornada,0.0
Rechazo la poesía panfletaria y vacía: Fernández Retamar,2008-11-02,-0.8402,Jornada,-0.6486
Una mítica relación,2008-11-02,0.3182,Jornada,0.0
Presentan cd doble con un “tesoro catedralicio”,2008-11-02,-0.4767,Jornada,0.296
"“Al principio, pensaban que La Nao era una feria de fritangas”",2008-11-02,-0.7717,Jornada,0.3182
Rasgos del führer,2008-11-02,0.0,Jornada,0.0
"Dolor, caos y belleza",2008-11-02,0.4215,Jornada,-0.4939
"Con más de 100 años, Hiro-Kun reina en el Pabellón de la Cultura Oriental",2008-11-02,0.6124,Jornada,0.0
Búsqueda de la identidad arrebatada por la guerra,2008-11-02,-0.802,Jornada,-0.5994
Venganza dulce y perversa,2008-11-02,-0.8625,Jornada,-0.4939
Familiares de soldados estadunidenses se quejan de los chicotazos de la crisis,2008-11-02,-0.9118,Jornada,-0.765
Navidad en NY: hamburguesas suplen el caviar,2008-11-02,-0.8591,Jornada,0.0
La Consar no cumple su misión: PRI,2008-11-02,0.2732,Jornada,-0.3412
"Tiendas de autoservicio triplican costo de frutas y vegetales, alerta la Profeco",2008-11-02,-0.34,Jornada,-0.1027
La turbulencia financiera mundial golpea ya las economías de China e India,2008-11-02,0.1779,Jornada,0.0
"Con problemas de cartera vencida, 5.1 millones de mexicanos: Buró de Crédito",2008-11-02,0.4404,Jornada,-0.0258
Subastó BdeM en 17 días 76% de fondos que aportó Pemex a reserva,2008-11-02,-0.9313,Jornada,0.0
Reconocimiento del Senado a jóvenes participantes en la Olimpiada Iberoamericana de Química,2008-11-02,0.3612,Jornada,0.0
Crean catálogo de edificios que inundará una presa,2008-11-02,0.3612,Jornada,0.0
Desarrollan nueva técnica sobre reproducción asistida,2008-11-02,-0.5994,Jornada,0.0
Rechazan secretarios de Educación dar apoyo incondicional a la ACE,2008-11-02,0.836,Jornada,-0.2023
Violan derechos iniciativas de Calderón sobre seguridad y justicia: PRI y PRD,2008-11-02,0.5994,Jornada,-0.25
"El martes, reporte sobre pesquisas en torno a dos eperristas desaparecidos",2008-11-02,0.128,Jornada,-0.296
Hará la inflación que caigan los fondos reales para ciencia y tecnología en 2009,2008-11-02,0.2023,Jornada,-0.2732
Asedian priístas de Agua Azul a zapatistas de Bolon Ajaw,2008-11-02,-0.959,Jornada,0.0
En Michoacán se oponen a venta de una isla,2008-11-02,0.5267,Jornada,0.0
Detienen en Azcapotzalco a dos narcomenudistas,2008-11-02,-0.7269,Jornada,-0.296
Acuerdo del DIF y procuradores,2008-11-02,0.6597,Jornada,0.4939
Tercer día de ataques contra la policía en el estado de México,2008-11-02,-0.3182,Jornada,-0.4404
"Decomisó la Cofepris 6 toneladas y media de fármacos caducos, falsos y en mal estado",2008-11-02,-0.936,Jornada,-0.7351
INE: deterioro de catalizadores cuadruplica emisión de gases,2008-11-02,-0.9545,Jornada,0.0
Debe darse más presupuesto al campo para evitar hambruna: Sergio Barrales,2008-11-02,-0.9169,Jornada,-0.296
Exigen diputados explicación sobre rezago en pago a militares en retiro,2008-11-02,0.8481,Jornada,-0.34
Tribunal fiscal pone en marcha el sistema electrónico Infomex,2008-11-02,0.5267,Jornada,0.0
Altar en NL en memoria de luchadores sociales,2008-11-02,0.3182,Jornada,-0.0516
Altar por feminicidios en Ciudad Juárez,2008-11-02,-0.0772,Jornada,0.0
"“Me tocó subirlos a un helicóptero, amarrarlos e irlos a tirar al mar”",2008-11-02,-0.7823,Jornada,0.0
Condena Arizmendi los asesinatos en Chinkultic; celebra misa por el caso,2008-11-02,-0.5106,Jornada,-0.5574
Marcha en Arizona para recordar a 183 migrantes muertos este año en el desierto,2008-11-02,0.0,Jornada,-0.6705
"Impacto negativo de la lucha calderonista anticrimen, denuncian ONG ante la CIDH",2008-11-02,-0.9371,Jornada,-0.8271
Descarta Gobernación un retorno masivo de connacionales desde EU,2008-11-02,-0.8593,Jornada,-0.5574
Más de 20 mil propuestas para el trámite más inútil: SFP,2008-11-02,0.6124,Jornada,-0.4754
"Bajo investigación, Gerardo Garay Cadena",2008-11-02,-0.8176,Jornada,0.0
"El Socialdemócrata, dispuesto a aliarse con sector del PRD contrario a AMLO",2008-11-02,-0.8555,Jornada,0.3612
Localizan cinco armas largas en una pick-up,2008-11-02,-0.7783,Jornada,0.0
En octubre capturó la SSP a 28 narcotraficantes,2008-11-02,-0.296,Jornada,0.0
El presidente de Paraguay visita Mixquic,2008-11-02,0.34,Jornada,0.0
"¿Quién sostendrá a los viejos migrantes que vuelvan?, pregunta investigador de la UAM",2008-11-02,-0.4767,Jornada,0.4019
Capturan a un presunto líder del cártel del Golfo,2008-11-02,-0.9413,Jornada,0.0
Agreden a reportero gráfico en Guerrero,2008-11-02,-0.296,Jornada,-0.5267
El cabildo de Izcalli se declara en insolvencia,2008-11-02,-0.296,Jornada,0.0
Sinaloa: exigen indagar negligencia médica,2008-11-02,-0.7964,Jornada,0.0
Piden castigar a agresores sexuales de niño en Oaxaca,2008-11-02,-0.2732,Jornada,-0.6908
Se enfrentan choferes con locatarios de la Ceda de Ecatepec; 30 heridos,2008-11-02,-0.6369,Jornada,-0.5423
PAN y PRI deciden integración del nuevo tribunal electoral de NL,2008-11-02,0.5423,Jornada,0.0
Padres torturan a su bebé en Tijuana,2008-11-02,0.34,Jornada,-0.5994
