article,pub_date,nltk_score,source,nltk_score_title
$68 Billion Returns to Bailout Kitty,2009/06/09,0.96,ProPublica,-0.1027
FRAC Act—Congress Introduces Twin Bills to Control Drilling and Protect Drinking Water,2009/06/09,0.9859,ProPublica,0.3818
Administration Reiterates Need for Speed,2009/06/09,0.4137,ProPublica,0.0
Afghanistan’s K Street Complaints and HUD’s Duds,2009/06/09,0.25,ProPublica,-0.4019
Obama Admin Regulatory Reforms Become More Modest,2009/06/09,-0.2333,ProPublica,0.0
"Introducing ProPublica’s DNA Backlog Tracker: Five Labs, Five Backlogs",2009/06/09,-0.982,ProPublica,0.0
DNA Tracker: Crime Labs and Their DNA Backlog,2009/06/09,-0.9922,ProPublica,-0.5423
