article,pub_date,nltk_score,source,nltk_score_title
La Jornada: Historia reciente,2011-02-04,0.25,Jornada,0.0
"La Jornada: Manigat y Martelly, a segunda vuelta por la presidencia de Haití",2011-02-04,-0.128,Jornada,0.0
La Jornada: Convoca la Conaie a una protesta por la captura de 3 dirigentes indígenas en Ecuador,2011-02-04,-0.8625,Jornada,-0.25
La Jornada: Tras rutina de ejercicio muere un reo en Guantánamo,2011-02-04,-0.296,Jornada,0.0
La Jornada: Tormenta se dirige a la costa este de EU,2011-02-04,-0.34,Jornada,0.0
"La Jornada: Transición rápida y ordenada, reclaman líderes de Europa",2011-02-04,-0.9274,Jornada,0.0
La Jornada: Ayunan dos disidentes cubanos presos,2011-02-04,0.34,Jornada,-0.4767
La Jornada: Obama da tumbos ante su viejo aliado; opta por rezar,2011-02-04,-0.9201,Jornada,0.3182
La Jornada: Tensa calma en El Cairo; opositores resisten ataques,2011-02-04,-0.875,Jornada,-0.4588
La Jornada: Conmemoran el derrocamiento de Stroessner en Paraguay hace 22 años,2011-02-04,0.0,Jornada,0.0
"La Jornada: En el Día de ira, exigen miles cambio de régimen en Yemen",2011-02-04,-0.25,Jornada,-0.128
"La Jornada: Mubarak se irá mañana, clamor en la plaza Tahrir",2011-02-04,-0.9772,Jornada,-0.0516
La Jornada: Diputados niegan a la fiscalía de Milán permiso para investigar oficinas del contador de Berlusconi,2011-02-04,-0.5423,Jornada,-0.34
La Jornada: Exigen diputados británicos a la BBC disculparse por mofa sobre mexicanos,2011-02-04,0.8271,Jornada,-0.3182
La Jornada: Piden diputados al órgano electoral transparentar manejos financieros,2011-02-04,-0.6124,Jornada,0.0
La Jornada: Desalojan plantón de la otra campaña en la carretera Ocosingo-Palenque,2011-02-04,-0.8316,Jornada,0.0
"La Jornada: En el Día de ira, exigen miles cambio de régimen en Yemen",2011-02-04,-0.25,Jornada,-0.128
La Jornada: Obama da tumbos ante su viejo aliado; opta por rezar,2011-02-04,-0.9201,Jornada,0.3182
La Jornada: Obispos mexicanos irán a Colombia a intercambiar experiencias sobre violencia,2011-02-04,0.1027,Jornada,-0.6249
La Jornada: Abre Sedena al público el Campo Militar Número 1,2011-02-04,-0.2023,Jornada,0.0772
La Jornada: Rechaza jefe Diego alianzas PAN-PRD,2011-02-04,-0.296,Jornada,-0.4939
La Jornada: Instalaciones de Sempra no cumplen leyes de Ensenada,2011-02-04,-0.8979,Jornada,0.0
"La Jornada: Transición rápida y ordenada, reclaman líderes de Europa",2011-02-04,-0.9274,Jornada,0.0
"La Jornada: Busca EU la extradición de El Charro, vinculado a ejecución de 20 michoacanos",2011-02-04,-0.7579,Jornada,0.0
"La Jornada: Fernández de Cevallos, en favor de alianzas, pero entre PRI y PAN: López Obrador",2011-02-04,-0.296,Jornada,0.2144
La Jornada: Estamos en la ruta equivocada en la construcción del sistema de salud: Levy,2011-02-04,-0.4404,Jornada,-0.4767
La Jornada: Reportaron ayer 15 ejecuciones del crimen organizado en seis entidades,2011-02-04,0.0,Jornada,-0.5423
La Jornada: Llama Blake a depurar las policías,2011-02-04,0.0258,Jornada,0.0
La Jornada: Se tomará en cuenta todo lo hecho por los candidatos a sustituir a Gudiño en la Corte,2011-02-04,-0.6908,Jornada,0.0
La Jornada: Historia reciente,2011-02-04,0.25,Jornada,0.0
La Jornada: Queda en suspenso el dictamen para expedir la ley sobre trata de personas,2011-02-04,-0.8442,Jornada,-0.4767
La Jornada: El fuero no alcanza para abrigar la injuria: Blake,2011-02-04,0.3182,Jornada,-0.4215
La Jornada: Vincula HRW a militares y policías con muertes y desapariciones en NL,2011-02-04,-0.802,Jornada,0.0
La Jornada: Trasladaba dinero del narco,2011-02-04,0.0,Jornada,0.0
"La Jornada: Calderón ya tiene favorito para ocupar cargo en la SCJN, coinciden expertos",2011-02-04,-0.7184,Jornada,0.6705
La Jornada: Trifulca en San Lázaro por manta de PT y PRD ofensiva para Calderón,2011-02-04,-0.34,Jornada,-0.4588
La Jornada: Levantan a ex edil de Fresnillo,2011-02-04,0.4404,Jornada,0.0
"La Jornada: Mubarak se irá mañana, clamor en la plaza Tahrir",2011-02-04,-0.9772,Jornada,-0.0516
La Jornada: Realiza aerolínea Mexicana vuelo de certificación,2011-02-04,0.0516,Jornada,0.0
La Jornada: Reconoce Juan Sabines labor de taxistas vigilantes; entrega estímulos,2011-02-04,-0.5106,Jornada,0.1779
La Jornada: Formal prisión a dos federales en Juárez,2011-02-04,-0.9601,Jornada,-0.5106
La Jornada: Sobrecargos desconocen a Lizette Clavel como dirigente,2011-02-04,0.0,Jornada,-0.3612
La Jornada: Pide Godoy más inversión en el campo para detener los flagelos que azotan Michoacán,2011-02-04,-0.4215,Jornada,-0.296
La Jornada: ONU y Edomex suman esfuerzos en favor de la equidad de género,2011-02-04,-0.2732,Jornada,0.5994
La Jornada: Demandan senadores preservar la vida de ciudadanos en operativos,2011-02-04,-0.8555,Jornada,-0.128
La Jornada: Demanda el SME a la Secretaría de Gobernación reanudar negociaciones,2011-02-04,0.0,Jornada,0.0
La Jornada: Emitió el IFE 12.2 millones de credenciales,2011-02-04,0.0,Jornada,0.0
La Jornada: Cascada de cambios en el equipo de trabajo del gobernador neoleonés,2011-02-04,0.8957,Jornada,0.0
La Jornada: Llama la UNAM a legisladores a dar alta prioridad a la educación,2011-02-04,-0.6124,Jornada,0.0
La Jornada: Tensa calma en El Cairo; opositores resisten ataques,2011-02-04,-0.875,Jornada,-0.4588
La Jornada: Emboscan y asesinan al titular de seguridad pública en Nuevo Laredo,2011-02-04,-0.8834,Jornada,-0.5994
"La Jornada: La Camerata de Coahuila revolucionó la vida cultural del estado, dice su director",2011-02-04,-0.9702,Jornada,0.0
La Jornada: Traslada escritor del lienzo a las palabras los autorretratos de célebres artistas,2011-02-04,-0.25,Jornada,0.0
La Jornada: Jóvenes egipcios arriesgan la vida para defender la Biblioteca de Alejandría,2011-02-04,0.743,Jornada,-0.2732
La Jornada: Proponen un futuro de movilidad inteligente para 10 urbes en el mundo,2011-02-04,0.0,Jornada,0.4588
La Jornada: Artista chino crea con pólvora instalación de sitio en el MUAC,2011-02-04,0.91,Jornada,0.2732
La Jornada: Firman acuerdo de seguridad para BCS,2011-02-04,-0.2023,Jornada,0.6808
La Jornada: Retoman juicio oral en Baja California,2011-02-04,-0.296,Jornada,0.0
La Jornada: QR: contrato turbio de alumbrado público,2011-02-04,-0.0258,Jornada,0.0
La Jornada: Sindicato rechaza injerencia en la UAS,2011-02-04,-0.296,Jornada,-0.4939
La Jornada: Acusan al gobierno de Oaxaca de mantener preso a líder magisterial,2011-02-04,0.2263,Jornada,-0.6908
La Jornada: Reguetoneros llamarán a votar en Coahuila,2011-02-04,0.0,Jornada,0.0
La Jornada: Provocan las heladas apagones y daños a infraestructura hidráulica,2011-02-04,0.7579,Jornada,-0.4939
La Jornada: Registra el PRI coalición en Nayarit,2011-02-04,0.6597,Jornada,0.0
La Jornada: Niega titular de Ssa estar en campaña,2011-02-04,0.0,Jornada,-0.4215
La Jornada: Añorve pide volver a la alcaldía de Acapulco,2011-02-04,0.0,Jornada,0.0
La Jornada: Ciudadano camerunés denuncia a policías,2011-02-04,0.5267,Jornada,-0.4404
La Jornada: Falsea el Inegi datos sobre Huautla: alcalde,2011-02-04,0.0,Jornada,0.0
La Jornada: Persisten destrozos por lluvias en Michoacán,2011-02-04,-0.5994,Jornada,0.0
La Jornada: Descalifica el tricolor alianza en Hidalgo,2011-02-04,0.34,Jornada,0.0
La Jornada: Desarrollan fórmula herbolaria para tratar trastornos nerviosos,2011-02-04,-0.2732,Jornada,0.1531
La Jornada: Sólo uno de cada 5 académicos en el SNI,2011-02-04,0.4939,Jornada,0.0
La Jornada: Piden al gobierno de EU entregar a la hija de Rubí Frayre a su familia,2011-02-04,0.3182,Jornada,0.4939
La Jornada: Pese al desdén del gobierno abrirá el Museo de la Mujer este año,2011-02-04,-0.6597,Jornada,-0.4767
La Jornada: Contra los rezagos y el olvido,2011-02-04,-0.296,Jornada,-0.3612
La Jornada: Niegan autoridades del IPN que se intente reprimir a alumnos,2011-02-04,-0.891,Jornada,-0.5859
"La Jornada: Por falta de fondos, el desabasto de fármacos",2011-02-04,-0.2023,Jornada,-0.4404
"La Jornada: Embajadores, escépticos ante creación de fiscalía para delitos contra migrantes",2011-02-04,-0.6597,Jornada,-0.5267
"La Jornada: Después de accidente, la STPS clausura mina Lulú",2011-02-04,0.296,Jornada,-0.4767
La Jornada: América Latina fue la mayor fuente de ganancias del grupo Santander,2011-02-04,0.7506,Jornada,0.4404
La Jornada: Aguarda Ifai respuesta de Cofetel sobre concesión,2011-02-04,0.0,Jornada,0.0
La Jornada: Crisis en Egipto afecta a agencias de viajes,2011-02-04,0.0,Jornada,-0.6249
La Jornada: La Corte negó otro amparo contra el IDE,2011-02-04,-0.7351,Jornada,-0.4404
La Jornada: Los consejeros de Pemex cuestan más de $100 millones al año,2011-02-04,0.0,Jornada,0.0
La Jornada: Costó 90 mdd bloqueo a telecomunicaciones,2011-02-04,0.0,Jornada,-0.4404
La Jornada: Se agota reserva de direcciones de Internet,2011-02-04,0.0,Jornada,0.0
La Jornada: FAO: nuevo récord de presiones alcistas en precios de alimentos,2011-02-04,-0.8176,Jornada,-0.296
"La Jornada: Desempleo, una de las causas de la revuelta: OIT",2011-02-04,0.0,Jornada,-0.4404
La Jornada: Cayeron 3% las ventas de Cemex y 13% el flujo de operación en 2010,2011-02-04,-0.3182,Jornada,0.0
La Jornada: Rechaza Unefon que afecte a usuarios por eliminar aviso de buzón de voz,2011-02-04,0.2023,Jornada,-0.4939
La Jornada: Automovilistas británicos llaman a bloquear refinería,2011-02-04,0.0,Jornada,-0.4404
La Jornada: Interconectará la CFE a Baja California con compañías eléctricas de EU en 2014,2011-02-04,0.7506,Jornada,0.0
La Jornada: Cabildean diputados con la Corte declarar inconstitucional adelantar apagón analógico,2011-02-04,0.6249,Jornada,0.0
La Jornada: Pérez-Jácome ajusta su equipo de trabajo en la SCT,2011-02-04,0.0,Jornada,0.0
La Jornada: Reporta Telmex caída de 6% en sus ingresos,2011-02-04,0.0,Jornada,-0.2732
La Jornada: Reactivación de Nissan creó 500 empleos en Aguascalientes,2011-02-04,0.0,Jornada,0.25
