article,pub_date,nltk_score,source,nltk_score_title
La Jornada: They detect a legal vacuum in the telecommunication reform,2013-07-29,0.1027,Jornada,0.128
"La Jornada: The fall of tequila production, by high levels of inventories: CRT",2013-07-29,-0.1027,Jornada,0.0
La Jornada: They cause discontent among locals all inclusive packages in beach hotels,2013-07-29,0.34,Jornada,0.0
"La Jornada: Kessel, former secretary of Energy, collaborates with Spanish Iberdrola",2013-07-29,0.9287,Jornada,0.2732
La Jornada: A new advertising giant emerges with the merger of Publicis and Omnicom,2013-07-29,0.5574,Jornada,0.0
"La Jornada: Today, candidates for Ifetel and CFC are defined",2013-07-29,0.25,Jornada,0.0
La Jornada: Social mobility eroded in the US as inequity grows: Obama,2013-07-29,-0.4019,Jornada,0.0
La Jornada: From the dialogue between Baranda and Rojo a visual music box emerges,2013-07-29,0.9017,Jornada,0.0
La Jornada: The MACG brings the public to its collection through a curatorial essay,2013-07-29,0.0,Jornada,0.0
"La Jornada: Opening exhibition of Manuel González Serrano, painter of the aesthetics of pain",2013-07-29,-0.7096,Jornada,-0.5106
"La Jornada: Fernando Alonso dies, legend of Cuban dance",2013-07-29,-0.25,Jornada,0.0
"La Jornada: To combat fraud, corruption and fear, popular power: Taibo II",2013-07-29,-0.979,Jornada,-0.765
La Jornada: Former procurator demands to clear his name,2013-07-29,0.0,Jornada,0.3818
La Jornada: The Naucalli park lacking in sustainability plan,2013-07-29,-0.7783,Jornada,0.0
La Jornada: Abused child meets with his mother in Tabasco,2013-07-29,0.5267,Jornada,-0.5106
La Jornada: IP asks Mexiquenses clean criminal records,2013-07-29,-0.6597,Jornada,-0.1779
La Jornada: Farm lands are lost due to looting of the Ameca river: ejidatarios,2013-07-29,-0.7783,Jornada,-0.3182
La Jornada: 4 illegal wells closed in Ecatepec,2013-07-29,0.4767,Jornada,-0.3818
La Jornada: More poverty and crime in Querétaro: AN and PRD,2013-07-29,-0.7783,Jornada,-0.8104
La Jornada: Tourism project in BCS has no water insured,2013-07-29,0.296,Jornada,-0.296
La Jornada: INAH asks to stop works in Xalapa,2013-07-29,0.1027,Jornada,-0.296
La Jornada: Corriente takes a man to Zapopan,2013-07-29,-0.8225,Jornada,0.0
La Jornada: Ten years of struggle against the La Parota dam,2013-07-29,0.6124,Jornada,-0.3182
La Jornada: Professor disappears in Chihuahua,2013-07-29,-0.5423,Jornada,-0.34
La Jornada: Dead fish found in Veracruz,2013-07-29,0.0,Jornada,-0.6486
La Jornada: Detect adulterated gasolines in Juárez,2013-07-29,-0.7003,Jornada,0.0
La Jornada: The TEE validates the elections in Zacatecas,2013-07-29,0.3182,Jornada,0.34
La Jornada: Ex-rector of the Universidad Veracruzana is questioned for seeking third term,2013-07-29,-0.5106,Jornada,-0.1027
"La Jornada: Without social security or base, most of the bureaucrats: ANAD",2013-07-29,-0.6597,Jornada,0.34
La Jornada: Excluding 90% of job offers for people over 35: Conapred,2013-07-29,0.4019,Jornada,0.0
La Jornada: Boltvinik: the number of poor grew by 12 million with Calderón,2013-07-29,-0.9682,Jornada,-0.4215
The Journey: Children must sleep from seven to nine hours,2013-07-29,0.4404,Jornada,0.0
La Jornada: 39 people killed in car accident in Italy,2013-07-29,-0.891,Jornada,-0.8225
La Jornada: 27% sale of drugs to control diabetes in AL,2013-07-29,0.4939,Jornada,0.0
La Jornada: Egyptian interim government multiplies threats against supporters of the overthrown Mursi,2013-07-29,-0.8779,Jornada,0.0258
La Jornada: Russia prepares response at US request to hand over to Snowden,2013-07-29,-0.9231,Jornada,0.4939
La Jornada: Road accident in Italy; 36 dead,2013-07-29,0.0,Jornada,-0.8126
La Jornada: Tribute to Chávez for his birthday,2013-07-29,0.1779,Jornada,0.0
La Jornada: Peruvian unions protest against Humala,2013-07-29,0.0,Jornada,-0.25
"La Jornada: Leaving the psychology of princes, asks the Pope to bishops of AL",2013-07-29,-0.9246,Jornada,0.0
La Jornada: The pontiff meets with rulers of the region,2013-07-29,-0.296,Jornada,0.0
La Jornada: Berlusconi prefers jail to social work,2013-07-29,0.0,Jornada,0.0
La Jornada: Government and FARC return to the negotiating table,2013-07-29,0.5423,Jornada,0.0
"La Jornada: Israel will free 104 Palestinian prisoners, on resumption of dialogue",2013-07-29,0.7906,Jornada,0.0
La Jornada: British soldiers return to Afghanistan,2013-07-29,-0.0772,Jornada,0.0
La Jornada: Accused of 79 crimes of homicide to the engineer of the train injured in Spain,2013-07-29,-0.3182,Jornada,-0.5994
La Jornada: Syrian army controls important neighborhood of Homs,2013-07-29,0.0,Jornada,0.2023
"La Jornada: Calumnies, the alleged shipment of weapons from Cuba to North Korea: Fidel Castro",2013-07-29,-0.9042,Jornada,-0.4404
La Jornada: The electoral campaign control model does not guarantee equity: counselor,2013-07-29,-0.8225,Jornada,-0.1877
La Jornada: The PAN leadership proposes a second round to elect the national leader,2013-07-29,-0.8519,Jornada,0.0
La Jornada: US kidnapping suspect arrested,2013-07-29,0.3818,Jornada,-0.6486
"La Jornada: Defending natural resources, necessary to maintain sovereignty: former ambassador of Bolivia",2013-07-29,-0.886,Jornada,0.3612
La Jornada: SG's control body takes years to resolve complaints,2013-07-29,-0.6597,Jornada,-0.0258
"La Jornada: Party alliances helped Morena, says Lopez Obrador",2013-07-29,0.6808,Jornada,0.4019
La Jornada: Traveling holder of SRE to Turkey,2013-07-29,0.0,Jornada,0.0
"La Jornada: In 30 days, 48 ​​people have lost their lives in the violent entity",2013-07-29,-0.8591,Jornada,-0.7351
La Jornada: Arrasa Soriana green area in Cuernavaca,2013-07-29,-0.8442,Jornada,0.0
La Jornada: Pésame de Peña Nieto,2013-07-29,0.0,Jornada,0.0
La Jornada: Fumigarán coffee plantations with Mexican biofungicides that do not damage organic grain,2013-07-29,-0.296,Jornada,0.3875
La Jornada: Chain with history of abuses and electoral complicity with the PRI,2013-07-29,-0.4588,Jornada,-0.5574
La Jornada: Recordings of telephone numbers not tested: TEPJF,2013-07-29,0.0,Jornada,0.0
"La Jornada: The pact, pending to be reactivated, but still valid: Camacho Quiroz",2013-07-29,0.1027,Jornada,0.0
La Jornada: Prevent stagnation in maize production for the next seven years,2013-07-29,-0.8316,Jornada,0.0258
La Jornada: General Gutiérrez Rebollo will go to a house of the Sedena,2013-07-29,-0.9868,Jornada,0.0
La Jornada: Rejects PRI conditions of opposition to energy reform,2013-07-29,0.6369,Jornada,-0.2732
La Jornada: A high command of the Navy is killed in Michoacán,2013-07-29,-0.8658,Jornada,-0.6705
La Jornada: Four people killed in Acapulco,2013-07-29,-0.6249,Jornada,-0.6705
La Jornada: Eliminate reference to the southern border in a bulletin about meeting with Napolitano,2013-07-29,0.8225,Jornada,0.0
La Jornada: Lack of severity of IFE against tricolor fraud,2013-07-29,-0.9403,Jornada,-0.7269
"La Jornada: In AN, we must all change: Diego",2013-07-29,-0.4939,Jornada,0.0
