article,pub_date,nltk_score,source,nltk_score_title
"La Jornada: Vete Alí, corean miles de yemeníes en las calles de Saná, Adén y Taiz",2011-04-07,0.4215,Jornada,0.0
La Jornada: Divulgan video en que el candidato favorito Ollanta Humala elogia a Sendero Luminoso,2011-04-07,0.296,Jornada,0.7506
"La Jornada: Divididos y desorganizados, los rebeldes condenan el desempeño de la OTAN",2011-04-07,-0.8689,Jornada,-0.6808
La Jornada: Ni Berlusconi ni Ruby se presentan al juicio en Milán,2011-04-07,-0.8779,Jornada,0.0
La Jornada: Encuentran las Abuelas de Plaza de Mayo a la nieta número 103,2011-04-07,0.0,Jornada,0.0772
La Jornada: En julio se revisará la apelación de Assange,2011-04-07,-0.6908,Jornada,0.0
La Jornada: Deploran Obama y Karzai quema del Corán,2011-04-07,-0.7351,Jornada,0.0
"La Jornada: Por detención, Berlín cita a embajador chino",2011-04-07,0.0,Jornada,-0.3612
La Jornada: Buscan evitar otra explosión por la acumulación de hidrógeno en la planta nuclear de Fukushima,2011-04-07,0.0,Jornada,-0.296
La Jornada: Ataques a campos petroleros,2011-04-07,-0.296,Jornada,-0.4404
La Jornada: Luz verde a eventual relección de Ortega,2011-04-07,0.0,Jornada,0.0
La Jornada: Tropas francesas de la ONU rescatan al embajador de Japón en Costa de Marfil,2011-04-07,-0.8689,Jornada,0.5106
La Jornada: Naufragio en Lampedusa; 150 muertos,2011-04-07,0.0,Jornada,-0.6486
La Jornada: Controversia constitucional contra contratos incentivados en Pemex,2011-04-07,0.8074,Jornada,0.3612
"La Jornada: Orgullosa de ser mexicana, 81% de la población",2011-04-07,0.4404,Jornada,0.4767
La Jornada: Rechaza SCJN a gasera que buscaba eludir obligaciones,2011-04-07,0.1531,Jornada,-0.6597
"La Jornada: Sí son nuestros muertos, no es nuestra guerra, expresaron en el mitin del DF",2011-04-07,-0.9924,Jornada,0.1396
La Jornada: Creará esclavos modernos la iniciativa de reforma laboral del PRIAN: expertos,2011-04-07,-0.2732,Jornada,0.0
La Jornada: Kaibiles dan entrenamiento militar a zetas en Guatemala,2011-04-07,-0.2732,Jornada,0.0
"La Jornada: La información no debe usarse en forma abusiva, dice ex colaborador de Assange",2011-04-07,-0.8807,Jornada,0.4717
La Jornada: La averiguación no es contundente sobre el móvil del multihomicidio,2011-04-07,-0.9854,Jornada,0.0
La Jornada: OCDE recomienda desaparecer la SRA,2011-04-07,0.0,Jornada,0.2263
"La Jornada: Desertor, el militar que falte tres días",2011-04-07,0.1779,Jornada,-0.296
"La Jornada: Álvaro Uribe intenta limpiar su imagen de criminal, señala ONG",2011-04-07,0.3818,Jornada,-0.1779
"La Jornada: Violencia, factor que inhibe el crecimiento, acepta Carstens",2011-04-07,-0.9313,Jornada,-0.2732
"La Jornada: Traición de Jesús Ortega, informar a EU sobre diferencias en el PRD: Padierna",2011-04-07,-0.2732,Jornada,-0.5859
La Jornada: Ratifica el TEPJF la multa de $113 millones contra Tv Azteca por violaciones a la ley,2011-04-07,0.4215,Jornada,-0.3818
"La Jornada: Nada más qué hacer en SG, señala el SME",2011-04-07,0.0,Jornada,0.0
La Jornada: Diputados exentan de ISR pensiones de no más de 25 minisalarios; oposición del PAN,2011-04-07,-0.1531,Jornada,-0.2023
La Jornada: El estamos hasta la madre se propaga en Argentina y España,2011-04-07,-0.9792,Jornada,0.0
La Jornada: Muestra de cobardía: Calderón,2011-04-07,0.0,Jornada,0.0
"La Jornada: Nos traicionaron quienes estaban cerca, dice AMLO; confirma el encuentro con Garza",2011-04-07,-0.9427,Jornada,-0.6124
La Jornada: Calderón debe escuchar a la sociedad: PRI,2011-04-07,-0.7783,Jornada,0.0
"La Jornada: En 21 estados, miles de personas exigen: ni un muerto más",2011-04-07,-0.5719,Jornada,0.4869
"La Jornada: Inegi: en declive, la percepción de los mexicanos sobre seguridad pública",2011-04-07,0.9217,Jornada,0.4215
La Jornada: Acuerdan calendario para el repliegue de efectivos federales en cuatro estados,2011-04-07,0.5267,Jornada,0.3818
"La Jornada: Que no anide el crimen en sus filas, pide Sicilia a las fuerzas armadas",2011-04-07,-0.936,Jornada,0.431
"La Jornada: Desde 2015, reducción sostenida de la violencia, vaticina García Luna",2011-04-07,-0.7906,Jornada,-0.6249
La Jornada: Mujeres chiapanecas en resistencia alertan sobre la creciente violencia en la entidad,2011-04-07,-0.9136,Jornada,-0.5859
La Jornada: En cuestiones sustantivas de la PGR no valdrá la postura del Presidente: Morales,2011-04-07,0.872,Jornada,0.0
"La Jornada: Sacan hasta 61 cuerpos de dos narcofosas localizadas en San Fernando, Tamaulipas",2011-04-07,-0.8658,Jornada,0.0
"La Jornada: Niveles sin precedente de violencia en México, advierte el director de la FBI",2011-04-07,-0.9954,Jornada,-0.6705
La Jornada: Legisladores ponen en duda las previsiones,2011-04-07,0.1027,Jornada,0.0
La Jornada: Se plantea en Cancún crear centro continental de inteligencia policiaca,2011-04-07,0.8225,Jornada,0.6369
"La Jornada: Policías federales encañonan a edil de Juárez en un retén; coordinación, exige Murguía",2011-04-07,-0.836,Jornada,0.0
"La Jornada: En vez de dar pasos concretos, el gobierno busca tapar problemática migratoria, acusan",2011-04-07,0.128,Jornada,-0.2023
La Jornada: Plagio de una iniciativa provoca escandalosa escaramuza en San Lázaro,2011-04-07,-0.5267,Jornada,-0.6908
La Jornada: La Federación y Morelos crean grupos multidisciplinarios para indagar el caso,2011-04-07,0.34,Jornada,0.2732
La Jornada: Reclaman justicia para Miguel Hernández,2011-04-07,-0.9876,Jornada,0.5267
La Jornada: Evocan a Héctor Mendoza con música en vivo y extractos de sus obras,2011-04-07,0.4588,Jornada,0.0
La Jornada: Impulsan propuesta alternativa a la cancelación del Año oficial de México en Francia,2011-04-07,0.296,Jornada,0.0
La Jornada: Leonora Carrington eligió vivir en un estado creativo que hoy nos exalta: Poniatowska,2011-04-07,0.6249,Jornada,0.4404
La Jornada: Diputada priísta deja curul en Hidalgo,2011-04-07,0.0,Jornada,0.0
La Jornada: Se reunirá Ángel Aguirre con los opositores a la presa La Parota,2011-04-07,-0.1027,Jornada,0.0
La Jornada: Se deslinda la IP de Acosta Naranjo,2011-04-07,0.5423,Jornada,0.0
La Jornada: Pide Eruviel Ávila apoyo a Elba Esther Gordillo y al SNTE para ganar elección,2011-04-07,-0.8519,Jornada,0.7579
La Jornada: Morelos: proponen mando policiaco único,2011-04-07,0.34,Jornada,0.0
La Jornada: Llegan más mexicanos deportados a Juárez,2011-04-07,0.3182,Jornada,0.0
La Jornada: Aprueban plebiscito en Oaxaca,2011-04-07,-0.296,Jornada,0.4215
La Jornada: Con Moreira aumentó crimen en Coahuila: AN,2011-04-07,0.0,Jornada,-0.34
La Jornada: Ganaderos exigen a Liconsa pagar más por la leche,2011-04-07,-0.25,Jornada,-0.2263
La Jornada: Crecen robo de autos y ejecuciones en NL,2011-04-07,-0.0516,Jornada,0.0
La Jornada: Reducen explotación de acuíferos,2011-04-07,0.4939,Jornada,0.0
La Jornada: Guerrero: acusan a 38 ex ediles por desfalcos,2011-04-07,0.0,Jornada,-0.5267
La Jornada: Declaran desastre por incendios en Coahuila,2011-04-07,-0.9042,Jornada,-0.7579
La Jornada: Presunta injerencia del narco en conflicto entre comuneros y minera en Michoacán,2011-04-07,-0.1779,Jornada,-0.3182
La Jornada: Agradece obispo haber sido enviado a Culiacán,2011-04-07,0.0,Jornada,0.4404
La Jornada: Alerta la OMS sobre riesgos del mal uso de antibióticos,2011-04-07,-0.7269,Jornada,-0.3612
La Jornada: Reportan daño sin precedente a la capa de ozono en el invierno pasado,2011-04-07,-0.8225,Jornada,-0.4939
"La Jornada: Facultad de Medicina Veterinaria y Zootecnia, de la UNAM, entre las 44 mejores del orbe",2011-04-07,-0.1027,Jornada,0.6369
La Jornada: Estudian programa de apoyo a ninis el gobierno capitalino y la UNAM,2011-04-07,-0.5719,Jornada,0.4019
La Jornada: Genera posturas encontradas la presentación de Masagro,2011-04-07,0.3182,Jornada,0.0
La Jornada: Necesitamos un gran acuerdo donde todos escribamos las reglas: Pagés,2011-04-07,-0.8957,Jornada,0.0
"La Jornada: De cada 100 mexicanos mayores de 15 años, 40 tienen rezago educativo: INEA",2011-04-07,0.6597,Jornada,0.0
"La Jornada: Renovar la SEP según los valores que le dio Vasconcelos, plantea Lujambio",2011-04-07,-0.8176,Jornada,0.4019
"La Jornada: Eduardo Bárzana García, nuevo integrante del equipo de Narro",2011-04-07,0.9349,Jornada,0.0
La Jornada: Presentan 33 recomendaciones a legisladores para impulsar reforma legal de medios,2011-04-07,-0.296,Jornada,0.4767
La Jornada: Ratifica Senado minuta sobre trata de personas,2011-04-07,-0.2023,Jornada,0.0
La Jornada: Evalúan convenio de seguridad social,2011-04-07,0.7351,Jornada,0.6808
La Jornada: Instalan Moreno Valle y González Zarur el Consejo Metropolitano,2011-04-07,-0.128,Jornada,0.0
La Jornada: Farmacias retirarán productos milagro,2011-04-07,-0.4404,Jornada,0.5859
La Jornada: Cayó el dólar a su menor nivel en 30 meses,2011-04-07,0.25,Jornada,-0.3818
La Jornada: Asignará Pemex a la IP el bombeo de crudo pesado en la sonda de Campeche,2011-04-07,0.2732,Jornada,0.0
La Jornada: Defiende MVS derecho a explotar espectro de la banda de 2.5 Ghz,2011-04-07,-0.7845,Jornada,-0.1027
La Jornada: Las cosas van a venir muy positivas; me lo dijo un pajarito: Calderón,2011-04-07,0.5423,Jornada,0.5984
La Jornada: Ifai revisará vandalismo contra Pemex,2011-04-07,-0.5574,Jornada,0.0
La Jornada: Proliferan litigios en las telecomunicaciones,2011-04-07,0.4019,Jornada,-0.2023
"La Jornada: Especialistas, empresarios y académicos confluirán en un foro sobre el tema",2011-04-07,0.2263,Jornada,0.0
La Jornada: Ausencia del Estado para regular el sector: expertos,2011-04-07,-0.3612,Jornada,0.0
La Jornada: Televisa comprará 50% de Iusacell en mil 600 mdd: según WSJ,2011-04-07,-0.25,Jornada,0.0
La Jornada: Firman México y Perú acuerdo de integración comercial,2011-04-07,0.886,Jornada,0.4939
