article,pub_date,nltk_score,source,nltk_score_title
"The Journey: Kim Jong-Un, great successor in the leadership of North Korea",2011-12-20,-0.9022,Jornada,0.7184
La Jornada: Arrest warrant for Iraqi vice-president,2011-12-20,0.4404,Jornada,-0.34
"La Jornada: Nearly 1,000 killed by typhoon in Philippines",2011-12-20,-0.5267,Jornada,-0.6705
"The Day: Repression continues in Egypt; 13 dead, 815 wounded and 120 detained in four days",2011-12-20,0.296,Jornada,-0.8625
Syria signs agreement with Arab League,2011-12-20,0.5994,Jornada,0.4939
La Jornada: Reform in the Cuban countryside,2011-12-20,0.0772,Jornada,0.0
La Jornada: Juan Manuel Santos visits Ecuador,2011-12-20,0.0,Jornada,0.0
La Jornada: Rousseff promises military resources,2011-12-20,0.0,Jornada,0.3818
La Jornada: Rajoy predicts deep reforms to straighten the economy of Spain,2011-12-20,-0.8689,Jornada,0.0
"La Jornada: Expert testifies that he found 10,000 diplomatic notes in Manning's computer",2011-12-20,-0.296,Jornada,0.0
La Jornada: More than 100 journalists killed in the year,2011-12-20,0.0,Jornada,-0.6705
La Jornada: US invasion of Panama 22 years ago,2011-12-20,0.0,Jornada,0.0
La Jornada: Iñaki Urdangarin won a public contest in Islas Baleares before submitting his proposal,2011-12-20,-0.25,Jornada,0.5719
La Jornada: EU to continue listening to Venezuela's relationship with Iran: Obama,2011-12-20,0.5574,Jornada,0.0
La Jornada: Arrest of Bolivian governor ordered,2011-12-20,0.0,Jornada,-0.34
"La Jornada: Reopen the Cathedral of Veracruz, after two years of rejuvenation",2011-12-20,0.0,Jornada,0.0
La Jornada: National Science and Arts Awards presented in a ceremony,2011-12-20,-0.7906,Jornada,0.4588
La Jornada: Felipe Calderón recalled his youthful daring: I was a furious opponent,2011-12-20,-0.3818,Jornada,0.0258
La Jornada: A foundation will give Internet access to the Fernando Benítez collection,2011-12-20,0.25,Jornada,0.0
La Jornada: Auction works to defend Wirikuta,2011-12-20,-0.9118,Jornada,0.0
La Jornada: Recover 14 corpses from a platform that sank,2011-12-20,0.0258,Jornada,0.0
"La Jornada: Without social protection, 5,100 million: ILO",2011-12-20,0.0,Jornada,0.0
La Jornada: GB approves measures to reorganize banks,2011-12-20,0.5574,Jornada,0.4019
La Jornada: Sacyr to sell stake in Repsol,2011-12-20,0.25,Jornada,0.0
La Jornada: Closes the BMV with a drop of 1.29%,2011-12-20,0.4939,Jornada,-0.2732
La Jornada: Peligra in US tax reduction plan,2011-12-20,0.128,Jornada,0.0
La Jornada: Global risk persists,2011-12-20,-0.9776,Jornada,-0.2732
La Jornada: Recover 4 million dollars of defrauded Latinos,2011-12-20,-0.296,Jornada,0.0
La Jornada: Italian unions call for strikes,2011-12-20,0.0,Jornada,-0.3612
"La Jornada: Mexican Banking, ""armored against a crisis in the euro zone"": ABM",2011-12-20,0.9118,Jornada,-0.6249
"La Jornada: Saab, in bankruptcy",2011-12-20,0.0,Jornada,0.0
La Jornada: It will give Europe 150 billion euros to the IMF for bailouts,2011-12-20,-0.8402,Jornada,0.0
La Jornada: Cofetel endorses 400 broadcasting concessions,2011-12-20,-0.4939,Jornada,0.34
La Jornada: Three feminicides in Ciudad Juárez,2011-12-20,-0.875,Jornada,0.0
La Jornada: Re-install police officers who failed examination,2011-12-20,0.0,Jornada,-0.5106
La Jornada: Condition exemption of tenure in Edomex,2011-12-20,-0.8176,Jornada,0.0
La Jornada: Affected by Pemex explosion in Puebla still awaiting compensation,2011-12-20,-0.8481,Jornada,-0.1531
La Jornada: Agrarian leader and his wife disappear in Michoacán,2011-12-20,-0.5267,Jornada,-0.2263
La Jornada: Chiapas: investigate threats against Velasco Coello,2011-12-20,0.5859,Jornada,-0.4215
La Jornada: PF agent injures teacher,2011-12-20,0.0,Jornada,0.0
La Jornada: Five children injured by blisters,2011-12-20,-0.296,Jornada,-0.4019
La Jornada: Woman escapes from kidnapper in La Yesca,2011-12-20,-0.4767,Jornada,0.128
La Jornada: Snowfall in 13 municipalities of Chihuahua,2011-12-20,0.0,Jornada,0.0
The Journey: Aguinaldo of $ 300 thousand for Marco Adame,2011-12-20,0.0,Jornada,0.0
La Jornada: $ 450 million missing in SSA-Nayarit,2011-12-20,-0.8176,Jornada,-0.296
La Jornada: Coahuila: changes in the security cabinet,2011-12-20,0.3818,Jornada,0.34
La Jornada: Zacatecas communities abandoned due to drought and crime,2011-12-20,-0.7269,Jornada,-0.7579
La Jornada: Discover in the tree of latex effective compounds for the treatment of HIV,2011-12-20,0.4404,Jornada,0.4767
La Jornada: Persistent discrimination against women in Latin America,2011-12-20,0.5994,Jornada,0.0
La Jornada: Program to deport criminal immigrants must disappear,2011-12-20,0.0,Jornada,-0.6486
La Jornada: Government and Veracruz sign agreement on security agreement,2011-12-20,0.5859,Jornada,0.8316
"La Jornada: Articular plans and resources of the UNAM, task of Hernández Bringas",2011-12-20,0.4404,Jornada,0.0
La Jornada: There will be a restructuring in shops and pharmacies Issste: Hidalgo Monroy,2011-12-20,0.0516,Jornada,0.0
La Jornada: Defined the PAN position of candidates in the ballots for the internal election,2011-12-20,-0.4939,Jornada,0.0
La Jornada: Calderón leaves without solving mining conflict,2011-12-20,-0.4215,Jornada,-0.0191
La Jornada: 2 thousand 268 people died when facing the military: Sedena,2011-12-20,-0.3182,Jornada,-0.5574
La Jornada: Arraigan to 12 police of case Ayotzinapa,2011-12-20,-0.4939,Jornada,0.0
La Jornada: Leaders of the FEG do not attend to declare for the murders,2011-12-20,-0.5423,Jornada,-0.6124
"La Jornada: Small producers of milk, on the edge of the razor",2011-12-20,0.4939,Jornada,0.0
La Jornada: Priístas rebel for concessions to Panal in the alliance Commitment for Mexico,2011-12-20,0.6597,Jornada,0.25
"La Jornada: No agreements, meeting to win political trial against governor of Guerrero",2011-12-20,-0.7964,Jornada,0.5719
"La Jornada: PF, indispensable tool for public safety, says García Luna",2011-12-20,0.9081,Jornada,0.4215
La Jornada: They accuse the federal government of drawing up blacklists of workers in Canada,2011-12-20,-0.7906,Jornada,-0.2023
"La Jornada: The undersecretary of Public Security of QR, an ex-convict accused of links with narco",2011-12-20,0.2732,Jornada,0.0516
La Jornada: Fox proposes great crusade for peace,2011-12-20,-0.7579,Jornada,0.8225
La Jornada: Dismantled in Washington cell linked to the La Familia cartel,2011-12-20,-0.8807,Jornada,0.0
"La Jornada: Since April, 282 bodies exhumed from clandestine graves in Durango",2011-12-20,0.0258,Jornada,-0.296
La Jornada: US Attorney to Appear Again for Operation Fast and Furious,2011-12-20,0.6808,Jornada,-0.5719
La Jornada: Vázquez Mota assures that he has the sympathy of the majority of his party,2011-12-20,0.8316,Jornada,0.7579
La Jornada: Order the Ifai to the Navy to disseminate list of drugs and seized objects,2011-12-20,-0.2023,Jornada,0.0
La Jornada: The 2006 campaign prevented death: AMLO,2011-12-20,-0.9912,Jornada,-0.5859
"La Jornada: Prison to Salazar Mendiguchía, by order of the government: defense",2011-12-20,-0.9869,Jornada,-0.4215
"La Jornada: Reta Cordero to Peña Nieto to discuss economics; PRI, guilty of the crisis, says",2011-12-20,-0.5106,Jornada,-0.7845
