article,pub_date,nltk_score,source,nltk_score_title
Astronomers tracked down asteroid to Earth,2009-03-31,-0.296,Jornada,0.0
"La Jornada: European Volunteers, in test of manned flight to Mars",2009-03-31,-0.4215,Jornada,0.0
La Jornada: Propose plan to bring water from the Red Sea to the Dead through a tunnel,2009-03-31,0.4939,Jornada,-0.6486
La Jornada: Building a space center in Chetumal,2009-03-31,0.0,Jornada,0.0
The Day: Statins Prevent Cardiovascular Evils,2009-03-31,0.0,Jornada,-0.5574
La Jornada: Armed group attacks with police grenades in the Michoacán rancheria; Four dead,2009-03-31,-0.5106,Jornada,-0.802
La Jornada: Exempt TV stations from illegal sale of spaces to the PVEM,2009-03-31,-0.9468,Jornada,-0.4939
La Jornada: Social pressure will allow today to be an opinion of law of extinction of dominion,2009-03-31,0.8979,Jornada,-0.0772
La Jornada: PGR helicopter crashes,2009-03-31,0.4939,Jornada,0.0
"La Jornada: Error, to say that Mexico is failed State: Kerry",2009-03-31,-0.8316,Jornada,-0.7184
La Jornada: Calderón dismisses possible joint military operations with the United States,2009-03-31,-0.9413,Jornada,0.4215
"La Jornada: Define the location of the refinery, demand",2009-03-31,0.128,Jornada,-0.128
La Jornada: Advancing the delivery of $ 11 billion to states to deal with the crisis,2009-03-31,-0.5267,Jornada,-0.6249
"La Jornada: Women, 5% of the prison population",2009-03-31,0.3182,Jornada,-0.5106
"La Jornada: Between disagreements, the PRD candidate's candidacy for the Chamber of Deputies ends",2009-03-31,-0.5267,Jornada,-0.4215
La Jornada: Border Commanders of US and Mexican armies meet,2009-03-31,0.1027,Jornada,0.0
La Jornada: The SSP seeks to integrate 10 thousand graduates to the intelligence system,2009-03-31,0.7845,Jornada,0.4767
La Jornada: The rumor of the monarchy caught the Mexican delegation in London,2009-03-31,0.0,Jornada,0.0
La Jornada: Approves the 15-day extension IFE to appoint candidates to San Lázaro,2009-03-31,0.4588,Jornada,0.4019
La Jornada: Reprobate Obama deputies have compared Calderón to Eliot Ness,2009-03-31,-0.6249,Jornada,0.0
La Jornada: New head of AFI,2009-03-31,0.0,Jornada,0.0
La Jornada: The PGR can retry checking Luis Echeverría is guilty,2009-03-31,-0.9468,Jornada,-0.4215
La Jornada: Construction of two maximum security penalties announced in Sinaloa and Veracruz,2009-03-31,0.6369,Jornada,0.34
La Jornada: Confirmed AN to Ramírez Acuña and César Nava as candidates,2009-03-31,0.128,Jornada,0.0
La Jornada: Napolitano and Holder come to a forum,2009-03-31,0.34,Jornada,0.0
La Jornada: $ 147 million spent on promotional monitoring,2009-03-31,0.6124,Jornada,0.0
La Jornada: Old-age priests and their offshoots tops multi-member lists,2009-03-31,0.4939,Jornada,0.5106
La Jornada: Osorio Chong denounced for illegal detention of peasants,2009-03-31,0.3612,Jornada,-0.7269
La Jornada: Neighbors ask to be replaced by defective homes,2009-03-31,0.0258,Jornada,-0.4404
La Jornada: They demand to find a campesino allegedly disappeared by police in Veracruz,2009-03-31,0.0,Jornada,-0.34
La Jornada: The Edomex Church is on the campaign trail,2009-03-31,-0.296,Jornada,0.0
La Jornada: Purging continues in the UAG,2009-03-31,0.3182,Jornada,0.0
La Jornada: Former secretary of Peña Nieto goes through Toluca,2009-03-31,0.296,Jornada,0.0
"La Jornada: Bárbara Botello, PRI and PT candidate in León",2009-03-31,-0.4404,Jornada,0.0
La Jornada: Nominates Convergence candidate in Colima,2009-03-31,0.0,Jornada,0.0
La Jornada: Health Celebration of Jalisco the anti-abortion law,2009-03-31,-0.9231,Jornada,0.0
La Jornada: Rector of the Automata de Morelos calls for funds,2009-03-31,0.0,Jornada,0.0
La Jornada: Ferromex denounced before the PGR to settlers and authorities of Zacatecas,2009-03-31,-0.3182,Jornada,0.0
La Jornada: They accuse the federal government of jockeying for the countryside,2009-03-31,0.0258,Jornada,-0.2023
La Jornada: Cañeros occupy an ingenuity in Zacatepec,2009-03-31,0.0516,Jornada,0.0
La Jornada: Naufragan boats with undocumented,2009-03-31,0.0,Jornada,0.0
La Jornada: EU abandons expression against terrorism,2009-03-31,0.0,Jornada,-0.7845
La Jornada: Police ambush trying to recover Himalaya mine in Bolivia,2009-03-31,-0.5106,Jornada,0.0
La Jornada: Fidel Castro meets two years with his Reflections,2009-03-31,0.2263,Jornada,0.0
La Jornada: Ghostnet spy network still active,2009-03-31,0.0,Jornada,0.4019
"The Journey: Israel: rumors, civilian casualties in Gaza",2009-03-31,0.0,Jornada,0.0
La Jornada: Version of died in an attack in Dubai Chechen Sulim Yamadayev,2009-03-31,-0.9618,Jornada,-0.7717
"La Jornada: Arab League, against arrest warrant for Bashir",2009-03-31,0.0,Jornada,-0.34
La Jornada: Right-wing referendum of the PP the plan of government of the socialist Patxi López,2009-03-31,0.4019,Jornada,0.0
"La Jornada: For US to reach out, Cuba must commit to democracy: Biden",2009-03-31,-0.7184,Jornada,0.3182
"La Jornada: About 20 injured and almost 80 arrested, balance of the Day of the Young Combatant in Chile",2009-03-31,-0.7269,Jornada,-0.6728
La Jornada: Attack on a police camp in Punjab; At least 12 dead and 90 wounded,2009-03-31,-0.8375,Jornada,-0.8126
"The Journey: US Sergeant, convicted of 4 murders in Iraq",2009-03-31,-0.7845,Jornada,-0.6124
La Jornada: Awards Instituto Carso to doctors for their work in favor of well-being,2009-03-31,0.0,Jornada,0.6908
The Journey: Chrysler makes an alliance with Fiat that would allow it to receive US $ 6 thousand,2009-03-31,0.5719,Jornada,0.2263
The Journey: Obama limits new aid to Chrysler and GM; Could bankrupt them,2009-03-31,-0.9705,Jornada,-0.5574
Weatherford signs agreement with Pemex for $ 646 million,2009-03-31,0.4588,Jornada,0.4939
The Day: Cobus suspends its service to Aerolitoral; Owes you $ 28 million,2009-03-31,0.0,Jornada,0.0
La Jornada: Urgen industrial fasten the application of resources for infrastructure,2009-03-31,-0.5106,Jornada,0.0
La Jornada: Oil market stable ... for now,2009-03-31,-0.9769,Jornada,0.296
La Jornada: Public sector revenues fell 6.7% in January-February,2009-03-31,-0.2023,Jornada,0.0
La Jornada: Bags plunge for concerns over automotive and banking sectors,2009-03-31,-0.5267,Jornada,0.0
The Day: GM considers bankruptcy to achieve financial viability,2009-03-31,-0.4939,Jornada,0.0
"The Journey: Tomorrow, the test Link",2009-03-31,0.0,Jornada,0.0
La Jornada: Gómez Urrutia dismissed as mining leader,2009-03-31,-0.5267,Jornada,0.0
La Jornada: Drug traffickers ally from Mexico and Italy: Saviano,2009-03-31,-0.9828,Jornada,0.0
La Jornada: Rectors and experts are called to open new universities,2009-03-31,-0.6908,Jornada,0.0
"La Jornada: Invariable, the policy on condom use: Secretary of Health",2009-03-31,0.128,Jornada,0.0
"La Jornada: They promote relationships between young people, free of violence",2009-03-31,-0.8834,Jornada,0.2023
"La Jornada: Security, employment for their parents and social work, demand parliamentary children",2009-03-31,-0.9565,Jornada,0.2263
La Jornada: Evaluate revacunar against pertussis by outbreaks in northern states of the country,2009-03-31,0.0258,Jornada,0.0
"La Jornada: On quiet election day, UNAM renews councils",2009-03-31,-0.5719,Jornada,0.0
La Jornada: Increase of 4.9% conspires strike in the Sutin,2009-03-31,-0.3612,Jornada,0.2023
La Jornada: Low return of migrants to Mexico: SG,2009-03-31,0.0,Jornada,-0.2732
La Jornada: Cuba perseveres in bringing together aesthetics and cultures,2009-03-31,0.4404,Jornada,0.0
La Jornada: Rodrigo Moya documented the joy of utopia in Cuba 45 years ago,2009-03-31,0.875,Jornada,0.5859
La Jornada: Apoteósico return of Manuel Mendive in the tenth artistic meeting,2009-03-31,0.9451,Jornada,0.0
