article,pub_date,nltk_score,source,nltk_score_title
Questions for Congress and Hollywood About Fracking,2011/02/16,0.946,ProPublica,0.0
ProPublica 2010 Annual Report Now Available,2011/02/16,0.9711,ProPublica,0.0
Overview of Middle East Crackdowns and the (Varying) U.S. Responses to Each,2011/02/16,-0.9989,ProPublica,0.0
"Credibility Shaken, Hedge Funds Are Punished by Investors",2011/02/16,-0.9917,ProPublica,-0.5106
The Reform for Disabled Borrowers That the Education Dept. Refuses to Adopt,2011/02/16,0.9778,ProPublica,0.1779
