article,pub_date,nltk_score,source,nltk_score_title
"La Jornada: News International ordered to delete hundreds of mails, declares company to GB Parliament",2011-08-02,-0.6705,Jornada,0.0
La Jornada: Special Norwegian unit to investigate attacks,2011-08-02,0.0,Jornada,-0.0516
La Jornada: UN Security Council condemns condemnation of Syrian regime,2011-08-02,-0.7096,Jornada,-0.6908
"La Jornada: Gaddafi, grateful for Venezuela's support: Chávez",2011-08-02,-0.4767,Jornada,0.6908
The Journey: Evicts the Egyptian army Tahrir Square; The trial against Mubarak begins tomorrow,2011-08-02,0.0,Jornada,0.0
La Jornada: The government of Cuba confirms intention to facilitate trips of citizens abroad,2011-08-02,-0.3612,Jornada,0.0
La Jornada: Argentina: Social organizations protest over repression that left 4 dead in Jujuy,2011-08-02,-0.6369,Jornada,-0.836
La Jornada: Russian federal government is asked to provide subsidy of 140 thousand mdd for the North Caucasus,2011-08-02,-0.7269,Jornada,0.0
La Jornada: US bombing leaves 4 dead in Pakistan,2011-08-02,0.0,Jornada,-0.6486
La Jornada: France unlocks Libyan government assets and makes them available to opponents,2011-08-02,0.25,Jornada,0.1779
The Journey: Violence in the Chinese region of Xinjiang,2011-08-02,0.0,Jornada,-0.6249
La Jornada: 17 young people arrested in Chile for placing barricades,2011-08-02,0.0,Jornada,-0.4767
La Jornada: The Axial label adds three new titles to its fund; Has been in the market for three years,2011-08-02,0.0,Jornada,0.0
"La Jornada: Fortunately, it's only a year before this government changes: Vargas",2011-08-02,-0.1027,Jornada,0.0
"La Jornada: With a sample, they pay homage to Giuseppe Verdi for 110 years of his death",2011-08-02,-0.4767,Jornada,-0.6486
La Jornada: Writing about violence trastoca the official information,2011-08-02,-0.8834,Jornada,-0.6249
La Jornada: De Bernal received the Fine Arts Medal,2011-08-02,-0.0772,Jornada,0.5994
La Jornada: Sectur to promote medical tourism to Mexico,2011-08-02,0.0772,Jornada,0.3818
La Jornada: Remittances pick up in June; Rose 6.9%: BdeM,2011-08-02,0.0,Jornada,0.0
La Jornada: The brake would have an impact on Mexican industry,2011-08-02,-0.4019,Jornada,0.0
La Jornada: Disenchantment of former socialists,2011-08-02,0.8834,Jornada,0.0
"The Day: Krugman: With the agreement to raise the debt, Obama surrendered",2011-08-02,0.802,Jornada,0.1779
La Jornada: Content of the plan,2011-08-02,0.0516,Jornada,0.0
La Jornada: Analysts predict growth in manufacturing activity in US,2011-08-02,-0.5106,Jornada,0.3818
La Jornada: Cofetel announces regulatory plan in the telecommunications area,2011-08-02,0.0,Jornada,0.0
La Jornada: The local economy lacks momentum: Coparmex,2011-08-02,0.4404,Jornada,0.0
"La Jornada: No change, forecast of GDP advance: Treasury",2011-08-02,0.5423,Jornada,-0.1027
La Jornada: SCT plans to tender MVS spectrum,2011-08-02,-0.765,Jornada,0.0
La Jornada: Pay with retaso to doctors of Guerrero,2011-08-02,0.0516,Jornada,-0.1027
La Jornada: Religious of Chilón complain about works,2011-08-02,0.0,Jornada,-0.3612
La Jornada: Risk of overflows in at least 13 municipalities of Veracruz,2011-08-02,0.0,Jornada,-0.2732
"La Jornada: Legal, give Leon's treasury to private schools: mayor",2011-08-02,0.2732,Jornada,0.3182
"La Jornada: Poor, almost half of Guanajuatans",2011-08-02,0.0,Jornada,-0.4767
La Jornada: Accept Guerrero care for human rights NGOs,2011-08-02,0.7184,Jornada,0.7003
La Jornada: Genoveno Figueroa Zamudio will be the candidate of the PRD in Morelia,2011-08-02,-0.9524,Jornada,0.0
La Jornada: Annuling only 54 boxes in the state of Mexico,2011-08-02,-0.296,Jornada,0.0
"La Jornada: The water agency of Coacalco, broken for lack of payment: mayor",2011-08-02,-0.4404,Jornada,-0.6597
La Jornada: Protest rejected students from universities of Guerrero and Nayarit,2011-08-02,0.0516,Jornada,-0.6486
The day: Ivonne Ortega presents her fourth report,2011-08-02,-0.296,Jornada,0.0
La Jornada: First transcontinental flight Mexico-Madrid with biofuel,2011-08-02,0.0772,Jornada,0.0
La Jornada: Ask the caravan to the government that is no longer the US gendarme,2011-08-02,0.2732,Jornada,-0.296
"La Jornada: With an enrollment of 230 students starts this month the ENES, León unit",2011-08-02,0.5574,Jornada,0.0
La Jornada: Tablajeros and ranchers get 30% profit with clenbuterol: experts,2011-08-02,-0.7184,Jornada,0.4404
La Jornada: Support of the Pastoral of Puebla,2011-08-02,-0.296,Jornada,0.4019
La Jornada: Causes serious contraceptive effects for men,2011-08-02,-0.7964,Jornada,-0.0772
La Jornada: Cuba develops macroproject to tackle climate change,2011-08-02,-0.6249,Jornada,0.0
La Jornada: Create bacteria with the substitution of a part of the DNA by synthetic compound,2011-08-02,-0.5859,Jornada,0.2732
La Jornada: Rebellion in the PGR: 21 state delegates resign,2011-08-02,0.6249,Jornada,-0.4404
"La Jornada: Preserving jobs in Mexicana, offers Del Valle",2011-08-02,0.6124,Jornada,0.0
La Jornada: Denies SHCP allocating money to precampaña,2011-08-02,0.3818,Jornada,-0.4215
La Jornada: Enforced disappearances in Mexico at the level of those committed in dictatorships: AI,2011-08-02,-0.7717,Jornada,0.2732
La Jornada: Award for best safety plan in schools,2011-08-02,-0.6486,Jornada,0.8885
La Jornada: Three members of the Knights Templar,2011-08-02,0.0,Jornada,0.0
La Jornada: Coneval demand that the Popular Insurance check their impact on health,2011-08-02,-0.2732,Jornada,0.3182
"La Jornada: Cesar Repression of Miners, United Steelworkers asks Calderón",2011-08-02,-0.3818,Jornada,0.0516
"La Jornada: Air transport of wounded deputy cost $ 17,000",2011-08-02,-0.7351,Jornada,0.0
La Jornada: Diego ordered the massacre of young people in Salvárcar and rehabilitation centers: SSP,2011-08-02,0.34,Jornada,0.0
La Jornada: The chief of hired assassins of the Acapulco Independent Cartel falls,2011-08-02,-0.2023,Jornada,0.0
La Jornada: The dispute for the integration of the National Political Council begins in the tricolor,2011-08-02,-0.296,Jornada,-0.4019
La Jornada: The rules for directing the legislative body,2011-08-02,0.0,Jornada,0.0
La Jornada: Applauds Mexican government legal action against anti-immigrant law,2011-08-02,0.0,Jornada,0.4404
La Jornada: Elogia president of Colombia fight against Mexico narco,2011-08-02,-0.3612,Jornada,-0.3818
La Jornada: Bureaucrat reiterates request for audit against Issste director,2011-08-02,-0.6597,Jornada,0.0
La Jornada: The PRD will fight to preside over the board and the Board of Coordination in San Lázaro,2011-08-02,0.8402,Jornada,-0.3818
La Jornada: Found dead to niece of the head of Social Development of Nuevo Leon,2011-08-02,0.6486,Jornada,-0.6486
"La Jornada: In force, FTA between Mexico and Colombia",2011-08-02,0.0,Jornada,0.0
"La Jornada: In poverty, 53.8% of Mexican children; 11.7 million suffer from hunger",2011-08-02,-0.9729,Jornada,-0.8316
La Jornada: Citizen Movement will support in 2012 the best positioned: Walton,2011-08-02,0.8316,Jornada,0.7845
"La Jornada: The mafia of power pushed AN aside and now goes with the PRI, insists AMLO",2011-08-02,-0.7351,Jornada,0.0
