article,pub_date,nltk_score,source,nltk_score_title
Five New Orleans Cops Convicted for Their Role in Post-Katrina Shootings,2011/08/05,-0.9913,ProPublica,0.0
ProPublica Education Data Conference Call and Transcript,2011/08/05,1.0,ProPublica,0.0
"The Latest on Our Sputtering Economy, by the Numbers",2011/08/05,-0.5267,ProPublica,0.0
"This Week’s Top MuckReads: Medicaid Moguls, Destroying Evidence and the Madoff of the Midwest",2011/08/05,0.4253,ProPublica,-0.4215
Feds Say Major New York Gas Pipeline Poses Safety Risk,2011/08/05,-0.4947,ProPublica,0.1779
