article,pub_date,nltk_score,source,nltk_score_title
La Jornada: Procesan a presunto capo en Guatemala,2010-03-16,-0.296,Jornada,0.0
La Jornada: Asignan fondos para seguridad pública,2010-03-16,0.8225,Jornada,0.4215
La Jornada: Promueven en Chiapas la desintegración encubierta con planes de reordenamiento,2010-03-16,0.7184,Jornada,0.34
La Jornada: Decae efectividad de militares en la lucha contra el crimen organizado en Juárez,2010-03-16,0.34,Jornada,-0.7269
"La Jornada: Por mis posiciones, toda mi vida he sido incómodo para varios, dice Raúl Padilla",2010-03-16,-0.296,Jornada,-0.3818
La Jornada: Realizarán en El Paso segunda autopsia a los cuerpos de los tres ejecutados en Juárez,2010-03-16,-0.2732,Jornada,0.0
La Jornada: La OIT prepara tres recomendaciones a México por violaciones a derechos sindicales,2010-03-16,0.5267,Jornada,-0.5267
La Jornada: Padierna denuncia bloqueo al registro de su corriente de opinión en el PRD,2010-03-16,-0.743,Jornada,-0.6705
La Jornada: Cambios a la estrategia anticrimen,2010-03-16,0.296,Jornada,0.0
La Jornada: El Ejército y la policía federal redoblan la vigilancia en instalaciones de LFC,2010-03-16,0.0,Jornada,0.0
"La Jornada: Asesina la delincuencia organizada al menos a 56 personas; 20, en Chihuahua",2010-03-16,-0.7269,Jornada,-0.8481
La Jornada: Solidaridad de campesinos,2010-03-16,0.0,Jornada,0.0
"La Jornada: Un museo en renovación y algunos cultivos, últimos reductos de Zapata en Anenecuilco",2010-03-16,-0.6124,Jornada,0.0
La Jornada: Rastrea la Armada a presuntos zetas que huyeron de rancho en Nuevo León,2010-03-16,0.0772,Jornada,0.0
La Jornada: Reitera AMLO rechazo a alianzas,2010-03-16,0.8834,Jornada,-0.5423
"La Jornada: Hoy, Calderón regresa a Juárez",2010-03-16,-0.8689,Jornada,0.0
La Jornada: Preocupa al país la salud de Fariñas: SRE,2010-03-16,-0.3612,Jornada,-0.4215
La Jornada: Cartones,2010-03-16,0.0,Jornada,0.0
La Jornada: Pide Perry mayor apoyo,2010-03-16,0.0,Jornada,0.6369
La Jornada: Piden pesquisa a fondo sobre homicidio de periodista,2010-03-16,-0.6908,Jornada,-0.6908
La Jornada: Confrontación en el IFE sobre la cédula de identidad orilló a crear grupo de alto nivel,2010-03-16,0.7717,Jornada,-0.0516
La Jornada: Rechazan legisladores injerencia de la DEA en tareas de seguridad en México,2010-03-16,-0.9247,Jornada,0.0
La Jornada: Martín Esparza falsificó actas: Alejandro Muñoz,2010-03-16,0.0,Jornada,-0.3818
La Jornada: Exige la CIDH al Estado combatir homicidios de periodistas en México,2010-03-16,0.5267,Jornada,-0.7506
La Jornada: Dimiten defensores de Zhenli Ye Gon,2010-03-16,0.0,Jornada,0.5267
"La Jornada: Llegan a Ciudad Juárez equipos de FBI, DEA y otras agencias de EU",2010-03-16,-0.9477,Jornada,0.0
La Jornada: Ordena juez a la gasera Sempra Energy restituir terreno que se apropió en BC,2010-03-16,-0.4588,Jornada,0.5106
La Jornada: Consumidores cautivos de monopolios son base de fortunas,2010-03-16,-0.1531,Jornada,0.0
La Jornada: Serán secretos por 12 años datos sobre reservas de Chicontepec,2010-03-16,-0.875,Jornada,0.0
La Jornada: Congresistas de EU exigen a Obama medidas para enfrentar la manipulación monetaria china,2010-03-16,-0.875,Jornada,-0.5267
La Jornada: Preocupa a empresarios turísticos violencia en Acapulco,2010-03-16,-0.5574,Jornada,-0.4215
La Jornada: Venezuela venderá 80 mil barriles de crudo a Bielorrusia,2010-03-16,0.4939,Jornada,-0.5719
La Jornada: Prorroga SCT por diez años la concesión a Volaris; comienza a operar desde el AICM,2010-03-16,0.0,Jornada,0.128
La Jornada: La petrolera asiática CNOOC ingresa a AL,2010-03-16,0.0,Jornada,0.0
La Jornada: El riesgo de ser localizable,2010-03-16,-0.836,Jornada,-0.2732
"La Jornada: Vila-Matas propone un funeral paródico, festivo, de la era Gutenberg",2010-03-16,-0.1779,Jornada,0.128
La Jornada: Se analiza códice mexicano hallado en Andalucía,2010-03-16,0.0,Jornada,0.0
La Jornada: Suspende el INAH obra para rehabilitar calle en el centro de Oaxaca,2010-03-16,-0.6908,Jornada,0.0
La Jornada: Intento crear intimidad en un país que cambió de rostro: Rafael Gumucio,2010-03-16,0.8979,Jornada,0.2732
"La Jornada: Más que juzgar a las personas, quiero comprender, dice Tavares",2010-03-16,-0.9735,Jornada,0.0772
La Jornada: Los diarios necesitan agenda propia para hacer frente a medios electrónicos: Bastenier,2010-03-16,-0.5423,Jornada,0.0
La Jornada: Confirman vínculo entre variación bursátil e incidencia de infartos,2010-03-16,-0.9287,Jornada,-0.4404
La Jornada: Demanda grupo internacional más recursos para preservar especies en riesgo de extinción,2010-03-16,-0.7783,Jornada,-0.3818
La Jornada: La Auditoría Superior detectó anomalías en cuentas de Conapesca: Greenpeace,2010-03-16,-0.4588,Jornada,0.5423
"La Jornada: Merkel, satisfecha con la postura del Papa",2010-03-16,0.0,Jornada,0.4215
La Jornada: Disuelven un partido pedófilo en Holanda,2010-03-16,0.8126,Jornada,0.4019
La Jornada: Languidece importante plan panista que busca abatir el rezago educativo,2010-03-16,-0.7351,Jornada,-0.1531
La Jornada: Facebook abre oficina en India,2010-03-16,0.4939,Jornada,0.0
La Jornada: Complejo turístico pone en riesgo el parque marino Cabo Pulmo,2010-03-16,-0.296,Jornada,-0.2732
La Jornada: Más recursos al Seguro Popular,2010-03-16,0.0,Jornada,0.4215
La Jornada: Chiapas: detienen a 39 indocumentados,2010-03-16,0.3182,Jornada,-0.7717
La Jornada: Durante el puente creció el flujo de pasajeros en el aeropuerto capitalino,2010-03-16,0.4939,Jornada,0.0
La Jornada: Hay que adoptar política nacionalista para frenar los saqueos: investigadora,2010-03-16,-0.5423,Jornada,-0.296
La Jornada: Participarán ejércitos extranjeros amigos en el desfile de Independencia,2010-03-16,-0.3612,Jornada,0.4767
La Jornada: Se inconforma la CNC por decisión de Pemex,2010-03-16,0.0,Jornada,-0.4215
"La Jornada: La Iglesia católica debe ser más honrada, piden en Alemania",2010-03-16,0.0,Jornada,0.624
"La Jornada: Inhabilitado, forense que señaló violación de Ernestina Ascensión",2010-03-16,-0.9839,Jornada,-0.7184
La Jornada: Exigen a gobernador de BCS aclarar crimen,2010-03-16,0.0,Jornada,-0.6597
"La Jornada: Casi listo, el remozamiento de la catedral de Zacatecas",2010-03-16,0.296,Jornada,0.2975
La Jornada: Hallan muerto a reo del penal de Culiacán,2010-03-16,-0.4019,Jornada,-0.8225
La Jornada: Naucalpan: investigan permisos a vendedores,2010-03-16,0.0,Jornada,0.0
La Jornada: Se inscriben aspirantes del PRI en Tlaxcala,2010-03-16,-0.6597,Jornada,0.0
La Jornada: Se van al PVEM 500 perredistas de Chiapas,2010-03-16,-0.4019,Jornada,0.0
La Jornada: Respalda el PT la postulación de Xóchitl Gálvez en Hidalgo,2010-03-16,-0.128,Jornada,0.3612
La Jornada: Ofrece el PRI tortillas por votos,2010-03-16,0.0,Jornada,0.0
La Jornada: Precandidatos del PAN en Sinaloa firman pacto,2010-03-16,-0.296,Jornada,0.0
La Jornada: Cancún: anomalías por $2.5 millones en la cuenta 2008,2010-03-16,-0.5994,Jornada,0.0
La Jornada: Peligran pensiones de ex ferrocarrileros,2010-03-16,-0.296,Jornada,0.0
La Jornada: Pintarán las viviendas inundadas en Edomex,2010-03-16,0.0,Jornada,0.0
La Jornada: PAN y PRI se acusan mutuamente de destrucción de propaganda en Yucatán,2010-03-16,-0.0772,Jornada,-0.7579
La Jornada: Arrestan a 98 policías por presuntas ligas con el crimen organizado,2010-03-16,0.7579,Jornada,-0.765
La Jornada: Lula promueve a Brasil como facilitador del diálogo para la paz en Medio Oriente,2010-03-16,0.8658,Jornada,0.7096
La Jornada: EU y Rusia acaparan más de 50% de la venta total de armas en el mundo: Sipri,2010-03-16,0.0258,Jornada,0.0
La Jornada: Obama apuesta su futuro político a la aprobación de la reforma de salud,2010-03-16,-0.5994,Jornada,0.0
La Jornada: Inestable suministro eléctrico en Chile,2010-03-16,0.0,Jornada,-0.3612
La Jornada: Juez español ordena captura de seis vascos residentes en Venezuela y cinco colombianos,2010-03-16,-0.836,Jornada,0.0
La Jornada: Privilegios en penal boliviano a ex dictador,2010-03-16,0.0,Jornada,0.3818
