article,pub_date,nltk_score,source,nltk_score_title
"La Jornada: I do not forgive, says murdered minor mother",2012-04-18,-0.4404,Jornada,0.4023
La Jornada: They ask to ban bullfights in Coahuila,2012-04-18,0.0,Jornada,-0.5574
La Jornada: Neighbors: authorities ignore order to stop works of dam The Zapotillo,2012-04-18,-0.6808,Jornada,-0.5719
"La Jornada: Acéfalo, the municipality of Monterrey; Congress was not informed of the separation of Larrazabal",2012-04-18,-0.7096,Jornada,0.0
"La Jornada: The PT, displaced by the PRD in the selection of candidates in Tabasco, accuses the leader",2012-04-18,-0.7506,Jornada,-0.34
La Jornada: Revocate two gay marriages in QR,2012-04-18,-0.296,Jornada,0.0
"La Jornada: Bane in 7 municipalities of Veracruz, due to rain",2012-04-18,0.5267,Jornada,0.0
La Jornada: Gas companies risk consumers,2012-04-18,0.0,Jornada,-0.2732
La Jornada: Reedresa El Coqueto to the prison of Barrientos,2012-04-18,-0.5994,Jornada,-0.5106
La Jornada: Burn public school in Chimalhuacán,2012-04-18,-0.5859,Jornada,0.0
La Jornada: Indian leader arrested in revolt,2012-04-18,0.0,Jornada,-0.4767
La Jornada: On alert 3 entities for intense activity of Popo; Is in phase III,2012-04-18,-0.6249,Jornada,0.3612
La Jornada: Syndicate accuses favoritism in electing rector of the UAZ,2012-04-18,-0.6597,Jornada,-0.1779
La Jornada: The link between State and science must be closer: Urrutia,2012-04-18,0.0,Jornada,0.0
"La Jornada: In spectacular flight, Discovery arrived Tuesday to its final destination",2012-04-18,-0.296,Jornada,0.0
La Jornada: Assange premieres program on Russian TV channel that transmits in English,2012-04-18,-0.5267,Jornada,0.0
"La Jornada: Former guerrilla, new president of East Timor",2012-04-18,-0.25,Jornada,0.0
"The Journey: Fidel Castro: exhausted, the system imposed by the empire",2012-04-18,-0.4019,Jornada,-0.4215
La Jornada: Chile denounces installation of a US-funded military training base,2012-04-18,0.6249,Jornada,-0.4404
La Jornada: The extreme right advances in Europe but in France it is promoted from the state: academic,2012-04-18,-0.6369,Jornada,0.5719
La Jornada: Belgium backs French presidential hopeful Hollande,2012-04-18,-0.5423,Jornada,0.4767
"La Jornada: About 1,200 Palestinians imprisoned in Israel start fasting to report abuses",2012-04-18,-0.7184,Jornada,-0.765
The Journey: Science,2012-04-18,0.0258,Jornada,0.0
La Jornada: The war on drugs has only created a threat to international security: IISS,2012-04-18,-0.9287,Jornada,-0.5994
"La Jornada: I would do it again, says the multi-homicide Breivik on the second day of trial in Oslo",2012-04-18,-0.989,Jornada,0.0
"La Jornada: Gay couples are family, not marriage, consider EMF",2012-04-18,-0.5423,Jornada,0.0
La Jornada: Will reduce spending on the purchase of antiretrovirals,2012-04-18,0.0,Jornada,0.0
La Jornada: It will cost $ 25 billion to lease equipment that will replace Enciclomedia,2012-04-18,-0.6808,Jornada,0.0
La Jornada: Two university students injured in the Mexico-Toluca accident,2012-04-18,-0.6486,Jornada,-0.7003
"La Jornada: The salary increase for teachers, without reaching debt, says Cordoba",2012-04-18,0.7003,Jornada,0.4249
La Jornada: Prisoners and repression persist activists to demobilize,2012-04-18,-0.6808,Jornada,-0.7096
"La Jornada: There are still risks on blood quality for therapies, say activists",2012-04-18,-0.5859,Jornada,-0.2732
La Jornada: Santiago Mitlatongo is the first sustainable rural community in Oaxaca,2012-04-18,0.0,Jornada,0.0
"La Jornada: Students will qualify with letters A, B, C and D as of the next school year",2012-04-18,0.4939,Jornada,0.0
La Jornada: They asked to clarify the murder of Cariño and Jaakkola,2012-04-18,0.0,Jornada,-0.6908
La Jornada: ZonaMaco proposes to turn Mexico City into the avant-garde capital of America,2012-04-18,-0.6808,Jornada,0.0
La Jornada: Nicanor Parra does not go to Spain to receive the Cervantes award,2012-04-18,0.296,Jornada,0.5423
"La Jornada: Inaugurated the Andenes Poetry, open space in the University Cultural Center",2012-04-18,0.0,Jornada,0.0
"La Jornada: Sala Margolín, cultural referent, will close definitively",2012-04-18,-0.5719,Jornada,0.0
"La Jornada: A scene, an initiatory trip with a lot of humor, like a kaleidoscopic dream",2012-04-18,-0.8316,Jornada,0.6808
"La Jornada: For the first time, UNAM will hold the World Book Day in seven venues",2012-04-18,-0.7269,Jornada,0.0
"The Day: Günter Grass should not keep bed, assures the doctor of the German writer",2012-04-18,-0.8316,Jornada,-0.2411
The Day: Mexico Needs Less Emphasis on Structural Reforms and More on Education: Krugman,2012-04-18,-0.6597,Jornada,0.0
"La Jornada: Officials and companies, sanctioned for hogging the business of the tortilla",2012-04-18,0.0,Jornada,0.0
La Jornada: Old age of Mexicans cost an additional $ 400 billion: IMF,2012-04-18,0.3182,Jornada,0.0
"La Jornada: Five executive aircraft, stars of the auction of confiscated goods",2012-04-18,-0.4404,Jornada,0.0
"La Jornada: Insecurity, the biggest factor that threatens companies",2012-04-18,-0.4939,Jornada,-0.6597
La Jornada: It beats in Tenedora K that this day will transfer shares to Atlantic Med,2012-04-18,-0.8316,Jornada,0.296
La Jornada: Admission of Telcel lawsuit,2012-04-18,0.9371,Jornada,-0.2263
The Journey: Science,2012-04-18,0.0258,Jornada,0.0
La Jornada: Highlights in forum corporate social responsibility in Mexico,2012-04-18,0.0,Jornada,0.0
"La Jornada: Public health, great opportunity for the participation of IP",2012-04-18,0.3182,Jornada,0.7845
La Jornada: Governments raise their participation in private companies that are publicly traded,2012-04-18,0.0,Jornada,0.0
"La Jornada: Mexico did not leave the crisis, 57% of senior executives",2012-04-18,-0.4588,Jornada,0.5334
La Jornada: Rajoy minimizes risk of contagion from the crisis in Spain and Europe to AL,2012-04-18,0.0,Jornada,-0.8481
La Jornada: Recovering the peso against the dollar,2012-04-18,0.0,Jornada,0.0
"La Jornada: Spanish investments, a risk for Latin America, warns the IMF",2012-04-18,-0.3818,Jornada,-0.3612
La Jornada: Quadri considers populism worthy of psychoanalysis expropriation of YPF,2012-04-18,-0.5267,Jornada,0.4404
La Jornada: Bloody day of the underworld leaves 45 dead in 12 states,2012-04-18,0.9337,Jornada,-0.802
La Jornada: It must respect other nations: Ebrard,2012-04-18,-0.296,Jornada,0.4767
"La Jornada: Calderón violated the Constitution, but will not be sanctioned: IFE",2012-04-18,-0.7184,Jornada,-0.296
La Jornada: IFE backs Peña Nieto,2012-04-18,0.0,Jornada,-0.0516
La Jornada: Researchers demand to boost science and democratize its benefits,2012-04-18,-0.296,Jornada,0.5859
"La Jornada: Repsol plugged investment projects in Argentina, says ambassador in Mexico",2012-04-18,0.0772,Jornada,0.0
La Jornada: Passes to the full Senate the General Law of Victims,2012-04-18,0.4404,Jornada,-0.3182
La Jornada: Chinese company Petrochemical Corp to buy YPF shares,2012-04-18,-0.0516,Jornada,0.296
The Journey: Science,2012-04-18,0.0258,Jornada,0.0
La Jornada: Eruviel Ávila defends his predecessor,2012-04-18,-0.5267,Jornada,0.0
"La Jornada: Educational programs of candidates, superficial and simplistic: academics",2012-04-18,0.0,Jornada,0.0
La Jornada: Integra la Siedo new investigation against former employees of Moreira,2012-04-18,-0.5423,Jornada,0.0
The Journey: Science,2012-04-18,0.0258,Jornada,0.0
La Jornada: Repsol shares fall in Buenos Aires and Madrid,2012-04-18,-0.3182,Jornada,0.296
La Jornada: Approves St. Lazaro open supercarceles,2012-04-18,0.8126,Jornada,0.4019
La Jornada: Lawmakers criticize Calderon's interference in Argentina's decisions,2012-04-18,0.5423,Jornada,-0.3818
La Jornada: Bartlett was a good legislator: Cárdenas,2012-04-18,-0.7783,Jornada,0.4404
La Jornada: Spain's stance on conflict causes discomfort in Spain,2012-04-18,-0.7003,Jornada,-0.6249
La Jornada: The EU studies measures to respond to Argentina's decision on YPF,2012-04-18,0.6486,Jornada,0.0
La Jornada: Nationalization of Argentine oil will not affect Mexico's stability: Carstens,2012-04-18,-0.6369,Jornada,0.0
La Jornada: The PRI fears the truth: the candidate,2012-04-18,-0.8481,Jornada,-0.128
La Jornada: Mexico qualifies for unpunished violence towards informants,2012-04-18,-0.6705,Jornada,-0.6249
La Jornada: Veracruz visited more than 2.5 million tourists in Easter,2012-04-18,0.0,Jornada,0.0
La Jornada: Rajoy will speak with three of the presidential candidates,2012-04-18,0.0,Jornada,0.0
La Jornada: The last of my agenda would be the expropriation: Vázquez Mota,2012-04-18,-0.296,Jornada,0.0
La Jornada: Luis Javier Garrido receives posthumous tribute for his social commitment,2012-04-18,0.3182,Jornada,0.3818
"La Jornada: It takes organized crime inertia to replace the State, warns Calderón",2012-04-18,-0.8689,Jornada,-0.5994
La Jornada: Tamaulipas pays homage to General Francisco Javier Mina,2012-04-18,0.0,Jornada,0.0
La Jornada: The federal government must explain the privileges that Repsol has had: AMLO,2012-04-18,-0.9274,Jornada,0.3818
La Jornada: López Obrador recalls in Jalapa the PRI use of the word fidelity,2012-04-18,0.25,Jornada,0.0
La Jornada: Demand Repsol 10.5 billion dollars; We will not pay that amount: Buenos Aires,2012-04-18,0.8074,Jornada,-0.0526
La Jornada: The expropriation of YPF hurts everyone: Rajoy,2012-04-18,-0.8402,Jornada,-0.4767
La Jornada: Peña criticizes expropriation of YPF Repsol,2012-04-18,-0.8225,Jornada,-0.34
La Jornada: Spanish call on social networks to boycott Argentine products,2012-04-18,-0.296,Jornada,-0.3182
La Jornada: Differences between register and list,2012-04-18,-0.4939,Jornada,0.0
