article,pub_date,nltk_score,source,nltk_score_title
La Jornada: Fidel Castro says goodbye to the last of his public positions,2011-04-20,-0.9153,Jornada,0.0
"La Jornada: Havana, by normal ties with Washington but with respect for sovereignty: Ricardo Alarcón",2011-04-20,-0.9042,Jornada,0.631
"La Jornada: My task, to prevent the return of capitalism: Raúl Castro",2011-04-20,-0.802,Jornada,0.0258
La Jornada: Italy freezes its nuclear plans,2011-04-20,0.0772,Jornada,-0.0258
"The Day: NATO bombs Tripoli, Azizeyeh and Sirte",2011-04-20,-0.6124,Jornada,0.0
La Jornada: Hierarchical rise to two of the largest operators of the Cuban economy,2011-04-20,-0.1027,Jornada,0.0
"La Jornada: Baltasar Garzón, suspended again, now to investigate corruption of the PP",2011-04-20,-0.7579,Jornada,-0.4767
The Journey: Transfer Manning to another prison,2011-04-20,0.0,Jornada,-0.5106
"La Jornada: Changes in the CCP, an internal process: EU",2011-04-20,0.25,Jornada,0.0
"La Jornada: Board of the international extreme right in Buenos Aires; Their leaders, linked to the CIA",2011-04-20,0.9042,Jornada,0.0
La Jornada: Approves the Syrian government law to lift the state of emergency,2011-04-20,-0.1779,Jornada,0.0258
"The Day: SG does not fulfill its obligation not to sanction the spokesman of the archdiocese, says the IFE",2011-04-20,-0.9217,Jornada,-0.3412
La Jornada: NGO denounces that the INM violated Proiettis rights when deported,2011-04-20,-0.296,Jornada,-0.743
La Jornada: AMLO to host new national tour,2011-04-20,0.3182,Jornada,0.0
"La Jornada: Havana, by normal ties with Washington but with respect for sovereignty: Ricardo Alarcón",2011-04-20,-0.9042,Jornada,0.631
"La Jornada: Changes in the CCP, an internal process: EU",2011-04-20,0.25,Jornada,0.0
La Jornada: Pide Narro Robles create development options where humanism prevails over macroeconomics,2011-04-20,-0.9118,Jornada,0.2732
"La Jornada: To accuse gang members of SME, political excess: Pablo Gómez",2011-04-20,-0.9287,Jornada,-0.2023
La Jornada: Roots the PGR to another 22 involved in the multi-homicide of San Fernando,2011-04-20,-0.9136,Jornada,0.0
La Jornada: Cries justice father of murdered doctor,2011-04-20,0.0,Jornada,-0.5719
"La Jornada: Elva Nava's obligations as attorney for Pemex, according to a document of the state",2011-04-20,-0.946,Jornada,0.0
"La Jornada: After flood, senators worry about the fragility of its expensive new headquarters",2011-04-20,-0.8807,Jornada,-0.4404
La Jornada: Zapatista demands liberation of Monte Redondo indigenous accused falsely,2011-04-20,-0.7783,Jornada,-0.296
"La Jornada: Ciudad Juárez, on the way to calm: ECHR",2011-04-20,-0.0516,Jornada,0.3182
"La Jornada: Deserters of the Navy, two executed",2011-04-20,0.296,Jornada,0.0
La Jornada: Evangelicals reject violence,2011-04-20,-0.1531,Jornada,-0.7783
"La Jornada: My task, to prevent the return of capitalism: Raúl Castro",2011-04-20,-0.802,Jornada,0.0258
La Jornada: Critican telos silence of the cabinet before the questions,2011-04-20,0.2263,Jornada,0.0
La Jornada: The sentimental couple of El JJ are released,2011-04-20,0.0,Jornada,0.6166
La Jornada: Investigate whether the Gulf cartel put or delivered Chemis to the Mexican Army,2011-04-20,-0.6808,Jornada,0.0
La Jornada: PRD: Calderón will violate the Constitution if it goes to the beatification,2011-04-20,0.0,Jornada,-0.4939
La Jornada: Investigates the PGR kidnapping of a Swiss,2011-04-20,-0.296,Jornada,0.0
La Jornada: Fidel Castro says goodbye to the last of his public positions,2011-04-20,-0.9153,Jornada,0.0
La Jornada: Sea of ​​our dreams,2011-04-20,-0.0258,Jornada,0.4019
La Jornada: Sentenced to imprisonment in Hugo Wallace case,2011-04-20,-0.8658,Jornada,-0.0258
La Jornada: Rosario Ibarra asks Marisela Morales to quote Echeverría,2011-04-20,-0.3182,Jornada,0.0
La Jornada: Hierarchical rise to two of the largest operators of the Cuban economy,2011-04-20,-0.1027,Jornada,0.0
La Jornada: The Conamp receives the unique collection booth in Cascadas de Agua Azul,2011-04-20,0.9371,Jornada,0.0
La Jornada: Plan for the Executive to manage at will free armed forces,2011-04-20,-0.5574,Jornada,0.5106
"La Jornada: Labor Martyrs, Pasta de Conchos Miners: Cereal",2011-04-20,0.0516,Jornada,0.0
La Jornada: Will prevent PRI diversion of funds to campaigns,2011-04-20,0.0,Jornada,0.0258
The Journey: They face the Army and Navy to criminals in Veracruz; Die 10,2011-04-20,-0.9153,Jornada,-0.8225
La Jornada: Monument to reconcile Turks and Armenians becomes a symbol of hatred,2011-04-20,-0.3182,Jornada,-0.6369
La Jornada: The Brazilian Symphony Orchestra faces its worst crisis in 70 years,2011-04-20,-0.765,Jornada,-0.8481
La Jornada: More than 70 thousand people have visited the Soumaya Plaza Carso Museum,2011-04-20,0.0,Jornada,0.0
"The Journey: Tadashi Endo explores the brevity of life, beyond time and words",2011-04-20,-0.7184,Jornada,0.0
"La Jornada: The Philadelphia Orchestra, favorite of world music lovers, bankrupt",2011-04-20,-0.7351,Jornada,0.4215
La Jornada: Show the evolution of landscape painting in Mexican plastic,2011-04-20,-0.296,Jornada,0.0
La Jornada: The writer José Agustín is recognized with the ALDF Medal of Merit,2011-04-20,0.4404,Jornada,0.7096
La Jornada: Citizens denounce former governor of BCS,2011-04-20,0.5423,Jornada,-0.34
La Jornada: Criticized for police suppressing protests,2011-04-20,-0.296,Jornada,-0.5267
La Jornada: The APPG requires Rivero to handle 139 requests,2011-04-20,0.0258,Jornada,0.0
La Jornada: Alert in the country for forest fires in at least eight states,2011-04-20,-0.7717,Jornada,0.296
La Jornada: Edomex: cut in water supply will affect 13 municipalities,2011-04-20,0.0,Jornada,-0.2732
La Jornada: PRI says ready to fight in federal elections,2011-04-20,-0.7096,Jornada,-0.0258
La Jornada: Inhabitants of Valle de Chalco require drills,2011-04-20,-0.6705,Jornada,0.0
La Jornada: Avala the PRI relocation of Mayan office in QR,2011-04-20,0.0,Jornada,0.0
La Jornada: Initiates distribution of support to victims,2011-04-20,0.0,Jornada,0.1027
"La Jornada: Javier Torres, environmentalist leader in Guerrero",2011-04-20,-0.9081,Jornada,0.0
La Jornada: Women at risk for customs and customs,2011-04-20,0.0,Jornada,-0.2732
La Jornada: Yucatan: dismissed director of reformatory,2011-04-20,-0.5994,Jornada,0.0
La Jornada: Prevent 60% of maize harvests after reseeding in Sinaloa,2011-04-20,-0.8316,Jornada,0.0258
La Jornada: The SRA offers a permanent table to resolve 82 agrarian conflicts in Oaxaca,2011-04-20,0.0,Jornada,0.0
La Jornada: Guerrero seeks to organize Tianguis Mexico 2012,2011-04-20,0.0,Jornada,0.0
La Jornada: Decrece tourism in Guanajuato,2011-04-20,0.0,Jornada,0.0
La Jornada: About 15 million young Mexicans in poverty: UN,2011-04-20,-0.9674,Jornada,-0.5106
La Jornada: It is urgent to relocate people who live near the Company channel: experts,2011-04-20,-0.9661,Jornada,0.2023
"La Jornada: Of cultural origin, the differences between genders",2011-04-20,-0.296,Jornada,0.0
"La Jornada: Women, with low level of well-being",2011-04-20,-0.3818,Jornada,-0.2732
La Jornada: SME: electrical faults led to flooding in Valle de Chalco,2011-04-20,-0.6908,Jornada,-0.4767
La Jornada: Slim to own Brazil's StarOne satellite service,2011-04-20,-0.296,Jornada,0.0
La Jornada: Obama Confides in Legislative Agreement on Reducing Federal Deficit,2011-04-20,-0.5423,Jornada,0.128
"La Jornada: Chiapas, with healthy finances; Site 20 in indebtedness per inhabitant",2011-04-20,-0.959,Jornada,0.4019
La Jornada: Entities will carry out surveillance operations for visitor safety,2011-04-20,-0.4588,Jornada,0.4215
La Jornada: The fine for América Móvil will have no impact on its profile: S & P,2011-04-20,-0.8555,Jornada,-0.1027
"La Jornada: In Latin America, 56 million people have grown up in the middle class since 1990",2011-04-20,0.0,Jornada,0.0
"La Jornada: Viable, raise wages without generating inflationary pressures: expert",2011-04-20,0.0,Jornada,0.2411
"La Jornada: Record of foreign exchange reserves, with 124 thousand 290 mdd: BdeM",2011-04-20,0.0,Jornada,0.0
