article,pub_date,nltk_score,source,nltk_score_title
Anthrax Suspect’s Defenders Warn Against Rush to Judgment,2008/08/01,-0.9806,ProPublica,-0.0258
This Week in Scandal Watch,2008/08/01,-0.9981,ProPublica,-0.4404
Big FOIA Backlog Lingers,2008/08/01,0.9881,ProPublica,0.0
Bill Authorizes GAO to Sue Gov’t for Info,2008/08/01,0.1779,ProPublica,0.0
Reminders of Botched Investigation as Suspected Culprit Dies,2008/08/01,-0.9907,ProPublica,-0.2263
New Scandal: Politicization of Federal Government,2008/08/01,-0.6369,ProPublica,-0.4404
