article,pub_date,nltk_score,source,nltk_score_title
Publica el PSD lista de aspirantes en la Internet,2009-01-23,-0.765,Jornada,0.0
"Definen AMLO, Convergencia y PT posibles precandidatos",2009-01-23,-0.4404,Jornada,0.0
"El gobierno mantiene sus privilegios, pese a la situación mundial, denuncia AMLO",2009-01-23,-0.9657,Jornada,-0.0772
Demanda Ulises Ruiz edificar en Oaxaca la nueva refinería,2009-01-23,0.765,Jornada,-0.128
Presentan informe sobre agresiones a periodistas,2009-01-23,-0.9578,Jornada,-0.4404
"No hay indicios de falla mecánica en el Learjet que transportó a Mouriño, insisten",2009-01-23,-0.993,Jornada,-0.6705
Reunión de la junta directiva de Lotería,2009-01-23,0.25,Jornada,0.0
Roban y recuperan 12 hummers,2009-01-23,-0.6486,Jornada,-0.4939
La Secretaría del Trabajo ha recibido 214 mil peticiones de empleo en 20 días,2009-01-23,-0.872,Jornada,0.0
Confirma Genaro Góngora Pimentel que le interesa presidir la CNDH,2009-01-23,0.8442,Jornada,0.4019
"Gobierno, sin voluntad de negociar con eperristas",2009-01-23,-0.296,Jornada,0.0
Capturan a dos presuntos ladrones de combustible,2009-01-23,-0.296,Jornada,-0.6369
"“Buena señal”, el anuncio de Obama de cerrar la prisión de Guantánamo: Ricardo Alarcón",2009-01-23,-0.8456,Jornada,-0.1027
Analiza Gobernación fortalecer seguridad en Chihuahua y Sinaloa,2009-01-23,0.5859,Jornada,0.6808
IFE y radio y televisión firman acuerdo sobre equidad informativa de campañas,2009-01-23,0.0258,Jornada,0.4939
El IFE no investigará a legisladores: Navarrete,2009-01-23,0.765,Jornada,0.0
Decomisan agentes federales casi tres toneladas de efedrina en Colima,2009-01-23,0.8442,Jornada,0.0
Tenemos el derecho de presumir: réplica de AN,2009-01-23,-0.0258,Jornada,0.0
Carecemos de facultades para auditar o supervisar cuentas bancarias: Valdés,2009-01-23,0.9821,Jornada,-0.25
Prevén en el PRD obtener de 43 a 45 diputaciones por la vía plurinominal,2009-01-23,0.9169,Jornada,0.0
Jóvenes socialistas se reúnen en Zacatecas,2009-01-23,0.0,Jornada,0.0
Cesará la PGR a 7 mil 500 trabajadores,2009-01-23,-0.7184,Jornada,0.0
Denuncia Madero investigaciones financieras a él y otros legisladores,2009-01-23,-0.9313,Jornada,-0.4404
"Terminó la polémica sobre qué juez debe procesar a El Mochomo, luego de un año",2009-01-23,-0.886,Jornada,-0.4019
"El PAN utiliza ilegalmente las obras del gobierno para promocionarse, dice el PRI",2009-01-23,-0.9769,Jornada,0.3818
Radio y tv inician campaña para apoyar el plan calderonista anticrisis,2009-01-23,0.7964,Jornada,0.4019
"Sólo han abandonado el Partido del Trabajo casi 200 militantes, aseguran",2009-01-23,-0.8126,Jornada,0.4019
Ejidatarios de Juchitán exigen ser copropietarios,2009-01-23,0.6486,Jornada,-0.128
Inseguridad y narcotráfico ponen en riesgo la labor de capacitadores del IFE,2009-01-23,-0.9169,Jornada,-0.5994
"El laicismo permite el respeto a todos los credos, dice el director de la FCPS",2009-01-23,-0.8225,Jornada,0.7096
Impulsan diputados una iniciativa para prevenir la pederastia en centros escolares,2009-01-23,-0.6808,Jornada,0.0258
La elección del titular de la CNDH debe ser transparente: agrupaciones,2009-01-23,-0.6369,Jornada,0.0
Cuestionan organizaciones campesinas datos de Sagarpa,2009-01-23,-0.981,Jornada,-0.1027
"Universidades, sin recursos para lograr cobertura de 30% en 2012",2009-01-23,0.128,Jornada,0.0
Analizan quitar nombre de Díaz Ordaz a bulevar,2009-01-23,0.0,Jornada,0.0
Deudores del Infonavit señalan hostigamiento,2009-01-23,-0.1779,Jornada,-0.5423
Abusos policiacos en dos entidades,2009-01-23,0.6808,Jornada,-0.5574
No hay fondos para la vía Lerma-Tres Marías,2009-01-23,0.4215,Jornada,-0.296
Niegan fuero a jueces,2009-01-23,0.296,Jornada,-0.34
Riña en el penal de Matamoros deja dos muertos y 35 lesionados,2009-01-23,-0.9909,Jornada,-0.8834
"Petistas mexiquenses, al PRD",2009-01-23,0.8074,Jornada,0.0
Rechazan burócratas cambiar sistema de pensiones de Sinaloa,2009-01-23,0.4767,Jornada,-0.4019
Se oponen a proyectos en Cancún,2009-01-23,0.6597,Jornada,0.0
Perredistas bloquean el Congreso de Guerrero en repudio a fallo del TEPJF,2009-01-23,-0.6124,Jornada,-0.4404
Rubén Mendoza Ayala podría unirse al PRD,2009-01-23,-0.296,Jornada,0.296
Edil graba CD para elogiarse,2009-01-23,-0.128,Jornada,0.5574
Devuelve el PAN de Jalisco $19 millones,2009-01-23,0.7096,Jornada,0.0
Decomisa la policía española 81 obras atribuidas a Dalí,2009-01-23,-0.5423,Jornada,0.0
El gobierno del Edomex arrancó show mediático con “permiso de facto” del INAH,2009-01-23,-0.8316,Jornada,0.0
"Apoyar a jóvenes talentos, entre los ejes de la gestión de María Teresa Frenk",2009-01-23,-0.8979,Jornada,0.6908
Reclaman artesanos libre tránsito en Chichén Itzá,2009-01-23,-0.296,Jornada,0.5106
Verifica la UNESCO trabajos de preservación en Machu Picchu,2009-01-23,0.0,Jornada,0.0
"“Inviable, sustituir Resplandor teotihuacano por otro proyecto”",2009-01-23,-0.8519,Jornada,0.34
Realizaron en Francia el estreno mundial de manuscritos de Mozart para el kyrie de una misa,2009-01-23,0.4019,Jornada,0.0
"Bryce Echenique apelará de la multa por plagio; “a ese paso ganaré el Nobel”, bromea",2009-01-23,0.2732,Jornada,0.765
Convenio para promover el arte y la cultura,2009-01-23,-0.5267,Jornada,0.3818
Aumenta el número de trabajadores para extraer tubos y resanar orificios,2009-01-23,-0.4588,Jornada,0.3818
Detenidos seis militares por el asesinato de tres civiles colombianos,2009-01-23,-0.9914,Jornada,-0.8126
Más de mil agrupaciones instan a Obama a promover una reforma migratoria integral,2009-01-23,0.6908,Jornada,0.5574
Desclasifican en EU documentos de múltiples intentos para normalizar la relación con Cuba,2009-01-23,0.6249,Jornada,0.0
Pide Fidel Castro al gobierno cubano continuar con su trabajo aunque él se agrave o muera,2009-01-23,-0.802,Jornada,-0.4767
Cierran campaña por el sí a la nueva Carta Magna con actos en tres ciudades de Bolivia,2009-01-23,0.93,Jornada,0.4019
Llegó en 2002 a Guantánamo; tenía 14 años,2009-01-23,-0.9686,Jornada,0.0
Impacto y rabia de ONU por la desoladora devastación que provocó Israel en Gaza,2009-01-23,-0.9493,Jornada,-0.8934
Firman Cristina Fernández y Hugo Chávez 21 acuerdos de cooperación,2009-01-23,-0.296,Jornada,0.2732
Obama prohíbe la tortura y ordena el cierre de Guantánamo,2009-01-23,-0.9682,Jornada,-0.5994
Piden empresas que se les baje impuestos,2009-01-23,-0.8074,Jornada,0.0
"2008, el “peor año” de Pemex, admite Jesús Reyes Heroles",2009-01-23,0.7783,Jornada,-0.4404
Anuncian acuerdo Televisa-Univisión,2009-01-23,0.8934,Jornada,0.4939
Despedirá Microsoft a 5 mil trabajadores los próximos 18 meses,2009-01-23,-0.8807,Jornada,-0.34
Dólar al alza; cerró ayer en $14.15,2009-01-23,-0.34,Jornada,0.0
"Paros y tomas si no baja el diesel, amagan",2009-01-23,-0.1531,Jornada,-0.0593
Cae la esperanza de que China jale la economía,2009-01-23,-0.3182,Jornada,0.4404
Piden reformar la ley del SAR ante pérdidas,2009-01-23,-0.7003,Jornada,-0.4019
"Slim, sin interés en comprar Banamex: vocero del magnate",2009-01-23,-0.8519,Jornada,-0.357
Suben los precios 0.15 por ciento en la primera quincena del año,2009-01-23,0.6369,Jornada,0.0
"Caerán producción industrial, empleo, inversión y consumo, anuncia Carstens",2009-01-23,-0.4767,Jornada,0.0
Anticipa Coparmex pérdida de 150 mil empleos este año,2009-01-23,-0.34,Jornada,-0.3182
“Debe consolidarse en la educación básica la teoría de la evolución”,2009-01-23,-0.1779,Jornada,0.0
Desarrollan crema preventiva de herpes genital,2009-01-23,-0.5574,Jornada,0.0
