article,pub_date,nltk_score,source,nltk_score_title
High-Prescribing Chicago Psychiatrist Faces Federal Fraud Suit,2012/11/15,-0.3848,ProPublica,-0.5859
Are You a U.S. Military Vet Who Can’t Obtain War Records? Tell Us Your Story,2012/11/15,0.3535,ProPublica,-0.5994
BP Agrees to Plead Guilty to Crimes in Gulf Oil Spill,2012/11/15,-0.997,ProPublica,-0.25
How Did Scores of Military Units Lose Combat Records in the War on Terror? A Q&A With Peter Sleeth,2012/11/15,0.9907,ProPublica,-0.9081
TSA X-Ray Body Scanners Sit Idle in Warehouse,2012/11/15,-0.9919,ProPublica,0.0
"What Effect, If Any, Did Voter ID Laws Have on the Election?",2012/11/15,-0.8179,ProPublica,0.0
Pipeline Safety Tracker,2012/11/15,-0.9884,ProPublica,0.4215
Pipelines Explained: How Safe are America’s 2.5 Million Miles of Pipelines?,2012/11/15,-0.9992,ProPublica,0.4404
Education Department Adopts Crucial Reform for Disabled Borrowers,2012/11/15,0.9991,ProPublica,0.1779
