article,pub_date,nltk_score,source,nltk_score_title
More Mea Culpas From Geithner as Regulator,2009/01/22,0.9437,ProPublica,0.0
Obama Begins to Fulfill Gitmo Promise,2009/01/22,0.0387,ProPublica,0.6369
Who Runs Departments Before Heads Are Confirmed?,2009/01/22,0.9788,ProPublica,0.0
Quick Picks: Banks Swap Regulators and Pols Use Bailout,2009/01/22,0.9789,ProPublica,-0.1027
"Nationalization of Banks? Citi, Gov’t Agreement Already Provides for Partial Takeover",2009/01/22,0.9951,ProPublica,0.4939
