article,pub_date,nltk_score,source,nltk_score_title
Obama Reverses Bush Executive Privilege Claim Over Documents,2009/01/21,0.3167,ProPublica,0.3612
Geithner Pressed During His Hearing,2009/01/21,-0.9017,ProPublica,0.0
"Obama Stops Clocks on Midnight Regs, But Others Still Ticking",2009/01/21,0.871,ProPublica,-0.1531
Obama Begins Rollback of Bush-Era Secrecy,2009/01/21,0.9863,ProPublica,0.0
"Gas Drilling Update: An Industry Setback in Utah, Plus an Overview From FLYP Media",2009/01/21,0.2075,ProPublica,0.0
"The Bailout: TARP Failing, Next Step Unclear",2009/01/21,0.9013,ProPublica,-0.6908
Quick Picks: Gitmo Takes a Break and Life Insurers Ask for One,2009/01/21,0.6369,ProPublica,0.0
One (Small) Step Toward Shuttering Gitmo,2009/01/21,-0.8361,ProPublica,0.0
Questions About Geithner’s Actual Record,2009/01/21,0.4215,ProPublica,0.0
