article,pub_date,nltk_score,source,nltk_score_title
Throat-clearing could be sign co-worker has medical condition,2008/06/20,0.9841,Chicago Tribune,0.0
CineYouth Festival begins Friday,2008/06/20,0.9392,Chicago Tribune,0.4939
"Off the grid, on the beach",2008/06/20,-0.7024,Chicago Tribune,0.0
For families,2008/06/20,0.9875,Chicago Tribune,0.0
What the panel said,2008/06/20,0.9665,Chicago Tribune,0.0
Movies,2008/06/20,0.9428,Chicago Tribune,0.0
"International cast, crew illuminate young Genghis",2008/06/20,0.7795,Chicago Tribune,0.0
Shows to watch,2008/06/20,0.8922,Chicago Tribune,0.0
Cinematic journey back to 1930s sure to please many American girls,2008/06/20,0.9733,Chicago Tribune,0.5574
Wholesome appreciation for a leggy icon,2008/06/20,0.8685,Chicago Tribune,0.5106
"No enlightenment, few laughs",2008/06/20,0.995,Chicago Tribune,0.25
Roommates are put to the test in '4 Months',2008/06/20,-0.4404,Chicago Tribune,0.0
'Girl' talk: Our reporter-for-a-day interviews star Abigail Breslin,2008/06/20,0.9984,Chicago Tribune,0.0
Resilient spirits survived the Soviet Union,2008/06/20,-0.4939,Chicago Tribune,0.5106
Rivette finds a dark modern heart in his Balzac adaptation,2008/06/20,-0.1377,Chicago Tribune,0.0
No-frills human rights tale packs a punch,2008/06/20,-0.9953,Chicago Tribune,0.0
Documentary details human toll of progress,2008/06/20,0.9253,Chicago Tribune,0.4215
New York's a small world for mini-noir's immigrants,2008/06/20,-0.9051,Chicago Tribune,0.0
Disney crafts another hit with its 'Camp Rock',2008/06/20,0.9919,Chicago Tribune,0.0
"Can I repair chipped, scratched mirror?",2008/06/20,-0.7236,Chicago Tribune,0.0
Ways to preserve your porch floor,2008/06/20,0.8562,Chicago Tribune,0.0
Summer dance lineup in Chicago,2008/06/20,0.999,Chicago Tribune,0.0
Split-level house offers a myriad of modern ideas,2008/06/20,0.9382,Chicago Tribune,0.0
Choosing a new fan can be a breeze,2008/06/20,0.9836,Chicago Tribune,0.3182
Other shows under the stars,2008/06/20,0.9883,Chicago Tribune,0.0
Kot in the act: Shows you can't miss,2008/06/20,0.9468,Chicago Tribune,0.1139
Take this opportunity to experience joy and Wonder,2008/06/20,0.8422,Chicago Tribune,0.765
"Rough rugby, sweet strawberries",2008/06/20,0.9992,Chicago Tribune,0.4588
Dilated Peoples' special brew,2008/06/20,0.8271,Chicago Tribune,0.4019
"Crank that move, you dancing machine",2008/06/20,0.8173,Chicago Tribune,0.0
It's my party and I'll sell if I want to,2008/06/20,0.9967,Chicago Tribune,0.4588
Looking for a good time? Try these...,2008/06/20,0.8105,Chicago Tribune,0.4404
Chris Jones recommends,2008/06/20,-0.937,Chicago Tribune,0.2263
Stage ticker,2008/06/20,0.8442,Chicago Tribune,0.0
Lavish open house festivities seek to boost home sales,2008/06/20,0.9943,Chicago Tribune,0.7003
Protect pool equipment from storms,2008/06/20,-0.875,Chicago Tribune,0.3818
Go big--or go home,2008/06/20,0.9814,Chicago Tribune,0.0
Get 'Hay Fever' in Forest Park,2008/06/20,0.9761,Chicago Tribune,0.0
Oswego working to keep small-town charm,2008/06/20,0.9873,Chicago Tribune,0.4019
High-rise sales near close-out,2008/06/20,0.6486,Chicago Tribune,0.0
See Logan run,2008/06/20,0.8595,Chicago Tribune,0.0
Is it more important to you to have a deck or patio?,2008/06/20,0.7785,Chicago Tribune,0.2716
Inviting porch beckons,2008/06/20,0.9753,Chicago Tribune,0.3182
The week in live music,2008/06/20,0.9807,Chicago Tribune,0.0
'Bloody Bess' is a bloody blast,2008/06/20,-0.8334,Chicago Tribune,-0.7003
Circling Logan Square's night-life scene,2008/06/20,0.9802,Chicago Tribune,0.0
Child's misbehavior greases path to eviction,2008/06/20,-0.8694,Chicago Tribune,-0.4588
What is that?,2008/06/20,0.9468,Chicago Tribune,0.0
Landmark show's remounting at IIT highlights photos of Adler and Sullivan buildings,2008/06/20,0.981,Chicago Tribune,0.0772
Down payment is from bank of Mom and Dad,2008/06/20,0.9943,Chicago Tribune,0.0
This playpen is the cat's meow,2008/06/20,0.9458,Chicago Tribune,0.0
Frontman's family has musical tradition,2008/06/20,0.9702,Chicago Tribune,0.0
Black Angels make selves small so music gets big,2008/06/20,0.2168,Chicago Tribune,0.0
"For Chaka Khan, ribs are not on Taste menu",2008/06/20,0.9431,Chicago Tribune,0.0
Proper landscaping can save on heating and cooling costs,2008/06/20,0.961,Chicago Tribune,0.4939
'Gutenberg' has go-getter producer,2008/06/20,0.3709,Chicago Tribune,0.0
Review of Alison Krauss-Robert Plant concert at Ravinia,2008/06/20,0.963,Chicago Tribune,0.0
Northern Trust courts the slightly less wealthy,2008/06/20,0.9902,Chicago Tribune,0.6403
Revisions to trucks take back seat at GM,2008/06/20,0.9603,Chicago Tribune,0.0
China spurs $4 drop in crude oil futures,2008/06/20,-0.5664,Chicago Tribune,-0.7003
Economic measure rises for 2nd month,2008/06/20,0.8082,Chicago Tribune,0.0
Supplier's comments help send Motorola shares to 5-year low,2008/06/20,-0.9052,Chicago Tribune,0.4215
High court eases worker burden in age-bias suits,2008/06/20,0.9919,Chicago Tribune,-0.1531
"United, Continental join forces",2008/06/20,0.997,Chicago Tribune,0.6124
Legalisms stifle Icahn,2008/06/20,-0.7335,Chicago Tribune,0.0
2 ex-Bear Stearns leaders arrested,2008/06/20,-0.9897,Chicago Tribune,-0.4767
Ex-Sears CEO Aylwin Lewis fills top post at Potbelly Sandwich Works,2008/06/20,0.4721,Chicago Tribune,0.2023
Icahn falls short in his push to shake up Biogen Idec's board,2008/06/20,0.9594,Chicago Tribune,-0.1779
67 from Chicago area charged in U.S. crackdown on mortgage fraud,2008/06/20,-0.9948,Chicago Tribune,-0.6808
Public weighs in on Zion nuclear plant proposal,2008/06/20,0.7596,Chicago Tribune,0.0
Lake in the Hills man sentenced to 15 years in attempted assault,2008/06/20,-0.994,Chicago Tribune,-0.5994
Death Notice: MAUREEN WEISS,2008/06/20,0.9657,Chicago Tribune,-0.5994
Death Notice: MARY ELLEN von AMMON,2008/06/20,0.9201,Chicago Tribune,-0.5994
Fans dreaming of golden age in Chicago sports,2008/06/20,0.9966,Chicago Tribune,0.0
Uncertainty of case in Bartlett man's slaying angers widow,2008/06/20,-0.9959,Chicago Tribune,-0.6908
Living with the enemy,2008/06/20,0.9845,Chicago Tribune,-0.5423
NIU building proton therapy clinic,2008/06/20,0.9035,Chicago Tribune,0.0
Dog day care center plans revised in Crystal Lake,2008/06/20,0.933,Chicago Tribune,0.4939
"Boy, 14, shot in West Pullman dies",2008/06/20,-0.9905,Chicago Tribune,0.0
Wright urges lawyers to be models for youth,2008/06/20,0.9246,Chicago Tribune,0.0
Death Notice: DAVID GORR,2008/06/20,0.9531,Chicago Tribune,-0.5994
Will.he.act.well?,2008/06/20,-0.765,Chicago Tribune,0.0
Ask Tom Why,2008/06/20,-0.0593,Chicago Tribune,0.0
Change You Can Believe In,2008/06/20,0.9893,Chicago Tribune,0.0
Elsewhere,2008/06/20,-0.9927,Chicago Tribune,0.0
Nation/world,2008/06/20,-0.8553,Chicago Tribune,0.0
Quotable,2008/06/20,-0.9042,Chicago Tribune,0.0
Group sues to stop 'I believe' plates,2008/06/20,0.0772,Chicago Tribune,-0.296
By The Numbers,2008/06/20,0.8223,Chicago Tribune,0.0
"Mmm, TASTY",2008/06/20,0.6542,Chicago Tribune,0.0
Both sides savor cease-fire's quiet,2008/06/20,-0.1039,Chicago Tribune,0.0
Campaign Digest,2008/06/20,0.7781,Chicago Tribune,0.0
"Obama says 'no, thanks'",2008/06/20,0.7815,Chicago Tribune,0.4404
Veterans hospital idea gets backing,2008/06/20,0.886,Chicago Tribune,0.0258
Corrections And Clarifications,2008/06/20,-0.743,Chicago Tribune,0.0
$84 million? No thanks.,2008/06/20,0.7093,Chicago Tribune,0.1779
'08 success cranks up the intensity,2008/06/20,0.991,Chicago Tribune,0.5719
On The Trail,2008/06/20,-0.7533,Chicago Tribune,0.0
China increasing fuel prices up to 18%,2008/06/20,0.6124,Chicago Tribune,0.0
Blagojevich loses key aide,2008/06/20,-0.5719,Chicago Tribune,-0.3182
Sacked Again,2008/06/20,0.9642,Chicago Tribune,0.0
To scene and be seen,2008/06/20,0.8997,Chicago Tribune,0.0
Comedy clash,2008/06/20,0.9358,Chicago Tribune,0.3612
Elsewhere,2008/06/20,0.3818,Chicago Tribune,0.0
Driver cited with DUI in crash that injured girl at bus shelter,2008/06/20,0.2635,Chicago Tribune,-0.6597
$500 million man?,2008/06/20,0.6593,Chicago Tribune,0.0
What Others Are Saying,2008/06/20,-0.7927,Chicago Tribune,0.0
Chicago,2008/06/20,-0.9311,Chicago Tribune,0.0
Caught between a rock and hard time,2008/06/20,0.3818,Chicago Tribune,-0.1027
Berwyn to cut 15 city workers,2008/06/20,-0.9412,Chicago Tribune,-0.2732
Facebook Fives,2008/06/20,0.9701,Chicago Tribune,0.0
Show Patrol,2008/06/20,0.9335,Chicago Tribune,0.0
Death Notice: VIRGINIA M. WATTS,2008/06/20,0.7964,Chicago Tribune,-0.5994
Box office thrives in face of recession,2008/06/20,0.5849,Chicago Tribune,-0.4215
Hometown Hits,2008/06/20,0.2023,Chicago Tribune,0.0
Deal would expand government's surveillance power,2008/06/20,-0.9774,Chicago Tribune,0.3182
Top court limits self-representation,2008/06/20,-0.7269,Chicago Tribune,0.2023
GAO: Medicare tax abuses uncovered,2008/06/20,0.2023,Chicago Tribune,-0.5574
"Taliban incursion easily staged, quelled",2008/06/20,0.1779,Chicago Tribune,0.34
Lawman pleads guilty in drug case,2008/06/20,-0.8271,Chicago Tribune,-0.4215
Edens Expressway work to switch lanes Friday night,2008/06/20,0.0,Chicago Tribune,0.0
Mouthwatch,2008/06/20,0.936,Chicago Tribune,0.0
Where high fuel prices are driving us,2008/06/20,0.9909,Chicago Tribune,0.0
Indictments could come in slaying of British student,2008/06/20,-0.9805,Chicago Tribune,0.0
The Digits,2008/06/20,-0.8074,Chicago Tribune,0.0
"Summer arrives, and so does the humidity",2008/06/20,0.4127,Chicago Tribune,0.0
Death Notice: VITO A. GAROFALO SR.,2008/06/20,0.9371,Chicago Tribune,-0.5994
$500 million man?,2008/06/20,0.8221,Chicago Tribune,0.0
Casual Friday,2008/06/20,0.0258,Chicago Tribune,0.2023
Death Notice: ELEANORE SUSTR,2008/06/20,0.9022,Chicago Tribune,-0.5994
Pfleger speaks at Loop anti-violence rally,2008/06/20,-0.9075,Chicago Tribune,0.0
Death Notice: MAE SCHUBERT,2008/06/20,0.9493,Chicago Tribune,-0.5994
"Different cases, same link--Chicago's Olympic bid",2008/06/20,0.9531,Chicago Tribune,0.0
U.S. envoys less active in Mideast,2008/06/20,-0.3108,Chicago Tribune,0.3415
City takes aim at ash borer,2008/06/20,-0.9921,Chicago Tribune,-0.1027
Entertainment Briefs,2008/06/20,0.9524,Chicago Tribune,0.4215
Where high fuel prices are driving us,2008/06/20,0.6666,Chicago Tribune,0.0
"Stay classic, planet Earth",2008/06/20,0.961,Chicago Tribune,0.0
A little optimism goes a long way,2008/06/20,0.9975,Chicago Tribune,0.4951
Death Notice: LEO S. PURALEWSKI,2008/06/20,0.8555,Chicago Tribune,-0.5994
"For 2 lost hikers, rescue was right call",2008/06/20,0.7269,Chicago Tribune,0.25
Walk the walk,2008/06/20,0.7469,Chicago Tribune,0.0
Briefing,2008/06/20,-0.818,Chicago Tribune,0.0
Death Notice: WALLACE W. OTTO,2008/06/20,0.7096,Chicago Tribune,-0.5994
Metra short on space as passengers flock to trains,2008/06/20,-0.8817,Chicago Tribune,0.0
Pace of Texas executions revives fairness disputes,2008/06/20,-0.9846,Chicago Tribune,0.128
Putting riders in the driver's seat,2008/06/20,0.9721,Chicago Tribune,0.0
Death Notice: TONY A. GARIGLIANO,2008/06/20,0.9816,Chicago Tribune,-0.5994
What role does architecture serve in houses of worship?,2008/06/20,0.9778,Chicago Tribune,0.296
"House OKs bill that may help Fermilab, Argonne stave off layoffs",2008/06/20,0.5467,Chicago Tribune,0.4019
Death Notice: HELEN F. DUDA,2008/06/20,0.4939,Chicago Tribune,-0.5994
(Letters),2008/06/20,0.9858,Chicago Tribune,0.0
Figures,2008/06/20,0.2617,Chicago Tribune,0.0
Be a ticket master,2008/06/20,-0.7793,Chicago Tribune,0.0
Shell oil field attacked,2008/06/20,-0.8176,Chicago Tribune,-0.4588
Officials to check witness' allegations in R. Kelly case,2008/06/20,-0.9201,Chicago Tribune,0.0
Death Notice: ROBERT G. BOBULA,2008/06/20,0.8885,Chicago Tribune,-0.5994
Death Notice: ROSE G. JIRKA,2008/06/20,0.9001,Chicago Tribune,-0.5994
Shooting stars,2008/06/20,0.5328,Chicago Tribune,0.0
Death Notice: BILL B. GRANT,2008/06/20,0.8979,Chicago Tribune,-0.1697
Community Briefing,2008/06/20,0.9881,Chicago Tribune,0.0
Death Notice: LILLIAN B. ANDERSON,2008/06/20,0.5267,Chicago Tribune,-0.5994
"Oh, Baby",2008/06/20,0.9858,Chicago Tribune,0.0
Bringin' funny back,2008/06/20,0.9971,Chicago Tribune,0.4404
Death Notice: DAWN M. VOSS AL-SHWAYAT,2008/06/20,0.9403,Chicago Tribune,-0.5994
Death Notice: MORRIS L. ROTH,2008/06/20,-0.8316,Chicago Tribune,-0.5994
Death Notice: LORRAINE C. DANHOFF,2008/06/20,0.9893,Chicago Tribune,-0.5994
Death Notice: DOLORES ALEXANDER ROPER,2008/06/20,0.9169,Chicago Tribune,-0.5994
Death Notice: MICHAEL ROSS,2008/06/20,0.8555,Chicago Tribune,-0.5994
"Oh, no. It's commencement time!",2008/06/20,0.548,Chicago Tribune,-0.3595
Thrillist: Dude to-do list,2008/06/20,0.9967,Chicago Tribune,0.0
Death Notice: RANDELL K. RAMLOT,2008/06/20,0.8271,Chicago Tribune,-0.5994
Dog flu strikes in Illinois,2008/06/20,0.9848,Chicago Tribune,-0.6249
Insect invasion,2008/06/20,-0.9209,Chicago Tribune,0.0
Myers' labor of 'Love',2008/06/20,0.998,Chicago Tribune,0.0
"Park Forest woman shot dead in domestic incident, police say",2008/06/20,-0.9676,Chicago Tribune,-0.6486
On this day in history,2008/06/20,0.4939,Chicago Tribune,0.0
Death Notice: EDWARD J. MAHAY SR.,2008/06/20,0.9666,Chicago Tribune,-0.5994
Premium gas sales are tanking,2008/06/20,0.8921,Chicago Tribune,0.0
Death Notice: LILLIAN J. DRZYMKOWSKI,2008/06/20,0.836,Chicago Tribune,-0.5994
Death Notice: ELMER A. and PEARL R. ECKERT,2008/06/20,0.9231,Chicago Tribune,-0.5994
Death Notice: WILLARD E. KNUDSON,2008/06/20,0.2263,Chicago Tribune,-0.5994
Death Notice: VIRGINIA TABAKA,2008/06/20,0.6908,Chicago Tribune,-0.5994
Fast-paised,2008/06/20,0.9136,Chicago Tribune,0.0
Death Notice: ARTHUR GREENMAN,2008/06/20,0.9712,Chicago Tribune,-0.5994
Death Notice: MARSHALL J. RUTTENBERG,2008/06/20,0.9911,Chicago Tribune,-0.5994
"Despite the risk, few buy insurance against floods",2008/06/20,-0.9587,Chicago Tribune,-0.2732
Former TV news anchor arrested on DUI charge,2008/06/20,-0.9513,Chicago Tribune,-0.4767
Death Notice: SOPHIE M. LEGINSKI,2008/06/20,0.7096,Chicago Tribune,-0.5994
"Carpentersville schools grow, but not as expected",2008/06/20,0.9605,Chicago Tribune,0.0
NU law school to offer 2-year program,2008/06/20,0.9106,Chicago Tribune,0.0
Death Notice: JOANN E. TELLERS,2008/06/20,0.8934,Chicago Tribune,-0.5994
From perp to victim,2008/06/20,-0.9523,Chicago Tribune,-0.2732
Death Notice: MARIE E. GLYNN,2008/06/20,0.9081,Chicago Tribune,-0.5994
Woman on Metra train injured in freak accident,2008/06/20,-0.9896,Chicago Tribune,-0.8271
Fortunes rise and fall along Mississippi,2008/06/20,-0.8811,Chicago Tribune,0.0
Death Notice: STELLA E. LANGERT VITAS,2008/06/20,0.8402,Chicago Tribune,-0.5994
Death Notice: JULIA V. NAUSIEDA,2008/06/20,0.9764,Chicago Tribune,-0.5994
Flood Digest,2008/06/20,0.2185,Chicago Tribune,0.0
Highland Park Township High School District 113 gets green gas,2008/06/20,0.6148,Chicago Tribune,0.0
Zimbabwe's neighbors issue rare criticism of Mugabe regime,2008/06/20,-0.8641,Chicago Tribune,-0.4404
Death Notice: JANET LEVIN,2008/06/20,0.7579,Chicago Tribune,-0.5994
Death Notice: GEORGE J. FITZGERALD,2008/06/20,0.743,Chicago Tribune,-0.5994
Great Taste!,2008/06/20,0.9884,Chicago Tribune,0.6588
Death Notice: JOSEPHINE T. DEIKUS,2008/06/20,0.9595,Chicago Tribune,-0.5994
Death Notice: ADELE J. NOVOTNY,2008/06/20,0.2732,Chicago Tribune,-0.5994
Death Notice: SYLVIA KOSLOW,2008/06/20,0.9371,Chicago Tribune,-0.5994
Death Notice: ALBINA R. RUSNAK,2008/06/20,0.7783,Chicago Tribune,-0.5994
"Sox, Cubs fans get ready for Wrigley rumble",2008/06/20,0.9871,Chicago Tribune,0.3612
Death Notice: DOROTHY B. HOPPE,2008/06/20,0.8126,Chicago Tribune,-0.5994
Asian carp's advance to lake seems to have stalled,2008/06/20,-0.7094,Chicago Tribune,-0.2023
Tasha Tudor: 1915 - 2008,2008/06/20,0.8972,Chicago Tribune,0.0
"It's a girl, y'all",2008/06/20,0.0,Chicago Tribune,0.0
Salute to 'Magnificent 7',2008/06/20,0.875,Chicago Tribune,0.5994
Using the Olympics as leverage,2008/06/20,0.9468,Chicago Tribune,0.0
Sentencing is delayed again for Carpentersville Village Board member who hit his wife,2008/06/20,-0.765,Chicago Tribune,-0.3612
Death Notice: VIRGINIA I. FRANZAK,2008/06/20,0.7269,Chicago Tribune,-0.5994
Death Notice: DENNIS R. NYKIEL,2008/06/20,0.6597,Chicago Tribune,-0.5994
"Illegal fireworks from Hoffman Estates store caused house fire, police say",2008/06/20,-0.9136,Chicago Tribune,-0.7184
Supreme Court ruling puts soldiers at great risk,2008/06/20,-0.9985,Chicago Tribune,0.765
Death Notice: EVELYN GODEK,2008/06/20,0.875,Chicago Tribune,-0.5994
R. Kelly witness claim in spotlight,2008/06/20,-0.7533,Chicago Tribune,0.0
Sports Shortstops,2008/06/20,-0.6597,Chicago Tribune,0.0
Death Notice: EDWINA KWIECIEN,2008/06/20,-0.6705,Chicago Tribune,-0.5994
Death Notice: JACQUELINE ANDERSON,2008/06/20,0.7579,Chicago Tribune,-0.5994
Death Notice: WILLIAM SCHEUERLE,2008/06/20,-0.7269,Chicago Tribune,-0.5994
Death Notice: EUGENE P. WOELFLIN,2008/06/20,0.8834,Chicago Tribune,-0.5994
Death Notice: QUEENIE HAVERS,2008/06/20,0.9774,Chicago Tribune,-0.5994
Death Notice: ESTELLE MLOTEK,2008/06/20,0.8689,Chicago Tribune,-0.5994
Death Notice: ANTHONY J. LEONARD,2008/06/20,0.9313,Chicago Tribune,-0.5994
Death Notice: OSCAR H. KUK,2008/06/20,0.2023,Chicago Tribune,-0.5994
Death Notice: CARL S. CAPOSEY,2008/06/20,0.2023,Chicago Tribune,-0.5994
Death Notice: JEAN JANET,2008/06/20,0.296,Chicago Tribune,-0.5994
Dr. Roy Edward Moor: 1924 - 2008,2008/06/20,0.7677,Chicago Tribune,0.0
"Joseph George Planos, Evanston firefighter",2008/06/20,0.9204,Chicago Tribune,0.0
College of DuPage president faces new challenges second time around,2008/06/20,0.836,Chicago Tribune,0.0772
Death Notice: FRANK J. BARTA,2008/06/20,0.9501,Chicago Tribune,-0.5994
Death Notice: ROBERT F. CLAUSEN,2008/06/20,0.7096,Chicago Tribune,-0.5994
Death Notice: LUCIA WALDBART,2008/06/20,0.9442,Chicago Tribune,-0.5994
Death Notice: EDWARD F. STAZAK,2008/06/20,0.8779,Chicago Tribune,-0.5994
Woman gets 6 years in university arson,2008/06/20,-0.9337,Chicago Tribune,0.0
Less graffiti well worth the trouble,2008/06/20,-0.9426,Chicago Tribune,-0.0624
Donaldson Pillsbury: 1940 - 2008,2008/06/20,-0.9423,Chicago Tribune,0.0
Hoffman Estates man charged with assault after standoff,2008/06/20,-0.9584,Chicago Tribune,-0.6808
Death Notice: JOHN E. KATZLER,2008/06/20,0.6369,Chicago Tribune,-0.5994
Metra mashup,2008/06/20,0.0204,Chicago Tribune,0.0
Ronald J. Real: 1937 - 2008,2008/06/20,0.9909,Chicago Tribune,0.0
Pet food stored in filthy conditions seized at Petco hub in Joliet,2008/06/20,0.4019,Chicago Tribune,0.0
Holding firm to their faith,2008/06/20,0.9934,Chicago Tribune,0.4215
Death Notice: RONALD E. GRAMZA,2008/06/20,0.9633,Chicago Tribune,-0.5994
DUI suspect charged with contempt of court in Kane County for refusing test,2008/06/20,-0.8934,Chicago Tribune,-0.8591
Death Notice: DOLORES M. REIMER,2008/06/20,0.9524,Chicago Tribune,-0.5994
Glen Ellyn family awaits word on brain surgery after boy hit by line drive at White Sox game,2008/06/20,-0.964,Chicago Tribune,0.0772
"Sex offender wins $57 million lottery, plans to buy house",2008/06/20,0.6124,Chicago Tribune,0.296
Death Notice: LORNA MARIE RAMAKER,2008/06/20,0.2732,Chicago Tribune,-0.5994
Cubs fans stomach a lot as Sox fans wave their flag,2008/06/20,0.8762,Chicago Tribune,0.0
Death Notice: SHERRI BERGER MARZANO,2008/06/20,0.9844,Chicago Tribune,-0.5994
Death Notice: DENNIS S. ROSA,2008/06/20,0.836,Chicago Tribune,-0.5994
The Digit,2008/06/20,0.9517,Chicago Tribune,0.0
"How U.S. levees are built, maintained",2008/06/20,-0.6072,Chicago Tribune,0.0
Death Notice: WILLIAM T. ARMSTRONG JR.,2008/06/20,0.9904,Chicago Tribune,-0.5994
Elburn house built in 1845 moved to a new homestead in LaFox,2008/06/20,0.6004,Chicago Tribune,0.0
Death Notice: IDA SCHULTZ,2008/06/20,0.9287,Chicago Tribune,-0.5994
Walter Jacobson ticketed on DUI,2008/06/20,-0.9423,Chicago Tribune,0.0
2 Do,2008/06/20,0.8519,Chicago Tribune,0.0
Second City 1st pick,2008/06/20,0.7717,Chicago Tribune,0.0
Wade among 5 confirmed for Beijing,2008/06/20,0.8481,Chicago Tribune,0.0
Three Up,2008/06/20,0.4767,Chicago Tribune,0.0
On This Date,2008/06/20,-0.296,Chicago Tribune,0.0
Zambrano's shoulder tempers North Side hoopla,2008/06/20,0.8247,Chicago Tribune,-0.3182
"Rangers 5, Braves 4",2008/06/20,0.0,Chicago Tribune,0.4404
On This Date,2008/06/20,0.2837,Chicago Tribune,0.0
"D'backs 2, A's 1",2008/06/20,0.3182,Chicago Tribune,0.0
"Yankees 2, Padres 1",2008/06/20,0.5859,Chicago Tribune,0.0
White Sox's Danks to get taste of Sox-Cubs rivalry,2008/06/20,0.9946,Chicago Tribune,0.0
"Rockies 6, Indians 3",2008/06/20,-0.3182,Chicago Tribune,0.0
"Twins 9, Nationals 3",2008/06/20,0.0,Chicago Tribune,0.0
"Brewers 8, Jays 7",2008/06/20,0.0,Chicago Tribune,0.0
The Question,2008/06/20,0.5859,Chicago Tribune,0.0
On This Date,2008/06/20,0.5859,Chicago Tribune,0.0
"Royals 4, Cards 1",2008/06/20,0.0,Chicago Tribune,0.0
"Dodgers 7, Reds 4",2008/06/20,0.2732,Chicago Tribune,0.0
DH playing 1st? Avert your eyes!,2008/06/20,-0.4278,Chicago Tribune,0.1007
Razov keeps his former team in deep slide,2008/06/20,-0.4215,Chicago Tribune,0.0
Irish working in future tense,2008/06/20,0.9966,Chicago Tribune,-0.34
White Sox offense powers sweep of Pirates,2008/06/20,0.8702,Chicago Tribune,-0.25
In Brief,2008/06/20,0.9118,Chicago Tribune,0.0
Around The Horn,2008/06/20,0.6249,Chicago Tribune,0.0
"Arlington Heights gymnast injured, withdraws from trials",2008/06/20,-0.6207,Chicago Tribune,-0.4019
Transactions,2008/06/20,0.4939,Chicago Tribune,0.0
Transactions,2008/06/20,0.8038,Chicago Tribune,0.0
"NBC, Irish wed through 2015",2008/06/20,0.9919,Chicago Tribune,0.0
In Brief,2008/06/20,0.9118,Chicago Tribune,0.0
"Orioles 7, Astros 5",2008/06/20,0.5719,Chicago Tribune,0.0
Derrick Rose sees a good fit with Bulls,2008/06/20,-0.7227,Chicago Tribune,0.6597
Not as easy as it looks,2008/06/20,0.969,Chicago Tribune,0.4404
Cubs swept by Rays,2008/06/20,-0.3791,Chicago Tribune,0.0
Hawks need to wait turn,2008/06/20,0.9916,Chicago Tribune,0.0
Give me 5,2008/06/20,0.8155,Chicago Tribune,0.0
AFL kicking up a notch,2008/06/20,0.4314,Chicago Tribune,0.0
Guillen swap sides? No way,2008/06/20,0.9794,Chicago Tribune,-0.296
Cubs-Sox will be borderline insanity,2008/06/20,0.9765,Chicago Tribune,-0.5719
Oscar De La Hoya,2008/06/20,0.9711,Chicago Tribune,0.0
Giants' Bradshaw jailed for 30 days,2008/06/20,-0.966,Chicago Tribune,-0.4939
Kevin Hart recovering from concussion at Iowa,2008/06/20,-0.2092,Chicago Tribune,0.0
Wally Backman dreams of managing in the majors,2008/06/20,0.9634,Chicago Tribune,0.4019
BTN and Comcast seal deal,2008/06/20,0.981,Chicago Tribune,0.0
100 Years In 100 Games,2008/06/20,0.3818,Chicago Tribune,0.0
"Jay Mariotti rips Ozzie Guillen, Sun-Times colleagues on WTTW",2008/06/20,-0.8987,Chicago Tribune,0.0
"Bears, Tommie Harris agree on new contract",2008/06/20,0.9906,Chicago Tribune,0.3612
