article,pub_date,nltk_score,source,nltk_score_title
Death Notice: MERRILL HOWARD KALIN,2008/06/26,0.9153,Chicago Tribune,-0.5994
"Butcher may be bit player, but he makes cut for feds",2008/06/26,0.6808,Chicago Tribune,-0.3919
Feds probing alleged coverup of air-traffic control errors,2008/06/26,-0.9906,Chicago Tribune,-0.34
Viking ship begins much-needed voyage to restoration,2008/06/26,0.9336,Chicago Tribune,0.0
"Victim in fatal Dolton standoff was beaten, stabbed, shot",2008/06/26,-0.9883,Chicago Tribune,-0.8834
Death Notice: Katherine M. Jaresko-Marcyniuk,2008/06/26,0.9393,Chicago Tribune,-0.5994
Gravestones sink while Des Plaines River rises,2008/06/26,-0.9953,Chicago Tribune,-0.128
Katherine Mary Jaresko-marcyniuk: 1959 - 2008,2008/06/26,0.9642,Chicago Tribune,0.0
Riverside Brookfield High School forum discusses official accused of relationship with staff member,2008/06/26,0.7769,Chicago Tribune,-0.296
Death Notice: CARLOS RAMIREZ JR.,2008/06/26,0.9371,Chicago Tribune,-0.5994
Death Notice: CAROL JEAN SCARDINA,2008/06/26,0.9698,Chicago Tribune,-0.5994
Bigger penalties for false police alarms in Naperville,2008/06/26,-0.9909,Chicago Tribune,-0.2732
Men found guilty in '05 kidnapping of grandmother,2008/06/26,-0.9974,Chicago Tribune,-0.4215
Corrections And Clarifications,2008/06/26,0.0772,Chicago Tribune,0.0
Thursday Shows,2008/06/26,0.0,Chicago Tribune,0.0
Three more years! Three more years!,2008/06/26,0.714,Chicago Tribune,0.0
"Israel's Olmert keeps office, for now",2008/06/26,0.9287,Chicago Tribune,0.0
Elsewhere,2008/06/26,-0.7983,Chicago Tribune,0.0
What Others Are Saying,2008/06/26,-0.9491,Chicago Tribune,0.0
Iranian official hardens position,2008/06/26,-0.9382,Chicago Tribune,0.0
"The Digit: 721,000",2008/06/26,-0.128,Chicago Tribune,0.0
Housing rescue stalls in Senate,2008/06/26,0.3182,Chicago Tribune,0.5106
Questions surround draft,2008/06/26,0.7814,Chicago Tribune,0.0
Shortstops,2008/06/26,0.7845,Chicago Tribune,0.0
Nine Lines,2008/06/26,0.4434,Chicago Tribune,0.0
Obama-rama,2008/06/26,0.9001,Chicago Tribune,0.0
Giving it away,2008/06/26,-0.4019,Chicago Tribune,0.34
Wiretap bill poised for passage,2008/06/26,0.0377,Chicago Tribune,0.25
Girl Talk,2008/06/26,0.7845,Chicago Tribune,0.0
Mouth park,2008/06/26,0.9956,Chicago Tribune,0.0
2 Do,2008/06/26,0.5859,Chicago Tribune,0.0
Their lessons taught religiously,2008/06/26,0.965,Chicago Tribune,0.0
Five On Five,2008/06/26,0.9774,Chicago Tribune,0.0
Death Notice: JAMES B. GIBSON,2008/06/26,-0.5106,Chicago Tribune,-0.5994
A good seat is hard to find,2008/06/26,0.7269,Chicago Tribune,0.3612
Wheaton golf club restaurant where 100 fell ill to reopen this week,2008/06/26,-0.7351,Chicago Tribune,-0.4215
Elsewhere,2008/06/26,-0.9676,Chicago Tribune,0.0
Hometown Hits,2008/06/26,0.0,Chicago Tribune,0.0
At The Buzzer,2008/06/26,0.8807,Chicago Tribune,0.0
New lawyer sought for girl held in car chase,2008/06/26,-0.9531,Chicago Tribune,0.0
"Don't go mum on us, Obama",2008/06/26,0.7037,Chicago Tribune,0.0
Pakistan blamed in Karzai attack,2008/06/26,0.5267,Chicago Tribune,-0.7351
Death Notice: MARIE KREMEN,2008/06/26,0.8834,Chicago Tribune,-0.5994
"Negotiators for state, union call in mediator to avert Monday contract deadline",2008/06/26,0.0,Chicago Tribune,-0.1779
Bada bing,2008/06/26,0.25,Chicago Tribune,0.0
5 reasons to go,2008/06/26,0.1187,Chicago Tribune,0.0
House OKs relief on minimum tax,2008/06/26,0.6908,Chicago Tribune,0.4767
More rain raises flood threat along Mississippi,2008/06/26,-0.7783,Chicago Tribune,-0.5267
On this date in history,2008/06/26,0.8885,Chicago Tribune,0.0
"Warm, humid air fuels heavy rains in Missouri",2008/06/26,0.936,Chicago Tribune,0.2263
Mad Man,2008/06/26,-0.979,Chicago Tribune,-0.4939
EPA emissions rule reportedly blocked,2008/06/26,0.7619,Chicago Tribune,-0.2732
"Photographers: John Mayer has a job, OK?",2008/06/26,0.7765,Chicago Tribune,0.4466
43 illegal immigrants arrested in 5-day sweep,2008/06/26,-0.9846,Chicago Tribune,-0.7717
World,2008/06/26,-0.9949,Chicago Tribune,0.0
Death Notice: DOROTHY E. ZANDER,2008/06/26,0.6124,Chicago Tribune,-0.5994
Death Notice: GLADYS E. REID,2008/06/26,0.9633,Chicago Tribune,-0.5994
Keep Spot cool this summer,2008/06/26,0.9581,Chicago Tribune,0.3182
Bank customer helps nab holdup suspects,2008/06/26,0.0772,Chicago Tribune,0.0516
Hospitalized,2008/06/26,-0.0258,Chicago Tribune,0.0
Death Notice: ROBIN E. TROYER,2008/06/26,0.9509,Chicago Tribune,-0.5994
Helping Out,2008/06/26,0.7456,Chicago Tribune,0.296
Release of suspect in bomb case appealed,2008/06/26,-0.2144,Chicago Tribune,-0.6597
Brown's defendant appeals tape decision,2008/06/26,0.1027,Chicago Tribune,0.0
Jackson faults Mbeki: 'Silence is ... betrayal',2008/06/26,0.1948,Chicago Tribune,-0.7845
"Joliet boy, 3, playing with handgun fatally shoots self in head",2008/06/26,-0.9855,Chicago Tribune,-0.5267
Obama: Bitter rivalry behind us,2008/06/26,-0.0525,Chicago Tribune,-0.4215
Death Notice: FRANK J. KUCHTA,2008/06/26,0.9325,Chicago Tribune,-0.5994
Community Briefing,2008/06/26,0.4938,Chicago Tribune,0.0
Death Notice: MAGDALENA KETTERER,2008/06/26,0.9169,Chicago Tribune,-0.5994
What YouTube told Weezer about you,2008/06/26,0.9851,Chicago Tribune,0.0
Death Notice: ETHEL GOLDMAN,2008/06/26,0.9337,Chicago Tribune,-0.5994
Death penalty for child rape rejected,2008/06/26,-0.9957,Chicago Tribune,-0.9423
From The Archives,2008/06/26,-0.743,Chicago Tribune,0.0
Death Notice: RICHARD F. McGUIRE,2008/06/26,0.8402,Chicago Tribune,-0.5994
Outstanding ombre,2008/06/26,0.7959,Chicago Tribune,0.6124
(Letters),2008/06/26,0.9655,Chicago Tribune,0.0
Death Notice: JUNE ANN OTTO,2008/06/26,0.8591,Chicago Tribune,-0.5994
Death Notice: CATHERINE RUTH O'MEARA,2008/06/26,0.9201,Chicago Tribune,-0.5994
Death Notice: JOHN DAVID CHISHOLM,2008/06/26,0.8801,Chicago Tribune,-0.5994
Playing politics with prisoners,2008/06/26,-0.9994,Chicago Tribune,-0.3612
Death Notice: ANNE COONEY,2008/06/26,0.8807,Chicago Tribune,-0.5994
Death Notice: RITA M. MACIKAS,2008/06/26,0.936,Chicago Tribune,-0.5994
Texas judge sets new execution date for killer,2008/06/26,-0.8176,Chicago Tribune,-0.6486
A majority places faith in one another,2008/06/26,0.9786,Chicago Tribune,0.4215
"Winners, losers and 'friends'",2008/06/26,0.9223,Chicago Tribune,-0.0772
Death Notice: MARIE L. PORCELLO,2008/06/26,0.9628,Chicago Tribune,-0.5994
Death Notice: DAVID B. CARPENTER,2008/06/26,0.9648,Chicago Tribune,-0.5994
"Lockport man, 23, dies after his motorcycle crashes into pickup truck in Homer Glen",2008/06/26,-0.8555,Chicago Tribune,0.0
Kenilworth tussles with idea of being placed on the National Register of Historic Places,2008/06/26,0.9365,Chicago Tribune,0.0
Orchestrating a different sound,2008/06/26,0.9538,Chicago Tribune,0.0
Death Notice: RALPH VINCENT NOVAK,2008/06/26,0.4767,Chicago Tribune,-0.5994
Death Notice: EDWARD J. TOMCZYK,2008/06/26,0.9451,Chicago Tribune,-0.5994
School Notes,2008/06/26,0.9702,Chicago Tribune,0.0
Death Notice: JOHN DAVID MORRIS,2008/06/26,-0.128,Chicago Tribune,-0.5994
Death Notice: CLARENCE B. HEINKEL,2008/06/26,0.6124,Chicago Tribune,-0.5994
Death Notice: NATE SOL GRUEN,2008/06/26,-0.4019,Chicago Tribune,-0.5994
Court curbs death penalty,2008/06/26,-0.9995,Chicago Tribune,-0.7845
Death Notice: STEVE POLGAR,2008/06/26,0.8689,Chicago Tribune,-0.5994
Death Notice: VINCENT JOSEPH LOSOLE SR.,2008/06/26,-0.9153,Chicago Tribune,-0.5994
Death Notice: DIANE MIKLAS,2008/06/26,0.5267,Chicago Tribune,-0.5994
Taking aim at Countrywide,2008/06/26,-0.9896,Chicago Tribune,0.0
Marengo dad charged with shooting pellet gun at kids as a game,2008/06/26,-0.7812,Chicago Tribune,-0.4939
Death Notice: RICHARD S. RACEK,2008/06/26,0.765,Chicago Tribune,-0.5994
Chicago schools make gains in hiring better grade of teachers,2008/06/26,0.9668,Chicago Tribune,0.6486
Death Notice: ROBERT MEYER,2008/06/26,-0.9413,Chicago Tribune,-0.5994
Death Notice: MARY ANN PERRY,2008/06/26,0.9666,Chicago Tribune,-0.5994
From funny to 'Fear',2008/06/26,0.7906,Chicago Tribune,0.4404
Death Notice: LORRAINE F. BERRY,2008/06/26,0.9477,Chicago Tribune,-0.5994
Death Notice: JEAN LYNN MARSHALL,2008/06/26,0.7783,Chicago Tribune,-0.5994
Jesuit college seeks to block bar's expansion,2008/06/26,-0.7906,Chicago Tribune,-0.4404
Death Notice: ROBERTA ANN MILLER,2008/06/26,0.9618,Chicago Tribune,-0.5994
Death Notice: SALVATORE DiPRIMA,2008/06/26,0.836,Chicago Tribune,-0.5994
City goes for green in 2016,2008/06/26,0.9925,Chicago Tribune,0.0
Chicago,2008/06/26,0.9738,Chicago Tribune,0.0
Death Notice: MARION R. KLINGBERG,2008/06/26,0.8402,Chicago Tribune,-0.5994
Death Notice: RICHARD S. HAJDUK,2008/06/26,0.9652,Chicago Tribune,-0.5994
"Warming, security linked in report",2008/06/26,-0.128,Chicago Tribune,0.4588
Japan's high-tech thrones are energy down the toilet,2008/06/26,0.9932,Chicago Tribune,0.2732
Politicized justice is not true justice,2008/06/26,-0.259,Chicago Tribune,0.6671
Zimbabwe needs a champion ...,2008/06/26,-0.854,Chicago Tribune,0.5994
Cuba's 1st gay pride parade is scrapped,2008/06/26,0.4767,Chicago Tribune,0.34
Sending mixed smoke signals,2008/06/26,-0.9714,Chicago Tribune,0.0
Here's your 'cue,2008/06/26,0.9441,Chicago Tribune,0.0
Best Bets,2008/06/26,0.9947,Chicago Tribune,0.6369
Death Notice: MARYELLEN BARRETT-MOSIER,2008/06/26,0.9524,Chicago Tribune,-0.5994
"Boating ban to be lifted on Chain, portion of Fox River",2008/06/26,-0.5574,Chicago Tribune,-0.5574
Death Notice: CLARENCE LUSARDI,2008/06/26,0.9705,Chicago Tribune,-0.5994
Death Notice: EDWARD J. MORRISSEY,2008/06/26,0.0772,Chicago Tribune,-0.5994
Driver killed when SUV hits viaduct near Cook County Jail,2008/06/26,-0.8126,Chicago Tribune,-0.6705
Community Briefing,2008/06/26,0.9929,Chicago Tribune,0.0
National Urban League conference returning to Chicago next year,2008/06/26,0.9774,Chicago Tribune,0.0
Now with extra beef,2008/06/26,-0.4325,Chicago Tribune,0.0
Death Notice: ALICE O. BURNETT,2008/06/26,0.4939,Chicago Tribune,-0.5994
Cocoa genome is on the menu,2008/06/26,0.2732,Chicago Tribune,0.0
Death Notice: VINSON BONET,2008/06/26,0.8934,Chicago Tribune,-0.5994
Korean-Americans still getting settled,2008/06/26,0.3103,Chicago Tribune,0.0
Kanye boos,2008/06/26,0.8,Chicago Tribune,0.0
Ask Tom Why,2008/06/26,0.3818,Chicago Tribune,0.0
Death Notice: JAMES C. KIMONT,2008/06/26,0.9169,Chicago Tribune,-0.5994
Freedom to give offense,2008/06/26,-0.6813,Chicago Tribune,0.4939
On The Download,2008/06/26,0.0,Chicago Tribune,0.0
Community Briefing,2008/06/26,0.9371,Chicago Tribune,0.0
R. Kelly fan out of jail,2008/06/26,0.9946,Chicago Tribune,0.3182
Death Notice: BERNARD C. GIERMAK,2008/06/26,0.9565,Chicago Tribune,-0.5994
Death Notice: PATRICIA ANN SCHUBERT,2008/06/26,0.8689,Chicago Tribune,-0.5994
Boy improving after drive-by shooting,2008/06/26,-0.4497,Chicago Tribune,0.4215
Death Notice: MARGARET V. SMITH,2008/06/26,0.765,Chicago Tribune,-0.5994
Death Notice: BERNICE J. HAISCH,2008/06/26,-0.7579,Chicago Tribune,-0.5994
Death Notice: PATRICIA ANN SCOTT,2008/06/26,0.9382,Chicago Tribune,-0.5994
Death Notice: STEVE NEWTON JR,2008/06/26,0.886,Chicago Tribune,-0.5994
Death Notice: SABINE A. CASTEN,2008/06/26,0.9643,Chicago Tribune,-0.5994
Death Notice: VONNE ELLEN BROWN,2008/06/26,0.9889,Chicago Tribune,-0.5994
Death Notice: GARY GENAZZIO,2008/06/26,0.4767,Chicago Tribune,-0.5994
Death Notice: THELMA JOSEPHINE TIMM,2008/06/26,0.9828,Chicago Tribune,-0.5994
Fireworks explode at sub shop on Chicago's West Side,2008/06/26,-0.9201,Chicago Tribune,0.0
Death Notice: JOHN KIEKENAPP,2008/06/26,0.9287,Chicago Tribune,-0.5994
FAA managers under investigation,2008/06/26,-0.9676,Chicago Tribune,0.0
Going green with paranoia,2008/06/26,-0.9557,Chicago Tribune,-0.25
When children are in line of fire,2008/06/26,-0.9968,Chicago Tribune,-0.34
"Underage drinkers often get free alcohol from adults, federal study finds",2008/06/26,-0.9624,Chicago Tribune,0.5106
Death Notice: ELIZABETH C. CALDERONE,2008/06/26,0.8442,Chicago Tribune,-0.5994
Death Notice: LADDIE KUTIL,2008/06/26,0.8442,Chicago Tribune,-0.5994
Death Notice: ARNOLD J. NELSON,2008/06/26,0.8555,Chicago Tribune,-0.5994
High-tech testing for war vets with post-traumatic stress disorder,2008/06/26,-0.9925,Chicago Tribune,-0.8555
Death Notice: TILLIE LAPKA,2008/06/26,0.9545,Chicago Tribune,-0.5994
Death Notice: ROBERT FRANCIS LONZE,2008/06/26,0.9233,Chicago Tribune,-0.5994
Shedding possessions sharpened focus,2008/06/26,0.7218,Chicago Tribune,0.0
Death Notice: MARJORIE ZEGLIN TOWERS,2008/06/26,0.1027,Chicago Tribune,-0.5994
Eyeing the guys,2008/06/26,0.8955,Chicago Tribune,0.0
Death Notice: FREDERICK J. LEONARD,2008/06/26,-0.228,Chicago Tribune,-0.5994
Death Notice: PATRICIA M. CASICA,2008/06/26,0.891,Chicago Tribune,-0.5994
Death Notice: LeROY M. CORRADINO,2008/06/26,0.9846,Chicago Tribune,-0.5994
Death Notice: HELEN FREYMAN,2008/06/26,-0.6249,Chicago Tribune,-0.5994
Death Notice: JAMES J. HEFFERNAN,2008/06/26,0.9451,Chicago Tribune,-0.5994
Daley friend buys controversial Bubbly Creek property,2008/06/26,0.765,Chicago Tribune,0.34
Chicago budget director may owe more for office shower,2008/06/26,-0.8074,Chicago Tribune,0.0
Some Chicago-area homeowners turning to chemicals in fight against emerald ash borer,2008/06/26,-0.8479,Chicago Tribune,-0.4588
Death Notice: ETHEL B. THROM,2008/06/26,0.9062,Chicago Tribune,-0.5994
Death Notice: KAREN L. HOVORKA,2008/06/26,0.9451,Chicago Tribune,-0.5994
Death Notice: ROBERT C. BLEMASTER,2008/06/26,0.5267,Chicago Tribune,-0.5994
"South Side restaurant employee shot in robbery, police say",2008/06/26,-0.5719,Chicago Tribune,0.0
Death Notice: PERCY ADDISON WOOD,2008/06/26,0.886,Chicago Tribune,-0.5994
Death Notice: HARRY J. JEZIORSKI,2008/06/26,0.9153,Chicago Tribune,-0.5994
R. Kelly fan finally free after 34 days,2008/06/26,0.9896,Chicago Tribune,0.6808
Punishment payout slashed by 80%,2008/06/26,-0.9964,Chicago Tribune,-0.6249
Death Notice: BONNIE MACDOUGALL,2008/06/26,0.8779,Chicago Tribune,-0.5994
Death Notice: MARVIN H. BROODERSON,2008/06/26,0.9382,Chicago Tribune,-0.5994
Motorcyclist killed on Bishop Ford,2008/06/26,-0.4883,Chicago Tribune,-0.6705
Death Notice: SISTER MARY RAPHAEL KNESS,2008/06/26,0.7906,Chicago Tribune,-0.5994
School Notes,2008/06/26,0.8555,Chicago Tribune,0.0
Death Notice: PHILIP ROOTBERG,2008/06/26,0.872,Chicago Tribune,-0.5994
Death Notice: WILMA KIRWAN,2008/06/26,0.34,Chicago Tribune,-0.5994
Man fatally shot in West Englewood,2008/06/26,-0.8402,Chicago Tribune,-0.6369
Death Notice: HAROLD J. CARLSON,2008/06/26,0.9501,Chicago Tribune,-0.5994
Kabul blames Pakistan in Karzai attack,2008/06/26,0.5267,Chicago Tribune,-0.7003
Rotavirus oral vaccine puts cases at new low,2008/06/26,0.2854,Chicago Tribune,-0.2732
Death Notice: JOSEPHINE D. DuTEMPLE,2008/06/26,0.8885,Chicago Tribune,-0.5994
Man gets 78-month sentence in tax case,2008/06/26,-0.91,Chicago Tribune,0.0772
Glen Ellyn boy hit by batted ball before White Sox game won't need surgery,2008/06/26,-0.9186,Chicago Tribune,0.0
Helping Out,2008/06/26,0.991,Chicago Tribune,0.296
Death Notice: DR. RICHARD J. SASSETTI,2008/06/26,0.93,Chicago Tribune,-0.5994
Death Notice: EDWARD K. OLENDZKI,2008/06/26,0.886,Chicago Tribune,-0.5994
"Pride Parade not just about partying, floats",2008/06/26,0.9877,Chicago Tribune,0.0557
"Number of homeless over age 50 rising, study finds",2008/06/26,0.8646,Chicago Tribune,0.0772
Death Notice: JANE ANN JANETZKE,2008/06/26,-0.3818,Chicago Tribune,-0.5994
Femme Fatale,2008/06/26,0.9909,Chicago Tribune,0.0
Death Notice: GERALD E. MURRAY,2008/06/26,0.9559,Chicago Tribune,-0.5994
Avoid out-of-country blunders,2008/06/26,-0.6754,Chicago Tribune,-0.296
Death Notice: VONDA J. GENOVESI,2008/06/26,0.5106,Chicago Tribune,-0.5994
Mexico to send drug lord to U.S.,2008/06/26,0.6249,Chicago Tribune,0.0
Death Notice: MARY ELIZABETH VANDERLAAN,2008/06/26,0.9967,Chicago Tribune,-0.5994
Death Notice: DAVID WILLIAM ALFARO SR.,2008/06/26,0.9337,Chicago Tribune,-0.5994
Mp3 sound quality gets a boost,2008/06/26,0.9627,Chicago Tribune,0.4019
Death Notice: THOMAS P. ARKENBERG,2008/06/26,0.836,Chicago Tribune,-0.5994
Death Notice: LEONA M. RUBINKOWSKI,2008/06/26,0.891,Chicago Tribune,-0.5994
6 dead after plant rampage,2008/06/26,-0.8699,Chicago Tribune,-0.6486
An ancient city reborn,2008/06/26,0.9907,Chicago Tribune,0.0
18-year-old's body found in Fox River at Yorkville dam,2008/06/26,0.8917,Chicago Tribune,0.0
Death Notice: PETER M. BOCHNEWYCH,2008/06/26,0.9118,Chicago Tribune,-0.5994
Dr. Marian Tolpin: 1925 - 2008,2008/06/26,0.907,Chicago Tribune,0.0
Meeting set on Depakote label,2008/06/26,0.9278,Chicago Tribune,0.0
United Airlines to halt flights to 2 Florida cities,2008/06/26,0.9595,Chicago Tribune,0.4215
Market movers,2008/06/26,0.967,Chicago Tribune,0.0
Inaction speaks to uncharted territory,2008/06/26,0.917,Chicago Tribune,-0.25
"Volvo to eliminate 2,000 workers",2008/06/26,-0.09,Chicago Tribune,0.0
GAO: Boeing had shot at win,2008/06/26,0.9596,Chicago Tribune,0.5859
Chicago's Olympic bid going for the green,2008/06/26,0.9898,Chicago Tribune,0.0
American cutting at O'Hare,2008/06/26,0.4767,Chicago Tribune,-0.128
"ILFC to buy 300 jets from Boeing, Airbus",2008/06/26,-0.2023,Chicago Tribune,0.0
Tribune Co. puts tower on the block,2008/06/26,0.9386,Chicago Tribune,-0.4404
'Ball Girl' scores buzz for Gatorade,2008/06/26,0.9858,Chicago Tribune,0.0
Wholesale distributor pleads guilty to wire fraud in salad dressing scheme,2008/06/26,-0.9887,Chicago Tribune,-0.765
Building is far more than a headquarters,2008/06/26,0.9868,Chicago Tribune,0.0
Become an aerial artist at Aloft Loft,2008/06/26,0.9688,Chicago Tribune,0.0
Pride parade: Where to watch,2008/06/26,0.9469,Chicago Tribune,0.34
Great American Backyard Campout,2008/06/26,0.6136,Chicago Tribune,0.6249
Pete Wentz opens nightspot in Chicago,2008/06/26,0.9969,Chicago Tribune,0.0
Taste to your taste,2008/06/26,0.9761,Chicago Tribune,0.0
I love / I hate,2008/06/26,0.8504,Chicago Tribune,0.128
Great American Backyard Campout,2008/06/26,0.7906,Chicago Tribune,0.6249
Will these women trade in their cute summer shoes ...,2008/06/26,0.9641,Chicago Tribune,0.4588
Margarita Inn works old-world charm,2008/06/26,0.988,Chicago Tribune,0.4019
This No. 1 pick never had a chance,2008/06/26,-0.7041,Chicago Tribune,-0.4479
Local college players aspire for professional basketball jobs,2008/06/26,0.9682,Chicago Tribune,0.0
"Yankees 10, Pirates 0",2008/06/26,0.0,Chicago Tribune,0.0
Banned Gatlin to file another appeal,2008/06/26,-0.4404,Chicago Tribune,-0.4588
Lecavalier scores $77 million deal,2008/06/26,0.4215,Chicago Tribune,0.0
"Rays 15, Marlins 3",2008/06/26,-0.3182,Chicago Tribune,0.0
"Reds 6, Blue Jays 5",2008/06/26,0.0,Chicago Tribune,0.0
"Red Sox 5, D'backs 0",2008/06/26,0.0,Chicago Tribune,0.0
"Nationals 5, Angels 4",2008/06/26,-0.3818,Chicago Tribune,0.0
"Phillies-Athletics, late",2008/06/26,0.2263,Chicago Tribune,0.0
"A wise 18, Wie living in the now",2008/06/26,-0.7641,Chicago Tribune,0.4767
"Cubs defeat Orioles, 7-4",2008/06/26,0.8113,Chicago Tribune,-0.4588
"Royals 4, Rockies 2",2008/06/26,0.5106,Chicago Tribune,0.0
"Giants, Snee agree to extension",2008/06/26,0.6486,Chicago Tribune,0.3612
Germany tops Turkey 3-2,2008/06/26,0.7964,Chicago Tribune,0.5106
"Braves 4, Brewers 2",2008/06/26,0.6486,Chicago Tribune,0.4404
"Giants 4, Indians 1",2008/06/26,0.5859,Chicago Tribune,0.0
Aiming to regain control,2008/06/26,0.7843,Chicago Tribune,0.0
"Rangers 3, Astros 2",2008/06/26,0.0,Chicago Tribune,0.0
"Cardinals-Tigers, late",2008/06/26,-0.3182,Chicago Tribune,0.0
"Twins-Padres, late",2008/06/26,0.7184,Chicago Tribune,0.0
"In upset, Safin turns back clock",2008/06/26,0.9702,Chicago Tribune,-0.3818
Transactions,2008/06/26,-0.6705,Chicago Tribune,0.0
In Brief,2008/06/26,-0.164,Chicago Tribune,0.0
Around The Horn,2008/06/26,0.9604,Chicago Tribune,0.0
No joke: Home-grown Rose is destined to blossom here,2008/06/26,0.9948,Chicago Tribune,0.0
"Mets 8, Mariners 2",2008/06/26,-0.4707,Chicago Tribune,0.0
White Sox's Thome trying to stay sharp,2008/06/26,0.9778,Chicago Tribune,0.0
Big Brown trainer facing suspension,2008/06/26,0.6369,Chicago Tribune,0.0
Draft resembles guard-forward debate of 1981,2008/06/26,0.9886,Chicago Tribune,0.0
Big Ten Network goes behind scenes with Illinois,2008/06/26,0.9423,Chicago Tribune,0.0
"Cubs defeat Orioles, 7-4",2008/06/26,0.2251,Chicago Tribune,-0.4588
Time up for Bulls' choice,2008/06/26,0.9886,Chicago Tribune,0.0
DVD releases,2008/06/26,0.0,Chicago Tribune,0.0
Treasured Mexican sites can't be in ad,2008/06/26,0.904,Chicago Tribune,0.5574
Shows to watch,2008/06/26,-0.9555,Chicago Tribune,0.0
Metal artist forges mythic works,2008/06/26,0.9864,Chicago Tribune,0.0
ABC News takes cameras inside 'Hopkins',2008/06/26,-0.4951,Chicago Tribune,0.0
A water show with no H2O,2008/06/26,-0.9796,Chicago Tribune,-0.296
MacArthur top job: No college president pedigree required,2008/06/26,0.9964,Chicago Tribune,-0.1027
Raw energy trumps refinement in 'Aida',2008/06/26,0.9983,Chicago Tribune,0.2732
Giffin's new novel a good summer read,2008/06/26,0.9595,Chicago Tribune,0.6369
Teens' responses show profound lack of respect,2008/06/26,0.9705,Chicago Tribune,0.2023
Newlyweds' gift complaints unseemly,2008/06/26,0.97,Chicago Tribune,0.0516
The Phair sex barely awake in 'Guyville',2008/06/26,-0.1491,Chicago Tribune,0.0
Movies,2008/06/26,0.8779,Chicago Tribune,0.0
Meddling relatives can produce toxic nuptials,2008/06/26,0.5138,Chicago Tribune,0.0
