article,pub_date,nltk_score,source,nltk_score_title
Report Calls Alhurra a Failure,2008/12/11,0.9827,ProPublica,-0.5106
Transit Tax Shelter Deals Could Be Saved by Auto Bailout Bill,2008/12/11,0.8937,ProPublica,0.34
EPA’s Midnight Reg About Face Explained—Sort Of,2008/12/11,0.9137,ProPublica,0.0
"Taxpayer Cash in Hand, Citigroup Keeps Lobbying",2008/12/11,0.9258,ProPublica,0.4404
About Face! EPA Takes Two Rules Off the Table,2008/12/11,0.8327,ProPublica,0.0
Auto Bailout Unconstitutional?,2008/12/11,0.4274,ProPublica,-0.1027
