article,pub_date,nltk_score,source,nltk_score_title
La Jornada: Sobrecargos prorrogan emplazamiento a huelga contra Mexicana de Aviación,2010-09-14,-0.0516,Jornada,0.0516
La Jornada: Logra la SCT resolución para no pagar a Unefon,2010-09-14,-0.4215,Jornada,0.0762
La Jornada: OCDE: probable desaceleración en países desarrollados,2010-09-14,0.0,Jornada,0.0
"La Jornada: México, ¿en picada lenta?",2010-09-14,-0.9584,Jornada,0.0
La Jornada: Cierra la BMV 16 y 17; los bancos no darán servicio esos días,2010-09-14,0.25,Jornada,0.0
"La Jornada: El mercado laboral, en situación desesperada, advierte el FMI",2010-09-14,-0.969,Jornada,-0.4019
"La Jornada: Se deben crear empleos, pero de calidad: OIT",2010-09-14,-0.9545,Jornada,0.128
La Jornada: Alivio en mundo financiero con las nuevas normas de Basilea,2010-09-14,-0.2732,Jornada,0.4767
La Jornada: Bancomer no cumple con transparencia en contratos de cuenta de depósito con tarjeta,2010-09-14,-0.6124,Jornada,0.0
La Jornada: Estragos económicos en comercios del AICM,2010-09-14,0.25,Jornada,0.0
"La Jornada: México, con capitalización adecuada",2010-09-14,0.4939,Jornada,0.2263
"La Jornada: Según el presupuesto, el crecimiento será claramente insuficiente en 2011: Invex",2010-09-14,-0.2023,Jornada,0.6486
La Jornada: Geithner impulsa en EU un paquete de estímulos,2010-09-14,0.4019,Jornada,0.0
La Jornada: Sarkozy ordenó desmantelar campamentos ilegales y en primer lugar los de gitanos,2010-09-14,-0.6908,Jornada,-0.5574
La Jornada: Le Monde demandará al Estado francés por violar ley sobre confidencialidad de fuentes periodísticas,2010-09-14,-0.7351,Jornada,-0.5423
La Jornada: Ex jefes de DEA piden no legalizar mariguana,2010-09-14,0.0,Jornada,0.0
La Jornada: Policía mata a 13 personas en India,2010-09-14,0.0,Jornada,-0.5423
La Jornada: Las FARC pudieron violar derechos: ONU,2010-09-14,0.4767,Jornada,-0.4939
La Jornada: Condenan a ex jefe de ETA a 83 años de cárcel,2010-09-14,-0.802,Jornada,-0.5267
La Jornada: Arranca el nuevo modelo cubano con más de medio millón de despidos,2010-09-14,0.6124,Jornada,0.0
La Jornada: Fidel Castro fue citado con exactitud: Goldberg,2010-09-14,-0.5267,Jornada,0.0
La Jornada: Japón pide perdón a ex prisioneros de guerra,2010-09-14,-0.8316,Jornada,-0.6908
La Jornada: Internautas chinos critican al gobierno,2010-09-14,0.5267,Jornada,-0.3818
La Jornada: Se estrella avión de aerolínea venezolana con 51 personas a bordo; mueren 15 y sobreviven 36,2010-09-14,-0.8316,Jornada,-0.5994
La Jornada: Lamenta la AIEA el veto iraní a dos de sus inspectores más experimentados,2010-09-14,-0.5106,Jornada,-0.3612
La Jornada: Reconoce OTAN víctimas civiles,2010-09-14,-0.8271,Jornada,-0.3182
La Jornada: Irán reprocha a Obama no haber condenado la propuesta de quema del Corán en Florida,2010-09-14,-0.5267,Jornada,-0.34
La Jornada: Rechazan en EU a hijos de inmigrantes,2010-09-14,0.34,Jornada,-0.5106
La Jornada: Rechaza Washington informe de AI sobre Irak,2010-09-14,0.0,Jornada,-0.4939
"La Jornada: Al jefe Diego lo abandonaron su familia y amigos, dicen plagiarios",2010-09-14,-0.4939,Jornada,0.4767
La Jornada: Presentan la declaración de la ONU sobre derechos de pueblos indígenas en tzeltal,2010-09-14,0.5106,Jornada,0.0
La Jornada: Cordero comparece hoy en la Cámara de Diputados,2010-09-14,0.3612,Jornada,0.0
"La Jornada: Se adelantó, la sucesión: Beltrones",2010-09-14,-0.2023,Jornada,0.2023
La Jornada: Exige Jacinta Francisco reparación del daño ocasionado por el proceso penal en su contra,2010-09-14,-0.9698,Jornada,-0.765
La Jornada: Ligas entre FARC y cárteles mexicanos,2010-09-14,0.0,Jornada,0.0
La Jornada: Realiza IFE ajustes a fecha de sustitución de credenciales 03,2010-09-14,0.2732,Jornada,0.0
La Jornada: Niega Marina que La Barbie haya ayudado a detener a El Grande,2010-09-14,-0.9423,Jornada,-0.6124
"La Jornada: En 10 años de gobiernos panistas, la SSP federal sextuplicó su presupuesto, reporta la Cámara",2010-09-14,0.6908,Jornada,0.2732
La Jornada: Agreden a balazos a un elemento de la escolta del gobernador de Chihuahua,2010-09-14,-0.9517,Jornada,-0.4767
"La Jornada: A consulta nacional, el plan alternativo de López Obrador",2010-09-14,-0.9349,Jornada,0.0
La Jornada: Tramitará embajada de EU visas de inmigrante,2010-09-14,0.0,Jornada,0.0
"La Jornada: Pese a la violencia, el país tiene mucho que festejar: Ric Birch",2010-09-14,-0.34,Jornada,-0.1027
La Jornada: Arquidiócesis se queja de haber sido marginada de celebración,2010-09-14,-0.8074,Jornada,-0.3818
La Jornada: Vecinos de El Grande cierran con cadenas la casa donde se detuvo al presunto narco,2010-09-14,0.34,Jornada,-0.4767
La Jornada: Hace Calderón llamado a la unidad para enfrentar y superar a enemigos del país,2010-09-14,-0.2732,Jornada,-0.4939
La Jornada: Arriba contingente de invitados extranjeros a fiesta bicentenaria,2010-09-14,0.34,Jornada,0.5423
La Jornada: La reforma legal a la Cámara no será profunda: Ramírez Marín,2010-09-14,-0.6908,Jornada,0.128
La Jornada: Trasladan de Monterrey al DF a cuatro militares que dispararon a una familia,2010-09-14,-0.6124,Jornada,-0.5574
La Jornada: ¿Seguiremos informando?*,2010-09-14,-0.4019,Jornada,0.0
"La Jornada: Megapuente, excesivo y populista, acusa CNTE",2010-09-14,-0.7506,Jornada,-0.34
La Jornada: Dependencias y entidades oficiales deberán ampliar información a ciudadanos,2010-09-14,0.8555,Jornada,0.1779
La Jornada: Realiza la otra campaña bloqueos carreteros en inmediaciones de San Cristóbal de las Casas,2010-09-14,-0.25,Jornada,0.0
La Jornada: Recrean las fuerzas armadas capítulos trascendentes en la historia de México,2010-09-14,-0.0516,Jornada,0.0
"La Jornada: Perredistas, sin acuerdo sobre método para renovar directiva",2010-09-14,-0.2732,Jornada,-0.3875
La Jornada: Soldados que dispararon a una familia en NL deben ser juzgados por instancias civiles,2010-09-14,0.5574,Jornada,-0.5574
La Jornada: Presentan en NL el programa Alianza por la seguridad,2010-09-14,0.8176,Jornada,0.34
La Jornada: El presupuesto de 2011 debe ser el requerido,2010-09-14,0.1779,Jornada,0.0
La Jornada: El modelo neoliberal provoca las distorsiones agropecuarias,2010-09-14,-0.296,Jornada,0.0
La Jornada: Favorecen la desigualdad los subsidios al campo: CIDE,2010-09-14,0.4404,Jornada,0.25
La Jornada: Sueño una mejor universidad en todo; no podemos bajar la guardia,2010-09-14,-0.6705,Jornada,0.5994
La Jornada: Acudirá la ANUIES al Senado para solicitar recursos adicionales al presupuesto asignado,2010-09-14,0.5719,Jornada,0.0
"La Jornada: Fibromialgia, el enemigo silencioso; pasan años antes de un diagnóstico certero: Ssa",2010-09-14,-0.9801,Jornada,-0.5423
"La Jornada: Libres, 22 mineros consignados por los disturbios de Cananea",2010-09-14,0.5106,Jornada,0.0
La Jornada: Cofepris reconoce 9 productos huérfanos,2010-09-14,-0.0258,Jornada,0.0
La Jornada: Demanda el gremio azucarero 20% de aumento salarial en revisión contractual,2010-09-14,0.6728,Jornada,0.2023
La Jornada: Incremento salarial de 4.9% para más de 72 mil empleados del ISSSTE,2010-09-14,0.3612,Jornada,0.3182
"La Jornada: La crisis económica amenaza con elevar casos de cáncer en Europa, alertan expertos",2010-09-14,-0.9451,Jornada,-0.91
"La Jornada: Peligrosa, la reducción de estudios para desarrollar antibióticos, alertan",2010-09-14,-0.8074,Jornada,-0.2263
La Jornada: Se enfrentan padres y empleados del IEEPO,2010-09-14,-0.4404,Jornada,0.0
La Jornada: No se inflan cifras de afectados: Fidel Herrera,2010-09-14,-0.6249,Jornada,0.1139
La Jornada: Humberto Moreira revisa buscar la dirigencia nacional del tricolor,2010-09-14,-0.6597,Jornada,0.0
La Jornada: Chiapas: luchan familias por tarifas justas de luz,2010-09-14,0.0,Jornada,-0.0772
La Jornada: Rechazados de la UAS cumplen 3 días en ayuno,2010-09-14,-0.5719,Jornada,-0.5106
La Jornada: Inician ayuno padres de niños fallecidos en la guardería ABC,2010-09-14,0.5267,Jornada,-0.1027
La Jornada: Chiapas: piloto de Aeroméxico aterriza en aeropuerto equivocado,2010-09-14,-0.296,Jornada,-0.4767
La Jornada: Convergencia acepta candidatura de Aguirre,2010-09-14,0.0,Jornada,0.3182
La Jornada: PRI y aliados acuerdan derogar candidaturas comunes en Edomex,2010-09-14,0.0772,Jornada,0.3612
La Jornada: Alonso Reyes nombra al resto de su gabinete,2010-09-14,0.0,Jornada,0.0
"La Jornada: Mujeres triquis reubican plantón, por fiestas",2010-09-14,0.0,Jornada,0.4019
La Jornada: Confirman suspensión de festejos patrios al menos 13 municipios de tres entidades,2010-09-14,-0.6908,Jornada,0.0
"La Jornada: Persisten lluvias en Tabasco; en 17 municipios, 132 mil damnificados",2010-09-14,0.0,Jornada,-0.1531
La Jornada: AN tiene abanderado propio en Guerrero,2010-09-14,0.0,Jornada,0.0
La Jornada: Riña en Amanalco; 12 heridos y 20 detenidos,2010-09-14,0.0,Jornada,-0.7003
La Jornada: Cancún: crece déficit del ayuntamiento,2010-09-14,-0.296,Jornada,-0.4019
La Jornada: Miles de desposeídos forjaron la independencia: Gómez Álvarez,2010-09-14,-0.9849,Jornada,0.0
La Jornada: Muchas soldaderas terminaron en la miseria y el olvido: Ilse Mayté Murillo,2010-09-14,-0.9393,Jornada,-0.5719
La Jornada: Recuperarán la memoria histórica del exilio y la presencia de Buñuel en México,2010-09-14,0.1779,Jornada,0.0
"La Jornada: Las diferencias abismales nos mantienen en la corte de los ilusos, dice Rosa Beltrán",2010-09-14,0.5719,Jornada,0.0
