article,pub_date,nltk_score,source,nltk_score_title
La Jornada: Familiares de El Barbas reciben restos,2009-12-19,-0.4939,Jornada,0.0
La Jornada: Gobernación se deslinda de las fotos del cadáver de Beltrán Leyva,2009-12-19,0.6486,Jornada,0.0
"La Jornada: Estancada, la nueva ley federal antisecuestros",2009-12-19,0.4588,Jornada,0.0
La Jornada: Aniversario 20 del Programa Paisano,2009-12-19,-0.0516,Jornada,0.0
"La Jornada: No se valora a los maestros, dice Lujambio",2009-12-19,0.5267,Jornada,-0.3412
La Jornada: La SG debe informar qué persigue con un registro de datos personales: IFE,2009-12-19,-0.34,Jornada,0.0
"La Jornada: La política migratoria mexicana, esquizofrénica y limitada, acusan",2009-12-19,-0.0772,Jornada,-0.4019
"La Jornada: Entre Mario Alberto Beltrán, La Barbie y El Lazca está el sucesor de El jefe de jefes",2009-12-19,-0.7506,Jornada,0.2263
La Jornada: Muere capo del cártel del Golfo en enfrentamiento con militares en NL,2009-12-19,-0.836,Jornada,0.0
"La Jornada: Clave, desmembrar las finanzas del narco, dice Jesús Zambrano",2009-12-19,-0.875,Jornada,0.0
"La Jornada: Retrasan en Gobernación la fecha para establecer mesa de diálogo, acusa el SME",2009-12-19,-0.5574,Jornada,-0.5719
La Jornada: Apoyan priístas reducir número de legisladores,2009-12-19,0.1779,Jornada,0.4588
La Jornada: Afirma Rafael Ochoa que la SEP orquesta campaña de desprestigio contra el SNTE,2009-12-19,-0.4939,Jornada,-0.3612
La Jornada: Niega nueva unión de petroleros ser disidencia de la organización sindical,2009-12-19,0.0,Jornada,-0.4215
La Jornada: Exigen diálogo efectivo entre países emisores y receptores de indocumentados,2009-12-19,0.0516,Jornada,0.3818
La Jornada: Defensores de derechos humanos deploran el retorno de Robledo Madrid a la policía,2009-12-19,0.6597,Jornada,0.0772
La Jornada: Emigran jubilados de EU a México para acudir al IMSS,2009-12-19,0.34,Jornada,0.0
La Jornada: Lamenta Gobernación asesinato de niña,2009-12-19,0.0,Jornada,-0.6908
La Jornada: Llama fotógrafo a respetar el valor intrínseco del bosque como espacio vital,2009-12-19,0.7783,Jornada,0.6705
La Jornada: No se negocia devolución de Nefertiti a Egipto,2009-12-19,0.0,Jornada,0.0
La Jornada: Documenta experto la historia de los medios visuales en México antes de los Lumière,2009-12-19,-0.6705,Jornada,0.0
"La Jornada: Rebautizado, el Plan Puebla Panamá está fortalecido, sostiene investigador",2009-12-19,-0.4019,Jornada,0.4215
La Jornada: Los restos de García Lorca no están en Alfacar,2009-12-19,-0.7269,Jornada,0.0
La Jornada: Más del arcón navideño,2009-12-19,0.5574,Jornada,0.0
"La Jornada: Un millón 300 mil personas verán mi ballena, estima Orozco",2009-12-19,-0.4588,Jornada,0.0
La Jornada: Tribunal francés prohíbe a Google digitalizar libros,2009-12-19,-0.5267,Jornada,-0.3182
La Jornada: Pide experto privilegiar lo académico sobre los shows en zonas arqueológicas,2009-12-19,-0.296,Jornada,0.3612
La Jornada: Gana Carso licitación en Atotonilco,2009-12-19,0.0,Jornada,0.5719
"La Jornada: Energéticas, entre las industrias más contaminantes",2009-12-19,0.0,Jornada,0.2732
"La Jornada: La estancia infantil ABC, inhabilitada",2009-12-19,0.0,Jornada,0.0
La Jornada: Aprueban iniciativa de reforma sobre el consumo de combustibles fósiles,2009-12-19,-0.5994,Jornada,0.0
La Jornada: Los padres de niños desplazados de guarderías eliminadas recibirán apoyo,2009-12-19,0.6486,Jornada,0.4019
La Jornada: Fracasa cumbre de Copenhague; 5 países de AL rechazan acuerdo,2009-12-19,0.128,Jornada,-0.3182
La Jornada: México desempeñará un papel central en la próxima cumbre ambiental: Calderón,2009-12-19,0.5423,Jornada,0.34
La Jornada: Coahuila: reducen a menos de la mitad penas de cárcel a 2 militares violadores,2009-12-19,-0.9712,Jornada,-0.7984
La Jornada: Disputa por un predio origina trifulca en comunidad de San Cristóbal de las Casas,2009-12-19,-0.4019,Jornada,-0.6486
La Jornada: Multa al PRI en Sinaloa,2009-12-19,-0.296,Jornada,0.2023
"La Jornada: Nuevo paro laboral en el sector salud de Veracruz; exigen bono anual de $8,400",2009-12-19,-0.128,Jornada,0.5423
La Jornada: Popolucas demandan lotes para vivendas,2009-12-19,0.0,Jornada,0.0
La Jornada: Aprueban en Chiapas ley regresiva sobre el aborto; impone tratamiento sicológico,2009-12-19,-0.2263,Jornada,-0.1027
La Jornada: Ediles priístas cobran aguinaldos de $100 mil en Edomex con apenas 4 meses de funciones,2009-12-19,0.3182,Jornada,0.4588
"La Jornada: Ex jefe de bomberos de Hermosillo, libre",2009-12-19,-0.6597,Jornada,0.2263
"La Jornada: Al hospital, 2 obreros de Pemex en Salina Cruz",2009-12-19,0.0,Jornada,0.0
La Jornada: Panistas de Guanajuato incumplen obligación,2009-12-19,0.0772,Jornada,0.0
"La Jornada: Otorgan amparo que impide a minera detonar explosivos en el Cerro de San Pedro, SLP",2009-12-19,-0.2263,Jornada,0.4215
La Jornada: Familiares de menor fallecido acusan de negligencia a hospital de Zitácuaro,2009-12-19,-0.296,Jornada,-0.296
"La Jornada: Paralizado por tormentas de nieve, el tráfico aéreo en Gran Bretaña, Francia y Bélgica",2009-12-19,-0.9022,Jornada,0.0
La Jornada: Soldados iraníes se apoderaron de yacimiento petrolero iraquí: Bagdad,2009-12-19,-0.8271,Jornada,0.0
La Jornada: Declaraciones de enviado de Obama tensan las relaciones con Argentina,2009-12-19,-0.0258,Jornada,0.0
La Jornada: Nuevo proceso contra Chirac por corrupción,2009-12-19,-0.6486,Jornada,-0.2263
La Jornada: EU ataca bastión talibán en Pakistán,2009-12-19,-0.6486,Jornada,-0.34
La Jornada: Holanda rechaza las acusaciones de Chávez,2009-12-19,0.0,Jornada,-0.6705
La Jornada: Roban la placa de entrada a Auschwitz,2009-12-19,-0.0258,Jornada,-0.4939
La Jornada: Conmueve al conservador Texas la elección de Anisse Parker a la alcaldía de Houston,2009-12-19,-0.7783,Jornada,0.0
"La Jornada: Rusia y EU, bastante cerca de alcanzar acuerdo sobre desarme nuclear: Obama",2009-12-19,0.6705,Jornada,0.5106
La Jornada: La activista Aminatu Haidar anuncia que seguirá con su lucha hasta el final,2009-12-19,-0.4019,Jornada,-0.3818
"La Jornada: México no perdió trabajos, según Ruiz Mateos",2009-12-19,-0.4588,Jornada,0.3089
"La Jornada: Menor poder de compra y mayor inflación, pronósticos para 2010",2009-12-19,-0.6808,Jornada,-0.296
La Jornada: Cayó 7.1% el empleo en el sector manufacturero en octubre: Inegi,2009-12-19,0.0,Jornada,0.0
"La Jornada: La italiana Telecinco compra Cuatro, canal de tv abierta de Prisa",2009-12-19,0.0,Jornada,0.0
"La Jornada: Una burla a los trabajadores, el aumento de 4.85% a salarios mínimos: PRD y PT",2009-12-19,-0.7184,Jornada,0.0
La Jornada: Se fusionan 4 bancos intervenidos en Venezuela,2009-12-19,0.3182,Jornada,0.0
La Jornada: Se agrava en Ecuador crisis de electricidad,2009-12-19,0.6597,Jornada,-0.802
La Jornada: Determina tribunal de París que Google viola derechos de autor,2009-12-19,0.0,Jornada,-0.5106
